    1  18:25:37.639517 80:1f:02:ff:ca:5d (oui Unknown) > 74:d4:35:ec:64:73 (oui Unknown), ethertype IPv4 (0x0800), length 118: 172.23.15.73.49186 > legolas.ssh: Flags [P.], seq 2261879440:2261879504, ack 2925882128, win 510, length 64
    2  18:25:37.640141 74:d4:35:ec:64:73 (oui Unknown) > 80:1f:02:ff:ca:5d (oui Unknown), ethertype IPv4 (0x0800), length 118: legolas.ssh > 172.23.15.73.49186: Flags [P.], seq 1:65, ack 64, win 5707, length 64
    3  18:25:37.640871 74:d4:35:ec:64:73 (oui Unknown) > 80:1f:02:ff:ca:5d (oui Unknown), ethertype IPv4 (0x0800), length 646: legolas.ssh > 172.23.15.73.49186: Flags [P.], seq 65:657, ack 64, win 5707, length 592
    4  18:25:37.644983 80:1f:02:ff:ca:5d (oui Unknown) > 74:d4:35:ec:64:73 (oui Unknown), ethertype IPv4 (0x0800), length 118: 172.23.15.73.49186 > legolas.ssh: Flags [P.], seq 64:128, ack 65, win 510, length 64
    5  18:25:37.648525 80:1f:02:ff:ca:5d (oui Unknown) > 74:d4:35:ec:64:73 (oui Unknown), ethertype IPv4 (0x0800), length 118: 172.23.15.73.49186 > legolas.ssh: Flags [P.], seq 128:192, ack 657, win 507, length 64
    6  18:25:37.648596 74:d4:35:ec:64:73 (oui Unknown) > 80:1f:02:ff:ca:5d (oui Unknown), ethertype IPv4 (0x0800), length 54: legolas.ssh > 172.23.15.73.49186: Flags [.], ack 192, win 5707, length 0
    7  18:25:37.672146 74:d4:35:ec:64:73 (oui Unknown) > 80:1f:02:ff:ca:5d (oui Unknown), ethertype IPv4 (0x0800), length 790: legolas.ssh > 172.23.15.73.49186: Flags [P.], seq 657:1393, ack 192, win 5707, length 736
    8  18:25:37.681587 80:1f:02:ff:ca:5d (oui Unknown) > 74:d4:35:ec:64:73 (oui Unknown), ethertype IPv4 (0x0800), length 118: 172.23.15.73.49186 > legolas.ssh: Flags [P.], seq 192:256, ack 1393, win 512, length 64
    9  18:25:37.687029 80:1f:02:ff:ca:5d (oui Unknown) > 74:d4:35:ec:64:73 (oui Unknown), ethertype IPv4 (0x0800), length 118: 172.23.15.73.49186 > legolas.ssh: Flags [P.], seq 256:320, ack 1393, win 512, length 64
   10  18:25:37.687097 74:d4:35:ec:64:73 (oui Unknown) > 80:1f:02:ff:ca:5d (oui Unknown), ethertype IPv4 (0x0800), length 54: legolas.ssh > 172.23.15.73.49186: Flags [.], ack 320, win 5707, length 0
   11  18:25:37.687283 74:d4:35:ec:64:73 (oui Unknown) > 80:1f:02:ff:ca:5d (oui Unknown), ethertype IPv4 (0x0800), length 102: legolas.ssh > 172.23.15.73.49186: Flags [P.], seq 1393:1441, ack 320, win 5707, length 48
   12  18:25:37.692381 80:1f:02:ff:ca:5d (oui Unknown) > 74:d4:35:ec:64:73 (oui Unknown), ethertype IPv4 (0x0800), length 118: 172.23.15.73.49186 > legolas.ssh: Flags [P.], seq 320:384, ack 1441, win 512, length 64
   13  18:25:37.692969 74:d4:35:ec:64:73 (oui Unknown) > 80:1f:02:ff:ca:5d (oui Unknown), ethertype IPv4 (0x0800), length 118: legolas.ssh > 172.23.15.73.49186: Flags [P.], seq 1441:1505, ack 384, win 5707, length 64
   14  18:25:37.698284 80:1f:02:ff:ca:5d (oui Unknown) > 74:d4:35:ec:64:73 (oui Unknown), ethertype IPv4 (0x0800), length 118: 172.23.15.73.49186 > legolas.ssh: Flags [P.], seq 384:448, ack 1505, win 511, length 64
   15  18:25:37.702201 74:d4:35:ec:64:73 (oui Unknown) > 80:1f:02:ff:ca:5d (oui Unknown), ethertype IPv4 (0x0800), length 118: legolas.ssh > 172.23.15.73.49186: Flags [P.], seq 1505:1569, ack 448, win 5707, length 64
   16  18:25:37.708475 74:d4:35:ec:64:73 (oui Unknown) > 80:1f:02:ff:ca:5d (oui Unknown), ethertype IPv4 (0x0800), length 134: legolas.ssh > 172.23.15.73.49186: Flags [P.], seq 1569:1649, ack 448, win 5707, length 80
   17  18:25:37.708507 80:1f:02:ff:ca:5d (oui Unknown) > 74:d4:35:ec:64:73 (oui Unknown), ethertype IPv4 (0x0800), length 118: 172.23.15.73.49186 > legolas.ssh: Flags [P.], seq 448:512, ack 1569, win 511, length 64
   18  18:25:37.709582 74:d4:35:ec:64:73 (oui Unknown) > 80:1f:02:ff:ca:5d (oui Unknown), ethertype IPv4 (0x0800), length 374: legolas.ssh > 172.23.15.73.49186: Flags [P.], seq 1649:1969, ack 512, win 5707, length 320
   19  18:25:37.709623 74:d4:35:ec:64:73 (oui Unknown) > 80:1f:02:ff:ca:5d (oui Unknown), ethertype IPv4 (0x0800), length 166: legolas.ssh > 172.23.15.73.49186: Flags [P.], seq 1969:2081, ack 512, win 5707, length 112
   20  18:25:37.710339 74:d4:35:ec:64:73 (oui Unknown) > 80:1f:02:ff:ca:5d (oui Unknown), ethertype IPv4 (0x0800), length 182: legolas.ssh > 172.23.15.73.49186: Flags [P.], seq 2081:2209, ack 512, win 5707, length 128
   21  18:25:37.710407 74:d4:35:ec:64:73 (oui Unknown) > 80:1f:02:ff:ca:5d (oui Unknown), ethertype IPv4 (0x0800), length 102: legolas.ssh > 172.23.15.73.49186: Flags [P.], seq 2209:2257, ack 512, win 5707, length 48
   22  18:25:37.711254 74:d4:35:ec:64:73 (oui Unknown) > 80:1f:02:ff:ca:5d (oui Unknown), ethertype IPv4 (0x0800), length 118: legolas.ssh > 172.23.15.73.49186: Flags [P.], seq 2257:2321, ack 512, win 5707, length 64
   23  18:25:37.711343 74:d4:35:ec:64:73 (oui Unknown) > 80:1f:02:ff:ca:5d (oui Unknown), ethertype IPv4 (0x0800), length 102: legolas.ssh > 172.23.15.73.49186: Flags [P.], seq 2321:2369, ack 512, win 5707, length 48
   24  18:25:37.712126 74:d4:35:ec:64:73 (oui Unknown) > 80:1f:02:ff:ca:5d (oui Unknown), ethertype IPv4 (0x0800), length 102: legolas.ssh > 172.23.15.73.49186: Flags [P.], seq 2369:2417, ack 512, win 5707, length 48
   25  18:25:37.712226 74:d4:35:ec:64:73 (oui Unknown) > 80:1f:02:ff:ca:5d (oui Unknown), ethertype IPv4 (0x0800), length 102: legolas.ssh > 172.23.15.73.49186: Flags [P.], seq 2417:2465, ack 512, win 5707, length 48
   26  18:25:37.714370 80:1f:02:ff:ca:5d (oui Unknown) > 74:d4:35:ec:64:73 (oui Unknown), ethertype IPv4 (0x0800), length 60: 172.23.15.73.49186 > legolas.ssh: Flags [.], ack 1969, win 510, length 0
   27  18:25:37.714853 80:1f:02:ff:ca:5d (oui Unknown) > 74:d4:35:ec:64:73 (oui Unknown), ethertype IPv4 (0x0800), length 60: 172.23.15.73.49186 > legolas.ssh: Flags [.], ack 2209, win 509, length 0
   28  18:25:37.715868 80:1f:02:ff:ca:5d (oui Unknown) > 74:d4:35:ec:64:73 (oui Unknown), ethertype IPv4 (0x0800), length 60: 172.23.15.73.49186 > legolas.ssh: Flags [.], ack 2321, win 508, length 0
   29  18:25:37.716113 80:1f:02:ff:ca:5d (oui Unknown) > 74:d4:35:ec:64:73 (oui Unknown), ethertype IPv4 (0x0800), length 60: 172.23.15.73.49186 > legolas.ssh: Flags [.], ack 2417, win 508, length 0
   30  18:25:37.720018 80:1f:02:ff:ca:5d (oui Unknown) > 74:d4:35:ec:64:73 (oui Unknown), ethertype IPv4 (0x0800), length 118: 172.23.15.73.49186 > legolas.ssh: Flags [P.], seq 512:576, ack 2465, win 508, length 64
   31  18:25:37.732783 80:1f:02:ff:ca:5d (oui Unknown) > 74:d4:35:ec:64:73 (oui Unknown), ethertype IPv4 (0x0800), length 118: 172.23.15.73.49186 > legolas.ssh: Flags [P.], seq 576:640, ack 2465, win 508, length 64
   32  18:25:37.732813 74:d4:35:ec:64:73 (oui Unknown) > 80:1f:02:ff:ca:5d (oui Unknown), ethertype IPv4 (0x0800), length 54: legolas.ssh > 172.23.15.73.49186: Flags [.], ack 640, win 5707, length 0
   33  18:25:37.733037 74:d4:35:ec:64:73 (oui Unknown) > 80:1f:02:ff:ca:5d (oui Unknown), ethertype IPv4 (0x0800), length 102: legolas.ssh > 172.23.15.73.49186: Flags [P.], seq 2465:2513, ack 640, win 5707, length 48
   34  18:25:37.739019 80:1f:02:ff:ca:5d (oui Unknown) > 74:d4:35:ec:64:73 (oui Unknown), ethertype IPv4 (0x0800), length 118: 172.23.15.73.49186 > legolas.ssh: Flags [P.], seq 640:704, ack 2513, win 507, length 64
   35  18:25:37.739566 74:d4:35:ec:64:73 (oui Unknown) > 80:1f:02:ff:ca:5d (oui Unknown), ethertype IPv4 (0x0800), length 118: legolas.ssh > 172.23.15.73.49186: Flags [P.], seq 2513:2577, ack 704, win 5707, length 64
   36  18:25:37.745276 80:1f:02:ff:ca:5d (oui Unknown) > 74:d4:35:ec:64:73 (oui Unknown), ethertype IPv4 (0x0800), length 118: 172.23.15.73.49186 > legolas.ssh: Flags [P.], seq 704:768, ack 2577, win 507, length 64
   37  18:25:37.751573 74:d4:35:ec:64:73 (oui Unknown) > 80:1f:02:ff:ca:5d (oui Unknown), ethertype IPv4 (0x0800), length 278: legolas.ssh > 172.23.15.73.49186: Flags [P.], seq 2577:2801, ack 768, win 5707, length 224
   38  18:25:37.757513 80:1f:02:ff:ca:5d (oui Unknown) > 74:d4:35:ec:64:73 (oui Unknown), ethertype IPv4 (0x0800), length 118: 172.23.15.73.49186 > legolas.ssh: Flags [P.], seq 768:832, ack 2801, win 512, length 64
   39  18:25:37.759755 80:1f:02:ff:ca:5d (oui Unknown) > 74:d4:35:ec:64:73 (oui Unknown), ethertype IPv4 (0x0800), length 118: 172.23.15.73.49186 > legolas.ssh: Flags [P.], seq 832:896, ack 2801, win 512, length 64
   40  18:25:37.759787 74:d4:35:ec:64:73 (oui Unknown) > 80:1f:02:ff:ca:5d (oui Unknown), ethertype IPv4 (0x0800), length 54: legolas.ssh > 172.23.15.73.49186: Flags [.], ack 896, win 5707, length 0
   41  18:25:37.759982 74:d4:35:ec:64:73 (oui Unknown) > 80:1f:02:ff:ca:5d (oui Unknown), ethertype IPv4 (0x0800), length 102: legolas.ssh > 172.23.15.73.49186: Flags [P.], seq 2801:2849, ack 896, win 5707, length 48
   42  18:25:37.765961 80:1f:02:ff:ca:5d (oui Unknown) > 74:d4:35:ec:64:73 (oui Unknown), ethertype IPv4 (0x0800), length 118: 172.23.15.73.49186 > legolas.ssh: Flags [P.], seq 896:960, ack 2849, win 512, length 64
   43  18:25:37.766461 74:d4:35:ec:64:73 (oui Unknown) > 80:1f:02:ff:ca:5d (oui Unknown), ethertype IPv4 (0x0800), length 118: legolas.ssh > 172.23.15.73.49186: Flags [P.], seq 2849:2913, ack 960, win 5707, length 64
   44  18:25:37.772408 80:1f:02:ff:ca:5d (oui Unknown) > 74:d4:35:ec:64:73 (oui Unknown), ethertype IPv4 (0x0800), length 118: 172.23.15.73.49186 > legolas.ssh: Flags [P.], seq 960:1024, ack 2913, win 511, length 64
   45  18:25:37.772491 80:1f:02:ff:ca:5d (oui Unknown) > 74:d4:35:ec:64:73 (oui Unknown), ethertype IPv4 (0x0800), length 118: 172.23.15.73.49186 > legolas.ssh: Flags [P.], seq 1024:1088, ack 2913, win 511, length 64
   46  18:25:37.772514 74:d4:35:ec:64:73 (oui Unknown) > 80:1f:02:ff:ca:5d (oui Unknown), ethertype IPv4 (0x0800), length 54: legolas.ssh > 172.23.15.73.49186: Flags [.], ack 1088, win 5707, length 0
   47  18:25:37.776317 74:d4:35:ec:64:73 (oui Unknown) > 80:1f:02:ff:ca:5d (oui Unknown), ethertype IPv4 (0x0800), length 438: legolas.ssh > 172.23.15.73.49186: Flags [P.], seq 2913:3297, ack 1088, win 5707, length 384
   48  18:25:37.784780 80:1f:02:ff:ca:5d (oui Unknown) > 74:d4:35:ec:64:73 (oui Unknown), ethertype IPv4 (0x0800), length 118: 172.23.15.73.49186 > legolas.ssh: Flags [P.], seq 1088:1152, ack 3297, win 510, length 64
   49  18:25:37.798039 74:d4:35:ec:64:73 (oui Unknown) > 80:1f:02:ff:ca:5d (oui Unknown), ethertype IPv4 (0x0800), length 342: legolas.ssh > 172.23.15.73.49186: Flags [P.], seq 3297:3585, ack 1152, win 5707, length 288
   50  18:25:37.804315 80:1f:02:ff:ca:5d (oui Unknown) > 74:d4:35:ec:64:73 (oui Unknown), ethertype IPv4 (0x0800), length 150: 172.23.15.73.49186 > legolas.ssh: Flags [P.], seq 1152:1248, ack 3585, win 509, length 96
   51  18:25:37.804378 74:d4:35:ec:64:73 (oui Unknown) > 80:1f:02:ff:ca:5d (oui Unknown), ethertype IPv4 (0x0800), length 102: legolas.ssh > 172.23.15.73.49186: Flags [P.], seq 3585:3633, ack 1248, win 5707, length 48
   52  18:25:37.807274 80:1f:02:ff:ca:5d (oui Unknown) > 74:d4:35:ec:64:73 (oui Unknown), ethertype IPv4 (0x0800), length 118: 172.23.15.73.49186 > legolas.ssh: Flags [P.], seq 1248:1312, ack 3585, win 509, length 64
   53  18:25:37.850857 74:d4:35:ec:64:73 (oui Unknown) > 80:1f:02:ff:ca:5d (oui Unknown), ethertype IPv4 (0x0800), length 54: legolas.ssh > 172.23.15.73.49186: Flags [.], ack 1312, win 5707, length 0
   54  18:25:37.870422 80:1f:02:ff:ca:5d (oui Unknown) > 74:d4:35:ec:64:73 (oui Unknown), ethertype IPv4 (0x0800), length 60: 172.23.15.73.49186 > legolas.ssh: Flags [.], ack 3633, win 509, length 0
   55  18:25:37.904505 1c:1b:0d:8a:d3:34 (oui Unknown) > Broadcast, ethertype ARP (0x0806), length 60: Request who-has 10.10.0.120 tell hmi, length 46
   56  18:25:38.367299 74:d4:35:ec:64:73 (oui Unknown) > 80:1f:02:ff:ca:5d (oui Unknown), ethertype IPv4 (0x0800), length 326: legolas.ssh > 172.23.15.73.49186: Flags [P.], seq 3633:3905, ack 1312, win 5707, length 272
   57  18:25:38.376319 80:1f:02:ff:ca:5d (oui Unknown) > 74:d4:35:ec:64:73 (oui Unknown), ethertype IPv4 (0x0800), length 118: 172.23.15.73.49186 > legolas.ssh: Flags [P.], seq 1312:1376, ack 3905, win 507, length 64
   58  18:25:38.376330 74:d4:35:ec:64:73 (oui Unknown) > 80:1f:02:ff:ca:5d (oui Unknown), ethertype IPv4 (0x0800), length 54: legolas.ssh > 172.23.15.73.49186: Flags [.], ack 1376, win 5707, length 0
   59  18:25:38.651697 74:d4:35:ec:64:73 (oui Unknown) > 80:1f:02:ff:ca:5d (oui Unknown), ethertype IPv4 (0x0800), length 96: legolas.43226 > ro-dc4.romania.luxoft.com.domain: 15731+ [1au] PTR? 73.15.23.172.in-addr.arpa. (54)
   60  18:25:38.652363 80:1f:02:ff:ca:5d (oui Unknown) > 74:d4:35:ec:64:73 (oui Unknown), ethertype IPv4 (0x0800), length 131: ro-dc4.romania.luxoft.com.domain > legolas.43226: 15731 NXDomain 0/1/1 (89)
   61  18:25:38.652466 74:d4:35:ec:64:73 (oui Unknown) > 80:1f:02:ff:ca:5d (oui Unknown), ethertype IPv4 (0x0800), length 85: legolas.43226 > ro-dc4.romania.luxoft.com.domain: 15731+ PTR? 73.15.23.172.in-addr.arpa. (43)
   62  18:25:38.653003 80:1f:02:ff:ca:5d (oui Unknown) > 74:d4:35:ec:64:73 (oui Unknown), ethertype IPv4 (0x0800), length 120: ro-dc4.romania.luxoft.com.domain > legolas.43226: 15731 NXDomain 0/1/0 (78)
   63  18:25:38.653924 74:d4:35:ec:64:73 (oui Unknown) > 80:1f:02:ff:ca:5d (oui Unknown), ethertype IPv4 (0x0800), length 95: legolas.40495 > ro-dc4.romania.luxoft.com.domain: 25197+ [1au] PTR? 120.0.10.10.in-addr.arpa. (53)
   64  18:25:38.654458 80:1f:02:ff:ca:5d (oui Unknown) > 74:d4:35:ec:64:73 (oui Unknown), ethertype IPv4 (0x0800), length 130: ro-dc4.romania.luxoft.com.domain > legolas.40495: 25197 NXDomain 0/1/1 (88)
   65  18:25:38.654554 74:d4:35:ec:64:73 (oui Unknown) > 80:1f:02:ff:ca:5d (oui Unknown), ethertype IPv4 (0x0800), length 84: legolas.40495 > ro-dc4.romania.luxoft.com.domain: 25197+ PTR? 120.0.10.10.in-addr.arpa. (42)
   66  18:25:38.654896 80:1f:02:ff:ca:5d (oui Unknown) > 74:d4:35:ec:64:73 (oui Unknown), ethertype IPv4 (0x0800), length 119: ro-dc4.romania.luxoft.com.domain > legolas.40495: 25197 NXDomain 0/1/0 (77)
   67  18:25:38.691284 80:1f:02:ff:ca:5d (oui Unknown) > 74:d4:35:ec:64:73 (oui Unknown), ethertype IPv4 (0x0800), length 118: 172.23.15.73.49186 > legolas.ssh: Flags [P.], seq 1376:1440, ack 3905, win 507, length 64
   68  18:25:38.691303 74:d4:35:ec:64:73 (oui Unknown) > 80:1f:02:ff:ca:5d (oui Unknown), ethertype IPv4 (0x0800), length 54: legolas.ssh > 172.23.15.73.49186: Flags [.], ack 1440, win 5707, length 0
   69  18:25:38.691548 74:d4:35:ec:64:73 (oui Unknown) > 80:1f:02:ff:ca:5d (oui Unknown), ethertype IPv4 (0x0800), length 102: legolas.ssh > 172.23.15.73.49186: Flags [P.], seq 3905:3953, ack 1440, win 5707, length 48
   70  18:25:38.698045 80:1f:02:ff:ca:5d (oui Unknown) > 74:d4:35:ec:64:73 (oui Unknown), ethertype IPv4 (0x0800), length 118: 172.23.15.73.49186 > legolas.ssh: Flags [P.], seq 1440:1504, ack 3953, win 507, length 64
   71  18:25:38.698057 74:d4:35:ec:64:73 (oui Unknown) > 80:1f:02:ff:ca:5d (oui Unknown), ethertype IPv4 (0x0800), length 54: legolas.ssh > 172.23.15.73.49186: Flags [.], ack 1504, win 5707, length 0
   72  18:25:38.698638 74:d4:35:ec:64:73 (oui Unknown) > 80:1f:02:ff:ca:5d (oui Unknown), ethertype IPv4 (0x0800), length 118: legolas.ssh > 172.23.15.73.49186: Flags [P.], seq 3953:4017, ack 1504, win 5707, length 64
   73  18:25:38.699142 74:d4:35:ec:64:73 (oui Unknown) > 80:1f:02:ff:ca:5d (oui Unknown), ethertype IPv4 (0x0800), length 262: legolas.ssh > 172.23.15.73.49186: Flags [P.], seq 4017:4225, ack 1504, win 5707, length 208
   74  18:25:38.703524 80:1f:02:ff:ca:5d (oui Unknown) > 74:d4:35:ec:64:73 (oui Unknown), ethertype IPv4 (0x0800), length 118: 172.23.15.73.49186 > legolas.ssh: Flags [P.], seq 1504:1568, ack 4017, win 507, length 64
   75  18:25:38.703524 80:1f:02:ff:ca:5d (oui Unknown) > 74:d4:35:ec:64:73 (oui Unknown), ethertype IPv4 (0x0800), length 60: 172.23.15.73.49186 > legolas.ssh: Flags [.], ack 4225, win 512, length 0
   76  18:25:38.703568 74:d4:35:ec:64:73 (oui Unknown) > 80:1f:02:ff:ca:5d (oui Unknown), ethertype IPv4 (0x0800), length 54: legolas.ssh > 172.23.15.73.49186: Flags [.], ack 1568, win 5707, length 0
   77  18:25:38.706076 80:1f:02:ff:ca:5d (oui Unknown) > 74:d4:35:ec:64:73 (oui Unknown), ethertype IPv4 (0x0800), length 118: 172.23.15.73.49186 > legolas.ssh: Flags [P.], seq 1568:1632, ack 4225, win 512, length 64
   78  18:25:38.706104 74:d4:35:ec:64:73 (oui Unknown) > 80:1f:02:ff:ca:5d (oui Unknown), ethertype IPv4 (0x0800), length 54: legolas.ssh > 172.23.15.73.49186: Flags [.], ack 1632, win 5707, length 0
   79  18:25:38.714272 74:d4:35:ec:64:73 (oui Unknown) > 80:1f:02:ff:ca:5d (oui Unknown), ethertype IPv4 (0x0800), length 134: legolas.ssh > 172.23.15.73.49186: Flags [P.], seq 4225:4305, ack 1632, win 5707, length 80
   80  18:25:38.715122 74:d4:35:ec:64:73 (oui Unknown) > 80:1f:02:ff:ca:5d (oui Unknown), ethertype IPv4 (0x0800), length 150: legolas.ssh > 172.23.15.73.49186: Flags [P.], seq 4305:4401, ack 1632, win 5707, length 96
   81  18:25:38.715975 74:d4:35:ec:64:73 (oui Unknown) > 80:1f:02:ff:ca:5d (oui Unknown), ethertype IPv4 (0x0800), length 182: legolas.ssh > 172.23.15.73.49186: Flags [P.], seq 4401:4529, ack 1632, win 5707, length 128
   82  18:25:38.716051 74:d4:35:ec:64:73 (oui Unknown) > 80:1f:02:ff:ca:5d (oui Unknown), ethertype IPv4 (0x0800), length 102: legolas.ssh > 172.23.15.73.49186: Flags [P.], seq 4529:4577, ack 1632, win 5707, length 48
   83  18:25:38.717086 74:d4:35:ec:64:73 (oui Unknown) > 80:1f:02:ff:ca:5d (oui Unknown), ethertype IPv4 (0x0800), length 134: legolas.ssh > 172.23.15.73.49186: Flags [P.], seq 4577:4657, ack 1632, win 5707, length 80
   84  18:25:38.717188 74:d4:35:ec:64:73 (oui Unknown) > 80:1f:02:ff:ca:5d (oui Unknown), ethertype IPv4 (0x0800), length 102: legolas.ssh > 172.23.15.73.49186: Flags [P.], seq 4657:4705, ack 1632, win 5707, length 48
   85  18:25:38.718043 74:d4:35:ec:64:73 (oui Unknown) > 80:1f:02:ff:ca:5d (oui Unknown), ethertype IPv4 (0x0800), length 102: legolas.ssh > 172.23.15.73.49186: Flags [P.], seq 4705:4753, ack 1632, win 5707, length 48
   86  18:25:38.718150 74:d4:35:ec:64:73 (oui Unknown) > 80:1f:02:ff:ca:5d (oui Unknown), ethertype IPv4 (0x0800), length 102: legolas.ssh > 172.23.15.73.49186: Flags [P.], seq 4753:4801, ack 1632, win 5707, length 48
   87  18:25:38.721894 80:1f:02:ff:ca:5d (oui Unknown) > 74:d4:35:ec:64:73 (oui Unknown), ethertype IPv4 (0x0800), length 60: 172.23.15.73.49186 > legolas.ssh: Flags [.], ack 4577, win 510, length 0
   88  18:25:38.722542 80:1f:02:ff:ca:5d (oui Unknown) > 74:d4:35:ec:64:73 (oui Unknown), ethertype IPv4 (0x0800), length 60: 172.23.15.73.49186 > legolas.ssh: Flags [.], ack 4705, win 510, length 0
   89  18:25:38.722790 80:1f:02:ff:ca:5d (oui Unknown) > 74:d4:35:ec:64:73 (oui Unknown), ethertype IPv4 (0x0800), length 60: 172.23.15.73.49186 > legolas.ssh: Flags [.], ack 4801, win 510, length 0
   90  18:25:38.732337 74:d4:35:ec:64:73 (oui Unknown) > 80:1f:02:ff:ca:5d (oui Unknown), ethertype IPv4 (0x0800), length 278: legolas.ssh > 172.23.15.73.49186: Flags [P.], seq 4801:5025, ack 1632, win 5707, length 224
   91  18:25:38.740599 80:1f:02:ff:ca:5d (oui Unknown) > 74:d4:35:ec:64:73 (oui Unknown), ethertype IPv4 (0x0800), length 118: 172.23.15.73.49186 > legolas.ssh: Flags [P.], seq 1632:1696, ack 5025, win 509, length 64
   92  18:25:38.778769 00:1f:da:5e:d8:01 (oui Unknown) > 01:80:c2:00:00:00 (oui Unknown), 802.3, length 38: LLC, dsap STP (0x42) Individual, ssap STP (0x42) Command, ctrl 0x03: STP 802.1d, Config, Flags [none], bridge-id 8000.00:1f:da:5e:d8:01.8019, length 35
   93  18:25:38.782858 74:d4:35:ec:64:73 (oui Unknown) > 80:1f:02:ff:ca:5d (oui Unknown), ethertype IPv4 (0x0800), length 54: legolas.ssh > 172.23.15.73.49186: Flags [.], ack 1696, win 5707, length 0
   94  18:25:38.839250 80:1f:02:ff:ca:5d (oui Unknown) > 74:d4:35:ec:64:73 (oui Unknown), ethertype IPv4 (0x0800), length 118: 172.23.15.73.49186 > legolas.ssh: Flags [P.], seq 1696:1760, ack 5025, win 509, length 64
   95  18:25:38.839285 74:d4:35:ec:64:73 (oui Unknown) > 80:1f:02:ff:ca:5d (oui Unknown), ethertype IPv4 (0x0800), length 54: legolas.ssh > 172.23.15.73.49186: Flags [.], ack 1760, win 5707, length 0
   96  18:25:38.923168 1c:1b:0d:8a:d3:34 (oui Unknown) > Broadcast, ethertype ARP (0x0806), length 60: Request who-has 10.10.0.120 tell hmi, length 46
   97  18:25:39.300188 74:d4:35:ec:64:73 (oui Unknown) > 80:1f:02:ff:ca:5d (oui Unknown), ethertype IPv4 (0x0800), length 246: legolas.ssh > 172.23.15.73.49186: Flags [P.], seq 5025:5217, ack 1760, win 5707, length 192
   98  18:25:39.308346 80:1f:02:ff:ca:5d (oui Unknown) > 74:d4:35:ec:64:73 (oui Unknown), ethertype IPv4 (0x0800), length 118: 172.23.15.73.49186 > legolas.ssh: Flags [P.], seq 1760:1824, ack 5217, win 508, length 64
   99  18:25:39.308358 74:d4:35:ec:64:73 (oui Unknown) > 80:1f:02:ff:ca:5d (oui Unknown), ethertype IPv4 (0x0800), length 54: legolas.ssh > 172.23.15.73.49186: Flags [.], ack 1824, win 5707, length 0
  100  18:25:39.392261 00:1f:da:5e:d8:01 (oui Unknown) > 01:00:81:00:01:01 (oui Unknown), 802.3, length 19: LLC, dsap SNAP (0xaa) Individual, ssap SNAP (0xaa) Command, ctrl 0x03: oui Nortel Networks SONMP (0x000081), pid Unknown (0x01a1), length 11: 
	0x0000:  aaaa 0300 0081 01a1 c0a8 0101 0001 199f  ................
	0x0010:  0c02 00                                  ...
  101  18:25:39.508048 80:1f:02:ff:ca:5d (oui Unknown) > 74:d4:35:ec:64:73 (oui Unknown), ethertype IPv4 (0x0800), length 118: 172.23.15.73.49186 > legolas.ssh: Flags [P.], seq 1824:1888, ack 5217, win 508, length 64
  102  18:25:39.508054 74:d4:35:ec:64:73 (oui Unknown) > 80:1f:02:ff:ca:5d (oui Unknown), ethertype IPv4 (0x0800), length 54: legolas.ssh > 172.23.15.73.49186: Flags [.], ack 1888, win 5707, length 0
  103  18:25:39.508210 74:d4:35:ec:64:73 (oui Unknown) > 80:1f:02:ff:ca:5d (oui Unknown), ethertype IPv4 (0x0800), length 102: legolas.ssh > 172.23.15.73.49186: Flags [P.], seq 5217:5265, ack 1888, win 5707, length 48
  104  18:25:39.513819 80:1f:02:ff:ca:5d (oui Unknown) > 74:d4:35:ec:64:73 (oui Unknown), ethertype IPv4 (0x0800), length 118: 172.23.15.73.49186 > legolas.ssh: Flags [P.], seq 1888:1952, ack 5265, win 508, length 64
  105  18:25:39.513827 74:d4:35:ec:64:73 (oui Unknown) > 80:1f:02:ff:ca:5d (oui Unknown), ethertype IPv4 (0x0800), length 54: legolas.ssh > 172.23.15.73.49186: Flags [.], ack 1952, win 5707, length 0
  106  18:25:39.514226 74:d4:35:ec:64:73 (oui Unknown) > 80:1f:02:ff:ca:5d (oui Unknown), ethertype IPv4 (0x0800), length 118: legolas.ssh > 172.23.15.73.49186: Flags [P.], seq 5265:5329, ack 1952, win 5707, length 64
  107  18:25:39.514425 74:d4:35:ec:64:73 (oui Unknown) > 80:1f:02:ff:ca:5d (oui Unknown), ethertype IPv4 (0x0800), length 246: legolas.ssh > 172.23.15.73.49186: Flags [P.], seq 5329:5521, ack 1952, win 5707, length 192
  108  18:25:39.518631 80:1f:02:ff:ca:5d (oui Unknown) > 74:d4:35:ec:64:73 (oui Unknown), ethertype IPv4 (0x0800), length 118: 172.23.15.73.49186 > legolas.ssh: Flags [P.], seq 1952:2016, ack 5329, win 507, length 64
  109  18:25:39.518643 74:d4:35:ec:64:73 (oui Unknown) > 80:1f:02:ff:ca:5d (oui Unknown), ethertype IPv4 (0x0800), length 54: legolas.ssh > 172.23.15.73.49186: Flags [.], ack 2016, win 5707, length 0
  110  18:25:39.520789 80:1f:02:ff:ca:5d (oui Unknown) > 74:d4:35:ec:64:73 (oui Unknown), ethertype IPv4 (0x0800), length 118: 172.23.15.73.49186 > legolas.ssh: Flags [P.], seq 2016:2080, ack 5521, win 507, length 64
  111  18:25:39.520797 74:d4:35:ec:64:73 (oui Unknown) > 80:1f:02:ff:ca:5d (oui Unknown), ethertype IPv4 (0x0800), length 54: legolas.ssh > 172.23.15.73.49186: Flags [.], ack 2080, win 5707, length 0
  112  18:25:39.546437 74:d4:35:ec:64:73 (oui Unknown) > 80:1f:02:ff:ca:5d (oui Unknown), ethertype IPv4 (0x0800), length 262: legolas.ssh > 172.23.15.73.49186: Flags [P.], seq 5521:5729, ack 2080, win 5707, length 208
  113  18:25:39.554292 80:1f:02:ff:ca:5d (oui Unknown) > 74:d4:35:ec:64:73 (oui Unknown), ethertype IPv4 (0x0800), length 102: 172.23.15.73.49186 > legolas.ssh: Flags [P.], seq 2080:2128, ack 5729, win 512, length 48
  114  18:25:39.594885 74:d4:35:ec:64:73 (oui Unknown) > 80:1f:02:ff:ca:5d (oui Unknown), ethertype IPv4 (0x0800), length 54: legolas.ssh > 172.23.15.73.49186: Flags [.], ack 2128, win 5707, length 0
  115  18:25:39.640547 80:1f:02:ff:ca:5d (oui Unknown) > 74:d4:35:ec:64:73 (oui Unknown), ethertype IPv4 (0x0800), length 118: 172.23.15.73.49186 > legolas.ssh: Flags [P.], seq 2128:2192, ack 5729, win 512, length 64
  116  18:25:39.640576 74:d4:35:ec:64:73 (oui Unknown) > 80:1f:02:ff:ca:5d (oui Unknown), ethertype IPv4 (0x0800), length 54: legolas.ssh > 172.23.15.73.49186: Flags [.], ack 2192, win 5707, length 0
  117  18:25:39.694609 80:1f:02:ff:ca:5d (oui Unknown) > 74:d4:35:ec:64:73 (oui Unknown), ethertype IPv4 (0x0800), length 118: 172.23.15.73.49186 > legolas.ssh: Flags [P.], seq 2192:2256, ack 5729, win 512, length 64
  118  18:25:39.694632 74:d4:35:ec:64:73 (oui Unknown) > 80:1f:02:ff:ca:5d (oui Unknown), ethertype IPv4 (0x0800), length 54: legolas.ssh > 172.23.15.73.49186: Flags [.], ack 2256, win 5707, length 0
  119  18:25:39.695099 74:d4:35:ec:64:73 (oui Unknown) > 80:1f:02:ff:ca:5d (oui Unknown), ethertype IPv4 (0x0800), length 102: legolas.ssh > 172.23.15.73.49186: Flags [P.], seq 5729:5777, ack 2256, win 5707, length 48
  120  18:25:39.701051 80:1f:02:ff:ca:5d (oui Unknown) > 74:d4:35:ec:64:73 (oui Unknown), ethertype IPv4 (0x0800), length 118: 172.23.15.73.49186 > legolas.ssh: Flags [P.], seq 2256:2320, ack 5777, win 512, length 64
  121  18:25:39.701079 74:d4:35:ec:64:73 (oui Unknown) > 80:1f:02:ff:ca:5d (oui Unknown), ethertype IPv4 (0x0800), length 54: legolas.ssh > 172.23.15.73.49186: Flags [.], ack 2320, win 5707, length 0
  122  18:25:39.702178 74:d4:35:ec:64:73 (oui Unknown) > 80:1f:02:ff:ca:5d (oui Unknown), ethertype IPv4 (0x0800), length 118: legolas.ssh > 172.23.15.73.49186: Flags [P.], seq 5777:5841, ack 2320, win 5707, length 64
  123  18:25:39.707505 80:1f:02:ff:ca:5d (oui Unknown) > 74:d4:35:ec:64:73 (oui Unknown), ethertype IPv4 (0x0800), length 118: 172.23.15.73.49186 > legolas.ssh: Flags [P.], seq 2320:2384, ack 5841, win 511, length 64
  124  18:25:39.707544 74:d4:35:ec:64:73 (oui Unknown) > 80:1f:02:ff:ca:5d (oui Unknown), ethertype IPv4 (0x0800), length 54: legolas.ssh > 172.23.15.73.49186: Flags [.], ack 2384, win 5707, length 0
  125  18:25:39.720329 74:d4:35:ec:64:73 (oui Unknown) > 80:1f:02:ff:ca:5d (oui Unknown), ethertype IPv4 (0x0800), length 118: legolas.ssh > 172.23.15.73.49186: Flags [P.], seq 5841:5905, ack 2384, win 5707, length 64
  126  18:25:39.721183 74:d4:35:ec:64:73 (oui Unknown) > 80:1f:02:ff:ca:5d (oui Unknown), ethertype IPv4 (0x0800), length 134: legolas.ssh > 172.23.15.73.49186: Flags [P.], seq 5905:5985, ack 2384, win 5707, length 80
  127  18:25:39.722039 74:d4:35:ec:64:73 (oui Unknown) > 80:1f:02:ff:ca:5d (oui Unknown), ethertype IPv4 (0x0800), length 166: legolas.ssh > 172.23.15.73.49186: Flags [P.], seq 5985:6097, ack 2384, win 5707, length 112
  128  18:25:39.722123 74:d4:35:ec:64:73 (oui Unknown) > 80:1f:02:ff:ca:5d (oui Unknown), ethertype IPv4 (0x0800), length 102: legolas.ssh > 172.23.15.73.49186: Flags [P.], seq 6097:6145, ack 2384, win 5707, length 48
  129  18:25:39.723041 74:d4:35:ec:64:73 (oui Unknown) > 80:1f:02:ff:ca:5d (oui Unknown), ethertype IPv4 (0x0800), length 134: legolas.ssh > 172.23.15.73.49186: Flags [P.], seq 6145:6225, ack 2384, win 5707, length 80
  130  18:25:39.723140 74:d4:35:ec:64:73 (oui Unknown) > 80:1f:02:ff:ca:5d (oui Unknown), ethertype IPv4 (0x0800), length 102: legolas.ssh > 172.23.15.73.49186: Flags [P.], seq 6225:6273, ack 2384, win 5707, length 48
  131  18:25:39.724004 74:d4:35:ec:64:73 (oui Unknown) > 80:1f:02:ff:ca:5d (oui Unknown), ethertype IPv4 (0x0800), length 102: legolas.ssh > 172.23.15.73.49186: Flags [P.], seq 6273:6321, ack 2384, win 5707, length 48
  132  18:25:39.724112 74:d4:35:ec:64:73 (oui Unknown) > 80:1f:02:ff:ca:5d (oui Unknown), ethertype IPv4 (0x0800), length 102: legolas.ssh > 172.23.15.73.49186: Flags [P.], seq 6321:6369, ack 2384, win 5707, length 48
  133  18:25:39.726494 80:1f:02:ff:ca:5d (oui Unknown) > 74:d4:35:ec:64:73 (oui Unknown), ethertype IPv4 (0x0800), length 60: 172.23.15.73.49186 > legolas.ssh: Flags [.], ack 5985, win 511, length 0
  134  18:25:39.726860 80:1f:02:ff:ca:5d (oui Unknown) > 74:d4:35:ec:64:73 (oui Unknown), ethertype IPv4 (0x0800), length 60: 172.23.15.73.49186 > legolas.ssh: Flags [.], ack 6145, win 510, length 0
  135  18:25:39.727362 80:1f:02:ff:ca:5d (oui Unknown) > 74:d4:35:ec:64:73 (oui Unknown), ethertype IPv4 (0x0800), length 60: 172.23.15.73.49186 > legolas.ssh: Flags [.], ack 6273, win 510, length 0
  136  18:25:39.727762 80:1f:02:ff:ca:5d (oui Unknown) > 74:d4:35:ec:64:73 (oui Unknown), ethertype IPv4 (0x0800), length 60: 172.23.15.73.49186 > legolas.ssh: Flags [.], ack 6369, win 509, length 0
  137  18:25:39.728782 74:d4:35:ec:64:73 (oui Unknown) > 80:1f:02:ff:ca:5d (oui Unknown), ethertype IPv4 (0x0800), length 262: legolas.ssh > 172.23.15.73.49186: Flags [P.], seq 6369:6577, ack 2384, win 5707, length 208
  138  18:25:39.737016 80:1f:02:ff:ca:5d (oui Unknown) > 74:d4:35:ec:64:73 (oui Unknown), ethertype IPv4 (0x0800), length 118: 172.23.15.73.49186 > legolas.ssh: Flags [P.], seq 2384:2448, ack 6577, win 508, length 64
  139  18:25:39.778859 74:d4:35:ec:64:73 (oui Unknown) > 80:1f:02:ff:ca:5d (oui Unknown), ethertype IPv4 (0x0800), length 54: legolas.ssh > 172.23.15.73.49186: Flags [.], ack 2448, win 5707, length 0
  140  18:25:39.779602 80:1f:02:ff:ca:5d (oui Unknown) > 74:d4:35:ec:64:73 (oui Unknown), ethertype IPv4 (0x0800), length 118: 172.23.15.73.49186 > legolas.ssh: Flags [P.], seq 2448:2512, ack 6577, win 508, length 64
  141  18:25:39.779637 74:d4:35:ec:64:73 (oui Unknown) > 80:1f:02:ff:ca:5d (oui Unknown), ethertype IPv4 (0x0800), length 54: legolas.ssh > 172.23.15.73.49186: Flags [.], ack 2512, win 5707, length 0
  142  18:25:39.830341 80:1f:02:ff:ca:5d (oui Unknown) > 74:d4:35:ec:64:73 (oui Unknown), ethertype IPv4 (0x0800), length 118: 172.23.15.73.49186 > legolas.ssh: Flags [P.], seq 2512:2576, ack 6577, win 508, length 64
  143  18:25:39.830376 74:d4:35:ec:64:73 (oui Unknown) > 80:1f:02:ff:ca:5d (oui Unknown), ethertype IPv4 (0x0800), length 54: legolas.ssh > 172.23.15.73.49186: Flags [.], ack 2576, win 5707, length 0
  144  18:25:39.830579 74:d4:35:ec:64:73 (oui Unknown) > 80:1f:02:ff:ca:5d (oui Unknown), ethertype IPv4 (0x0800), length 102: legolas.ssh > 172.23.15.73.49186: Flags [P.], seq 6577:6625, ack 2576, win 5707, length 48
  145  18:25:39.836767 80:1f:02:ff:ca:5d (oui Unknown) > 74:d4:35:ec:64:73 (oui Unknown), ethertype IPv4 (0x0800), length 118: 172.23.15.73.49186 > legolas.ssh: Flags [P.], seq 2576:2640, ack 6625, win 508, length 64
  146  18:25:39.836804 74:d4:35:ec:64:73 (oui Unknown) > 80:1f:02:ff:ca:5d (oui Unknown), ethertype IPv4 (0x0800), length 54: legolas.ssh > 172.23.15.73.49186: Flags [.], ack 2640, win 5707, length 0
  147  18:25:39.837346 74:d4:35:ec:64:73 (oui Unknown) > 80:1f:02:ff:ca:5d (oui Unknown), ethertype IPv4 (0x0800), length 118: legolas.ssh > 172.23.15.73.49186: Flags [P.], seq 6625:6689, ack 2640, win 5707, length 64
  148  18:25:39.843041 80:1f:02:ff:ca:5d (oui Unknown) > 74:d4:35:ec:64:73 (oui Unknown), ethertype IPv4 (0x0800), length 118: 172.23.15.73.49186 > legolas.ssh: Flags [P.], seq 2640:2704, ack 6689, win 508, length 64
  149  18:25:39.843081 74:d4:35:ec:64:73 (oui Unknown) > 80:1f:02:ff:ca:5d (oui Unknown), ethertype IPv4 (0x0800), length 54: legolas.ssh > 172.23.15.73.49186: Flags [.], ack 2704, win 5707, length 0
  150  18:25:39.849312 74:d4:35:ec:64:73 (oui Unknown) > 80:1f:02:ff:ca:5d (oui Unknown), ethertype IPv4 (0x0800), length 262: legolas.ssh > 172.23.15.73.49186: Flags [P.], seq 6689:6897, ack 2704, win 5707, length 208
  151  18:25:39.857544 80:1f:02:ff:ca:5d (oui Unknown) > 74:d4:35:ec:64:73 (oui Unknown), ethertype IPv4 (0x0800), length 118: 172.23.15.73.49186 > legolas.ssh: Flags [P.], seq 2704:2768, ack 6897, win 507, length 64
  152  18:25:39.864301 74:d4:35:ec:64:73 (oui Unknown) > 80:1f:02:ff:ca:5d (oui Unknown), ethertype IPv4 (0x0800), length 438: legolas.ssh > 172.23.15.73.49186: Flags [P.], seq 6897:7281, ack 2768, win 5707, length 384
  153  18:25:39.873531 80:1f:02:ff:ca:5d (oui Unknown) > 74:d4:35:ec:64:73 (oui Unknown), ethertype IPv4 (0x0800), length 118: 172.23.15.73.49186 > legolas.ssh: Flags [P.], seq 2768:2832, ack 7281, win 512, length 64
  154  18:25:39.914855 74:d4:35:ec:64:73 (oui Unknown) > 80:1f:02:ff:ca:5d (oui Unknown), ethertype IPv4 (0x0800), length 54: legolas.ssh > 172.23.15.73.49186: Flags [.], ack 2832, win 5707, length 0
  155  18:25:39.946946 1c:1b:0d:8a:d3:34 (oui Unknown) > Broadcast, ethertype ARP (0x0806), length 60: Request who-has 10.10.0.120 tell hmi, length 46
  156  18:25:39.959117 80:1f:02:ff:ca:5d (oui Unknown) > 74:d4:35:ec:64:73 (oui Unknown), ethertype IPv4 (0x0800), length 118: 172.23.15.73.49186 > legolas.ssh: Flags [P.], seq 2832:2896, ack 7281, win 512, length 64
  157  18:25:39.959150 74:d4:35:ec:64:73 (oui Unknown) > 80:1f:02:ff:ca:5d (oui Unknown), ethertype IPv4 (0x0800), length 54: legolas.ssh > 172.23.15.73.49186: Flags [.], ack 2896, win 5707, length 0
  158  18:25:40.257605 80:1f:02:ff:ca:5d (oui Unknown) > 74:d4:35:ec:64:73 (oui Unknown), ethertype IPv4 (0x0800), length 118: 172.23.15.73.49186 > legolas.ssh: Flags [P.], seq 2896:2960, ack 7281, win 512, length 64
  159  18:25:40.257615 74:d4:35:ec:64:73 (oui Unknown) > 80:1f:02:ff:ca:5d (oui Unknown), ethertype IPv4 (0x0800), length 54: legolas.ssh > 172.23.15.73.49186: Flags [.], ack 2960, win 5707, length 0
  160  18:25:40.257765 74:d4:35:ec:64:73 (oui Unknown) > 80:1f:02:ff:ca:5d (oui Unknown), ethertype IPv4 (0x0800), length 102: legolas.ssh > 172.23.15.73.49186: Flags [P.], seq 7281:7329, ack 2960, win 5707, length 48
  161  18:25:40.263585 80:1f:02:ff:ca:5d (oui Unknown) > 74:d4:35:ec:64:73 (oui Unknown), ethertype IPv4 (0x0800), length 118: 172.23.15.73.49186 > legolas.ssh: Flags [P.], seq 2960:3024, ack 7329, win 512, length 64
  162  18:25:40.263592 74:d4:35:ec:64:73 (oui Unknown) > 80:1f:02:ff:ca:5d (oui Unknown), ethertype IPv4 (0x0800), length 54: legolas.ssh > 172.23.15.73.49186: Flags [.], ack 3024, win 5707, length 0
  163  18:25:40.263958 74:d4:35:ec:64:73 (oui Unknown) > 80:1f:02:ff:ca:5d (oui Unknown), ethertype IPv4 (0x0800), length 118: legolas.ssh > 172.23.15.73.49186: Flags [P.], seq 7329:7393, ack 3024, win 5707, length 64
  164  18:25:40.268487 80:1f:02:ff:ca:5d (oui Unknown) > 74:d4:35:ec:64:73 (oui Unknown), ethertype IPv4 (0x0800), length 118: 172.23.15.73.49186 > legolas.ssh: Flags [P.], seq 3024:3088, ack 7393, win 511, length 64
  165  18:25:40.268497 74:d4:35:ec:64:73 (oui Unknown) > 80:1f:02:ff:ca:5d (oui Unknown), ethertype IPv4 (0x0800), length 54: legolas.ssh > 172.23.15.73.49186: Flags [.], ack 3088, win 5707, length 0
  166  18:25:40.290065 74:d4:35:ec:64:73 (oui Unknown) > 80:1f:02:ff:ca:5d (oui Unknown), ethertype IPv4 (0x0800), length 294: legolas.ssh > 172.23.15.73.49186: Flags [P.], seq 7393:7633, ack 3088, win 5707, length 240
  167  18:25:40.299842 80:1f:02:ff:ca:5d (oui Unknown) > 74:d4:35:ec:64:73 (oui Unknown), ethertype IPv4 (0x0800), length 118: 172.23.15.73.49186 > legolas.ssh: Flags [P.], seq 3088:3152, ack 7633, win 510, length 64
  168  18:25:40.342849 74:d4:35:ec:64:73 (oui Unknown) > 80:1f:02:ff:ca:5d (oui Unknown), ethertype IPv4 (0x0800), length 54: legolas.ssh > 172.23.15.73.49186: Flags [.], ack 3152, win 5707, length 0
  169  18:25:40.412392 80:1f:02:ff:ca:5d (oui Unknown) > 74:d4:35:ec:64:73 (oui Unknown), ethertype IPv4 (0x0800), length 118: 172.23.15.73.49186 > legolas.ssh: Flags [P.], seq 3152:3216, ack 7633, win 510, length 64
  170  18:25:40.412398 74:d4:35:ec:64:73 (oui Unknown) > 80:1f:02:ff:ca:5d (oui Unknown), ethertype IPv4 (0x0800), length 54: legolas.ssh > 172.23.15.73.49186: Flags [.], ack 3216, win 5707, length 0
  171  18:25:40.611318 80:1f:02:ff:ca:5d (oui Unknown) > 74:d4:35:ec:64:73 (oui Unknown), ethertype IPv4 (0x0800), length 118: 172.23.15.73.49186 > legolas.ssh: Flags [P.], seq 3216:3280, ack 7633, win 510, length 64
  172  18:25:40.611361 74:d4:35:ec:64:73 (oui Unknown) > 80:1f:02:ff:ca:5d (oui Unknown), ethertype IPv4 (0x0800), length 54: legolas.ssh > 172.23.15.73.49186: Flags [.], ack 3280, win 5707, length 0
  173  18:25:40.611881 74:d4:35:ec:64:73 (oui Unknown) > 80:1f:02:ff:ca:5d (oui Unknown), ethertype IPv4 (0x0800), length 102: legolas.ssh > 172.23.15.73.49186: Flags [P.], seq 7633:7681, ack 3280, win 5707, length 48
  174  18:25:40.616564 80:1f:02:ff:ca:5d (oui Unknown) > 74:d4:35:ec:64:73 (oui Unknown), ethertype IPv4 (0x0800), length 118: 172.23.15.73.49186 > legolas.ssh: Flags [P.], seq 3280:3344, ack 7681, win 510, length 64
  175  18:25:40.616598 74:d4:35:ec:64:73 (oui Unknown) > 80:1f:02:ff:ca:5d (oui Unknown), ethertype IPv4 (0x0800), length 54: legolas.ssh > 172.23.15.73.49186: Flags [.], ack 3344, win 5707, length 0
  176  18:25:40.617968 74:d4:35:ec:64:73 (oui Unknown) > 80:1f:02:ff:ca:5d (oui Unknown), ethertype IPv4 (0x0800), length 118: legolas.ssh > 172.23.15.73.49186: Flags [P.], seq 7681:7745, ack 3344, win 5707, length 64
  177  18:25:40.623291 80:1f:02:ff:ca:5d (oui Unknown) > 74:d4:35:ec:64:73 (oui Unknown), ethertype IPv4 (0x0800), length 118: 172.23.15.73.49186 > legolas.ssh: Flags [P.], seq 3344:3408, ack 7745, win 510, length 64
  178  18:25:40.623307 74:d4:35:ec:64:73 (oui Unknown) > 80:1f:02:ff:ca:5d (oui Unknown), ethertype IPv4 (0x0800), length 54: legolas.ssh > 172.23.15.73.49186: Flags [.], ack 3408, win 5707, length 0
  179  18:25:40.629981 74:d4:35:ec:64:73 (oui Unknown) > 80:1f:02:ff:ca:5d (oui Unknown), ethertype IPv4 (0x0800), length 262: legolas.ssh > 172.23.15.73.49186: Flags [P.], seq 7745:7953, ack 3408, win 5707, length 208
  180  18:25:40.638078 80:1f:02:ff:ca:5d (oui Unknown) > 74:d4:35:ec:64:73 (oui Unknown), ethertype IPv4 (0x0800), length 118: 172.23.15.73.49186 > legolas.ssh: Flags [P.], seq 3408:3472, ack 7953, win 509, length 64
  181  18:25:40.644834 74:d4:35:ec:64:73 (oui Unknown) > 80:1f:02:ff:ca:5d (oui Unknown), ethertype IPv4 (0x0800), length 486: legolas.ssh > 172.23.15.73.49186: Flags [P.], seq 7953:8385, ack 3472, win 5707, length 432
  182  18:25:40.653281 80:1f:02:ff:ca:5d (oui Unknown) > 74:d4:35:ec:64:73 (oui Unknown), ethertype IPv4 (0x0800), length 118: 172.23.15.73.49186 > legolas.ssh: Flags [P.], seq 3472:3536, ack 8385, win 507, length 64
  183  18:25:40.694856 74:d4:35:ec:64:73 (oui Unknown) > 80:1f:02:ff:ca:5d (oui Unknown), ethertype IPv4 (0x0800), length 54: legolas.ssh > 172.23.15.73.49186: Flags [.], ack 3536, win 5707, length 0
  184  18:25:40.726292 74:d4:35:ec:64:73 (oui Unknown) > 80:1f:02:ff:ca:5d (oui Unknown), ethertype IPv4 (0x0800), length 134: legolas.ssh > 172.23.15.73.49186: Flags [P.], seq 8385:8465, ack 3536, win 5707, length 80
  185  18:25:40.727135 74:d4:35:ec:64:73 (oui Unknown) > 80:1f:02:ff:ca:5d (oui Unknown), ethertype IPv4 (0x0800), length 134: legolas.ssh > 172.23.15.73.49186: Flags [P.], seq 8465:8545, ack 3536, win 5707, length 80
  186  18:25:40.727974 74:d4:35:ec:64:73 (oui Unknown) > 80:1f:02:ff:ca:5d (oui Unknown), ethertype IPv4 (0x0800), length 182: legolas.ssh > 172.23.15.73.49186: Flags [P.], seq 8545:8673, ack 3536, win 5707, length 128
  187  18:25:40.728054 74:d4:35:ec:64:73 (oui Unknown) > 80:1f:02:ff:ca:5d (oui Unknown), ethertype IPv4 (0x0800), length 102: legolas.ssh > 172.23.15.73.49186: Flags [P.], seq 8673:8721, ack 3536, win 5707, length 48
  188  18:25:40.728984 74:d4:35:ec:64:73 (oui Unknown) > 80:1f:02:ff:ca:5d (oui Unknown), ethertype IPv4 (0x0800), length 134: legolas.ssh > 172.23.15.73.49186: Flags [P.], seq 8721:8801, ack 3536, win 5707, length 80
