    1  18:22:49.920063 74:d4:35:ec:64:73 (oui Unknown) > 80:1f:02:ff:ca:5d (oui Unknown), ethertype IPv4 (0x0800), length 694: legolas.ssh > 172.23.15.73.49186: Flags [P.], seq 2925441968:2925442608, ack 2261761408, win 5623, length 640
    2  18:22:49.929677 80:1f:02:ff:ca:5d (oui Unknown) > 74:d4:35:ec:64:73 (oui Unknown), ethertype IPv4 (0x0800), length 118: 172.23.15.73.49186 > legolas.ssh: Flags [P.], seq 1:65, ack 640, win 512, length 64
    3  18:22:49.936669 80:1f:02:ff:ca:5d (oui Unknown) > 74:d4:35:ec:64:73 (oui Unknown), ethertype IPv4 (0x0800), length 118: 172.23.15.73.49186 > legolas.ssh: Flags [P.], seq 65:129, ack 640, win 512, length 64
    4  18:22:49.936735 74:d4:35:ec:64:73 (oui Unknown) > 80:1f:02:ff:ca:5d (oui Unknown), ethertype IPv4 (0x0800), length 54: legolas.ssh > 172.23.15.73.49186: Flags [.], ack 129, win 5623, length 0
    5  18:22:49.936909 74:d4:35:ec:64:73 (oui Unknown) > 80:1f:02:ff:ca:5d (oui Unknown), ethertype IPv4 (0x0800), length 102: legolas.ssh > 172.23.15.73.49186: Flags [P.], seq 640:688, ack 129, win 5623, length 48
    6  18:22:49.941669 80:1f:02:ff:ca:5d (oui Unknown) > 74:d4:35:ec:64:73 (oui Unknown), ethertype IPv4 (0x0800), length 118: 172.23.15.73.49186 > legolas.ssh: Flags [P.], seq 129:193, ack 688, win 512, length 64
    7  18:22:49.942341 74:d4:35:ec:64:73 (oui Unknown) > 80:1f:02:ff:ca:5d (oui Unknown), ethertype IPv4 (0x0800), length 118: legolas.ssh > 172.23.15.73.49186: Flags [P.], seq 688:752, ack 193, win 5623, length 64
    8  18:22:49.947629 80:1f:02:ff:ca:5d (oui Unknown) > 74:d4:35:ec:64:73 (oui Unknown), ethertype IPv4 (0x0800), length 118: 172.23.15.73.49186 > legolas.ssh: Flags [P.], seq 193:257, ack 752, win 511, length 64
    9  18:22:49.950998 74:d4:35:ec:64:73 (oui Unknown) > 80:1f:02:ff:ca:5d (oui Unknown), ethertype IPv4 (0x0800), length 374: legolas.ssh > 172.23.15.73.49186: Flags [P.], seq 752:1072, ack 257, win 5623, length 320
   10  18:22:49.960432 80:1f:02:ff:ca:5d (oui Unknown) > 74:d4:35:ec:64:73 (oui Unknown), ethertype IPv4 (0x0800), length 118: 172.23.15.73.49186 > legolas.ssh: Flags [P.], seq 257:321, ack 1072, win 510, length 64
   11  18:22:50.002855 74:d4:35:ec:64:73 (oui Unknown) > 80:1f:02:ff:ca:5d (oui Unknown), ethertype IPv4 (0x0800), length 54: legolas.ssh > 172.23.15.73.49186: Flags [.], ack 321, win 5623, length 0
   12  18:22:50.544241 74:d4:35:ec:64:73 (oui Unknown) > 80:1f:02:ff:ca:5d (oui Unknown), ethertype IPv4 (0x0800), length 310: legolas.ssh > 172.23.15.73.49186: Flags [P.], seq 1072:1328, ack 321, win 5623, length 256
   13  18:22:50.551890 80:1f:02:ff:ca:5d (oui Unknown) > 74:d4:35:ec:64:73 (oui Unknown), ethertype IPv4 (0x0800), length 118: 172.23.15.73.49186 > legolas.ssh: Flags [P.], seq 321:385, ack 1328, win 509, length 64
   14  18:22:50.551938 74:d4:35:ec:64:73 (oui Unknown) > 80:1f:02:ff:ca:5d (oui Unknown), ethertype IPv4 (0x0800), length 54: legolas.ssh > 172.23.15.73.49186: Flags [.], ack 385, win 5623, length 0
   15  18:22:50.774805 00:1f:da:5e:d8:01 (oui Unknown) > 01:80:c2:00:00:00 (oui Unknown), 802.3, length 38: LLC, dsap STP (0x42) Individual, ssap STP (0x42) Command, ctrl 0x03: STP 802.1d, Config, Flags [none], bridge-id 8000.00:1f:da:5e:d8:01.8019, length 35
   16  18:22:50.810788 74:d4:35:ec:64:73 (oui Unknown) > 80:1f:02:ff:ca:5d (oui Unknown), ethertype IPv4 (0x0800), length 134: legolas.ssh > 172.23.15.73.49186: Flags [P.], seq 1328:1408, ack 385, win 5623, length 80
   17  18:22:50.811633 74:d4:35:ec:64:73 (oui Unknown) > 80:1f:02:ff:ca:5d (oui Unknown), ethertype IPv4 (0x0800), length 150: legolas.ssh > 172.23.15.73.49186: Flags [P.], seq 1408:1504, ack 385, win 5623, length 96
   18  18:22:50.812462 74:d4:35:ec:64:73 (oui Unknown) > 80:1f:02:ff:ca:5d (oui Unknown), ethertype IPv4 (0x0800), length 182: legolas.ssh > 172.23.15.73.49186: Flags [P.], seq 1504:1632, ack 385, win 5623, length 128
   19  18:22:50.812507 74:d4:35:ec:64:73 (oui Unknown) > 80:1f:02:ff:ca:5d (oui Unknown), ethertype IPv4 (0x0800), length 102: legolas.ssh > 172.23.15.73.49186: Flags [P.], seq 1632:1680, ack 385, win 5623, length 48
   20  18:22:50.813403 74:d4:35:ec:64:73 (oui Unknown) > 80:1f:02:ff:ca:5d (oui Unknown), ethertype IPv4 (0x0800), length 118: legolas.ssh > 172.23.15.73.49186: Flags [P.], seq 1680:1744, ack 385, win 5623, length 64
   21  18:22:50.813501 74:d4:35:ec:64:73 (oui Unknown) > 80:1f:02:ff:ca:5d (oui Unknown), ethertype IPv4 (0x0800), length 102: legolas.ssh > 172.23.15.73.49186: Flags [P.], seq 1744:1792, ack 385, win 5623, length 48
   22  18:22:50.814316 74:d4:35:ec:64:73 (oui Unknown) > 80:1f:02:ff:ca:5d (oui Unknown), ethertype IPv4 (0x0800), length 102: legolas.ssh > 172.23.15.73.49186: Flags [P.], seq 1792:1840, ack 385, win 5623, length 48
   23  18:22:50.814420 74:d4:35:ec:64:73 (oui Unknown) > 80:1f:02:ff:ca:5d (oui Unknown), ethertype IPv4 (0x0800), length 102: legolas.ssh > 172.23.15.73.49186: Flags [P.], seq 1840:1888, ack 385, win 5623, length 48
   24  18:22:50.816230 80:1f:02:ff:ca:5d (oui Unknown) > 74:d4:35:ec:64:73 (oui Unknown), ethertype IPv4 (0x0800), length 60: 172.23.15.73.49186 > legolas.ssh: Flags [.], ack 1504, win 508, length 0
   25  18:22:50.816913 80:1f:02:ff:ca:5d (oui Unknown) > 74:d4:35:ec:64:73 (oui Unknown), ethertype IPv4 (0x0800), length 60: 172.23.15.73.49186 > legolas.ssh: Flags [.], ack 1680, win 508, length 0
   26  18:22:50.817119 80:1f:02:ff:ca:5d (oui Unknown) > 74:d4:35:ec:64:73 (oui Unknown), ethertype IPv4 (0x0800), length 60: 172.23.15.73.49186 > legolas.ssh: Flags [.], ack 1792, win 507, length 0
   27  18:22:50.820017 80:1f:02:ff:ca:5d (oui Unknown) > 74:d4:35:ec:64:73 (oui Unknown), ethertype IPv4 (0x0800), length 60: 172.23.15.73.49186 > legolas.ssh: Flags [.], ack 1888, win 507, length 0
   28  18:22:50.827981 80:1f:02:ff:ca:5d (oui Unknown) > 74:d4:35:ec:64:73 (oui Unknown), ethertype IPv4 (0x0800), length 150: 172.23.15.73.49186 > legolas.ssh: Flags [P.], seq 385:481, ack 1888, win 507, length 96
   29  18:22:50.827992 74:d4:35:ec:64:73 (oui Unknown) > 80:1f:02:ff:ca:5d (oui Unknown), ethertype IPv4 (0x0800), length 54: legolas.ssh > 172.23.15.73.49186: Flags [.], ack 481, win 5623, length 0
   30  18:22:50.828104 74:d4:35:ec:64:73 (oui Unknown) > 80:1f:02:ff:ca:5d (oui Unknown), ethertype IPv4 (0x0800), length 102: legolas.ssh > 172.23.15.73.49186: Flags [P.], seq 1888:1936, ack 481, win 5623, length 48
   31  18:22:50.875626 74:d4:35:ec:64:73 (oui Unknown) > 80:1f:02:ff:ca:5d (oui Unknown), ethertype IPv4 (0x0800), length 96: legolas.55577 > ro-dc4.romania.luxoft.com.domain: 53750+ [1au] PTR? 73.15.23.172.in-addr.arpa. (54)
   32  18:22:50.884725 80:1f:02:ff:ca:5d (oui Unknown) > 74:d4:35:ec:64:73 (oui Unknown), ethertype IPv4 (0x0800), length 60: 172.23.15.73.49186 > legolas.ssh: Flags [.], ack 1936, win 507, length 0
   33  18:22:50.884941 80:1f:02:ff:ca:5d (oui Unknown) > 74:d4:35:ec:64:73 (oui Unknown), ethertype IPv4 (0x0800), length 131: ro-dc4.romania.luxoft.com.domain > legolas.55577: 53750 NXDomain 0/1/1 (89)
   34  18:22:50.885047 74:d4:35:ec:64:73 (oui Unknown) > 80:1f:02:ff:ca:5d (oui Unknown), ethertype IPv4 (0x0800), length 85: legolas.55577 > ro-dc4.romania.luxoft.com.domain: 53750+ PTR? 73.15.23.172.in-addr.arpa. (43)
   35  18:22:50.885497 80:1f:02:ff:ca:5d (oui Unknown) > 74:d4:35:ec:64:73 (oui Unknown), ethertype IPv4 (0x0800), length 120: ro-dc4.romania.luxoft.com.domain > legolas.55577: 53750 NXDomain 0/1/0 (78)
   36  18:22:51.145943 74:d4:35:ec:64:73 (oui Unknown) > 80:1f:02:ff:ca:5d (oui Unknown), ethertype IPv4 (0x0800), length 262: legolas.ssh > 172.23.15.73.49186: Flags [P.], seq 1936:2144, ack 481, win 5623, length 208
   37  18:22:51.154208 80:1f:02:ff:ca:5d (oui Unknown) > 74:d4:35:ec:64:73 (oui Unknown), ethertype IPv4 (0x0800), length 118: 172.23.15.73.49186 > legolas.ssh: Flags [P.], seq 481:545, ack 2144, win 512, length 64
   38  18:22:51.154256 74:d4:35:ec:64:73 (oui Unknown) > 80:1f:02:ff:ca:5d (oui Unknown), ethertype IPv4 (0x0800), length 54: legolas.ssh > 172.23.15.73.49186: Flags [.], ack 545, win 5623, length 0
   39  18:22:51.747159 74:d4:35:ec:64:73 (oui Unknown) > 80:1f:02:ff:ca:5d (oui Unknown), ethertype IPv4 (0x0800), length 246: legolas.ssh > 172.23.15.73.49186: Flags [P.], seq 2144:2336, ack 545, win 5623, length 192
   40  18:22:51.756538 80:1f:02:ff:ca:5d (oui Unknown) > 74:d4:35:ec:64:73 (oui Unknown), ethertype IPv4 (0x0800), length 118: 172.23.15.73.49186 > legolas.ssh: Flags [P.], seq 545:609, ack 2336, win 511, length 64
   41  18:22:51.756586 74:d4:35:ec:64:73 (oui Unknown) > 80:1f:02:ff:ca:5d (oui Unknown), ethertype IPv4 (0x0800), length 54: legolas.ssh > 172.23.15.73.49186: Flags [.], ack 609, win 5623, length 0
   42  18:22:51.816476 74:d4:35:ec:64:73 (oui Unknown) > 80:1f:02:ff:ca:5d (oui Unknown), ethertype IPv4 (0x0800), length 134: legolas.ssh > 172.23.15.73.49186: Flags [P.], seq 2336:2416, ack 609, win 5623, length 80
   43  18:22:51.817294 74:d4:35:ec:64:73 (oui Unknown) > 80:1f:02:ff:ca:5d (oui Unknown), ethertype IPv4 (0x0800), length 134: legolas.ssh > 172.23.15.73.49186: Flags [P.], seq 2416:2496, ack 609, win 5623, length 80
   44  18:22:51.818119 74:d4:35:ec:64:73 (oui Unknown) > 80:1f:02:ff:ca:5d (oui Unknown), ethertype IPv4 (0x0800), length 166: legolas.ssh > 172.23.15.73.49186: Flags [P.], seq 2496:2608, ack 609, win 5623, length 112
   45  18:22:51.818184 74:d4:35:ec:64:73 (oui Unknown) > 80:1f:02:ff:ca:5d (oui Unknown), ethertype IPv4 (0x0800), length 102: legolas.ssh > 172.23.15.73.49186: Flags [P.], seq 2608:2656, ack 609, win 5623, length 48
   46  18:22:51.819094 74:d4:35:ec:64:73 (oui Unknown) > 80:1f:02:ff:ca:5d (oui Unknown), ethertype IPv4 (0x0800), length 118: legolas.ssh > 172.23.15.73.49186: Flags [P.], seq 2656:2720, ack 609, win 5623, length 64
   47  18:22:51.819185 74:d4:35:ec:64:73 (oui Unknown) > 80:1f:02:ff:ca:5d (oui Unknown), ethertype IPv4 (0x0800), length 102: legolas.ssh > 172.23.15.73.49186: Flags [P.], seq 2720:2768, ack 609, win 5623, length 48
   48  18:22:51.819999 74:d4:35:ec:64:73 (oui Unknown) > 80:1f:02:ff:ca:5d (oui Unknown), ethertype IPv4 (0x0800), length 102: legolas.ssh > 172.23.15.73.49186: Flags [P.], seq 2768:2816, ack 609, win 5623, length 48
   49  18:22:51.820100 74:d4:35:ec:64:73 (oui Unknown) > 80:1f:02:ff:ca:5d (oui Unknown), ethertype IPv4 (0x0800), length 102: legolas.ssh > 172.23.15.73.49186: Flags [P.], seq 2816:2864, ack 609, win 5623, length 48
   50  18:22:51.822709 80:1f:02:ff:ca:5d (oui Unknown) > 74:d4:35:ec:64:73 (oui Unknown), ethertype IPv4 (0x0800), length 60: 172.23.15.73.49186 > legolas.ssh: Flags [.], ack 2496, win 510, length 0
   51  18:22:51.823248 80:1f:02:ff:ca:5d (oui Unknown) > 74:d4:35:ec:64:73 (oui Unknown), ethertype IPv4 (0x0800), length 60: 172.23.15.73.49186 > legolas.ssh: Flags [.], ack 2656, win 510, length 0
   52  18:22:51.823325 80:1f:02:ff:ca:5d (oui Unknown) > 74:d4:35:ec:64:73 (oui Unknown), ethertype IPv4 (0x0800), length 60: 172.23.15.73.49186 > legolas.ssh: Flags [.], ack 2768, win 509, length 0
   53  18:22:51.824486 80:1f:02:ff:ca:5d (oui Unknown) > 74:d4:35:ec:64:73 (oui Unknown), ethertype IPv4 (0x0800), length 60: 172.23.15.73.49186 > legolas.ssh: Flags [.], ack 2864, win 509, length 0
   54  18:22:51.899519 74:d4:35:ec:64:73 (oui Unknown) > 80:1f:02:ff:ca:5d (oui Unknown), ethertype IPv4 (0x0800), length 96: legolas.54526 > ro-dc4.romania.luxoft.com.domain: 28708+ [1au] PTR? 5.201.30.172.in-addr.arpa. (54)
   55  18:22:51.900402 80:1f:02:ff:ca:5d (oui Unknown) > 74:d4:35:ec:64:73 (oui Unknown), ethertype IPv4 (0x0800), length 135: ro-dc4.romania.luxoft.com.domain > legolas.54526: 28708* 1/0/1 PTR ro-dc4.romania.luxoft.com. (93)
   56  18:22:52.347875 74:d4:35:ec:64:73 (oui Unknown) > 80:1f:02:ff:ca:5d (oui Unknown), ethertype IPv4 (0x0800), length 246: legolas.ssh > 172.23.15.73.49186: Flags [P.], seq 2864:3056, ack 609, win 5623, length 192
   57  18:22:52.355631 80:1f:02:ff:ca:5d (oui Unknown) > 74:d4:35:ec:64:73 (oui Unknown), ethertype IPv4 (0x0800), length 118: 172.23.15.73.49186 > legolas.ssh: Flags [P.], seq 609:673, ack 3056, win 508, length 64
   58  18:22:52.355643 74:d4:35:ec:64:73 (oui Unknown) > 80:1f:02:ff:ca:5d (oui Unknown), ethertype IPv4 (0x0800), length 54: legolas.ssh > 172.23.15.73.49186: Flags [.], ack 673, win 5623, length 0
   59  18:22:52.774919 00:1f:da:5e:d8:01 (oui Unknown) > 01:80:c2:00:00:00 (oui Unknown), 802.3, length 38: LLC, dsap STP (0x42) Individual, ssap STP (0x42) Command, ctrl 0x03: STP 802.1d, Config, Flags [none], bridge-id 8000.00:1f:da:5e:d8:01.8019, length 35
   60  18:22:52.822221 74:d4:35:ec:64:73 (oui Unknown) > 80:1f:02:ff:ca:5d (oui Unknown), ethertype IPv4 (0x0800), length 134: legolas.ssh > 172.23.15.73.49186: Flags [P.], seq 3056:3136, ack 673, win 5623, length 80
   61  18:22:52.823052 74:d4:35:ec:64:73 (oui Unknown) > 80:1f:02:ff:ca:5d (oui Unknown), ethertype IPv4 (0x0800), length 150: legolas.ssh > 172.23.15.73.49186: Flags [P.], seq 3136:3232, ack 673, win 5623, length 96
   62  18:22:52.823868 74:d4:35:ec:64:73 (oui Unknown) > 80:1f:02:ff:ca:5d (oui Unknown), ethertype IPv4 (0x0800), length 166: legolas.ssh > 172.23.15.73.49186: Flags [P.], seq 3232:3344, ack 673, win 5623, length 112
   63  18:22:52.823914 74:d4:35:ec:64:73 (oui Unknown) > 80:1f:02:ff:ca:5d (oui Unknown), ethertype IPv4 (0x0800), length 102: legolas.ssh > 172.23.15.73.49186: Flags [P.], seq 3344:3392, ack 673, win 5623, length 48
   64  18:22:52.824826 74:d4:35:ec:64:73 (oui Unknown) > 80:1f:02:ff:ca:5d (oui Unknown), ethertype IPv4 (0x0800), length 118: legolas.ssh > 172.23.15.73.49186: Flags [P.], seq 3392:3456, ack 673, win 5623, length 64
   65  18:22:52.824915 74:d4:35:ec:64:73 (oui Unknown) > 80:1f:02:ff:ca:5d (oui Unknown), ethertype IPv4 (0x0800), length 102: legolas.ssh > 172.23.15.73.49186: Flags [P.], seq 3456:3504, ack 673, win 5623, length 48
   66  18:22:52.825723 74:d4:35:ec:64:73 (oui Unknown) > 80:1f:02:ff:ca:5d (oui Unknown), ethertype IPv4 (0x0800), length 102: legolas.ssh > 172.23.15.73.49186: Flags [P.], seq 3504:3552, ack 673, win 5623, length 48
   67  18:22:52.825824 74:d4:35:ec:64:73 (oui Unknown) > 80:1f:02:ff:ca:5d (oui Unknown), ethertype IPv4 (0x0800), length 102: legolas.ssh > 172.23.15.73.49186: Flags [P.], seq 3552:3600, ack 673, win 5623, length 48
   68  18:22:52.827549 80:1f:02:ff:ca:5d (oui Unknown) > 74:d4:35:ec:64:73 (oui Unknown), ethertype IPv4 (0x0800), length 60: 172.23.15.73.49186 > legolas.ssh: Flags [.], ack 3232, win 508, length 0
   69  18:22:52.828022 80:1f:02:ff:ca:5d (oui Unknown) > 74:d4:35:ec:64:73 (oui Unknown), ethertype IPv4 (0x0800), length 60: 172.23.15.73.49186 > legolas.ssh: Flags [.], ack 3392, win 507, length 0
   70  18:22:52.829286 80:1f:02:ff:ca:5d (oui Unknown) > 74:d4:35:ec:64:73 (oui Unknown), ethertype IPv4 (0x0800), length 60: 172.23.15.73.49186 > legolas.ssh: Flags [.], ack 3504, win 506, length 0
   71  18:22:52.829758 80:1f:02:ff:ca:5d (oui Unknown) > 74:d4:35:ec:64:73 (oui Unknown), ethertype IPv4 (0x0800), length 60: 172.23.15.73.49186 > legolas.ssh: Flags [.], ack 3600, win 512, length 0
   72  18:22:52.948820 74:d4:35:ec:64:73 (oui Unknown) > 80:1f:02:ff:ca:5d (oui Unknown), ethertype IPv4 (0x0800), length 246: legolas.ssh > 172.23.15.73.49186: Flags [P.], seq 3600:3792, ack 673, win 5623, length 192
   73  18:22:52.957380 80:1f:02:ff:ca:5d (oui Unknown) > 74:d4:35:ec:64:73 (oui Unknown), ethertype IPv4 (0x0800), length 118: 172.23.15.73.49186 > legolas.ssh: Flags [P.], seq 673:737, ack 3792, win 511, length 64
   74  18:22:52.957397 74:d4:35:ec:64:73 (oui Unknown) > 80:1f:02:ff:ca:5d (oui Unknown), ethertype IPv4 (0x0800), length 54: legolas.ssh > 172.23.15.73.49186: Flags [.], ack 737, win 5623, length 0
   75  18:22:53.035407 80:1f:02:ff:ca:5d (oui Unknown) > 74:d4:35:ec:64:73 (oui Unknown), ethertype IPv4 (0x0800), length 118: 172.23.15.73.49186 > legolas.ssh: Flags [P.], seq 737:801, ack 3792, win 511, length 64
   76  18:22:53.035417 74:d4:35:ec:64:73 (oui Unknown) > 80:1f:02:ff:ca:5d (oui Unknown), ethertype IPv4 (0x0800), length 54: legolas.ssh > 172.23.15.73.49186: Flags [.], ack 801, win 5623, length 0
   77  18:22:53.035689 74:d4:35:ec:64:73 (oui Unknown) > 80:1f:02:ff:ca:5d (oui Unknown), ethertype IPv4 (0x0800), length 102: legolas.ssh > 172.23.15.73.49186: Flags [P.], seq 3792:3840, ack 801, win 5623, length 48
   78  18:22:53.041889 80:1f:02:ff:ca:5d (oui Unknown) > 74:d4:35:ec:64:73 (oui Unknown), ethertype IPv4 (0x0800), length 118: 172.23.15.73.49186 > legolas.ssh: Flags [P.], seq 801:865, ack 3840, win 511, length 64
   79  18:22:53.041901 74:d4:35:ec:64:73 (oui Unknown) > 80:1f:02:ff:ca:5d (oui Unknown), ethertype IPv4 (0x0800), length 54: legolas.ssh > 172.23.15.73.49186: Flags [.], ack 865, win 5623, length 0
   80  18:22:53.042531 74:d4:35:ec:64:73 (oui Unknown) > 80:1f:02:ff:ca:5d (oui Unknown), ethertype IPv4 (0x0800), length 118: legolas.ssh > 172.23.15.73.49186: Flags [P.], seq 3840:3904, ack 865, win 5623, length 64
   81  18:22:53.042794 74:d4:35:ec:64:73 (oui Unknown) > 80:1f:02:ff:ca:5d (oui Unknown), ethertype IPv4 (0x0800), length 246: legolas.ssh > 172.23.15.73.49186: Flags [P.], seq 3904:4096, ack 865, win 5623, length 192
   82  18:22:53.047200 80:1f:02:ff:ca:5d (oui Unknown) > 74:d4:35:ec:64:73 (oui Unknown), ethertype IPv4 (0x0800), length 118: 172.23.15.73.49186 > legolas.ssh: Flags [P.], seq 865:929, ack 3904, win 511, length 64
   83  18:22:53.051141 80:1f:02:ff:ca:5d (oui Unknown) > 74:d4:35:ec:64:73 (oui Unknown), ethertype IPv4 (0x0800), length 118: 172.23.15.73.49186 > legolas.ssh: Flags [P.], seq 929:993, ack 4096, win 510, length 64
   84  18:22:53.051215 74:d4:35:ec:64:73 (oui Unknown) > 80:1f:02:ff:ca:5d (oui Unknown), ethertype IPv4 (0x0800), length 54: legolas.ssh > 172.23.15.73.49186: Flags [.], ack 993, win 5623, length 0
   85  18:22:53.077022 74:d4:35:ec:64:73 (oui Unknown) > 80:1f:02:ff:ca:5d (oui Unknown), ethertype IPv4 (0x0800), length 262: legolas.ssh > 172.23.15.73.49186: Flags [P.], seq 4096:4304, ack 993, win 5623, length 208
   86  18:22:53.081140 80:1f:02:ff:ca:5d (oui Unknown) > 74:d4:35:ec:64:73 (oui Unknown), ethertype IPv4 (0x0800), length 118: 172.23.15.73.49186 > legolas.ssh: Flags [P.], seq 993:1057, ack 4096, win 510, length 64
   87  18:22:53.085921 80:1f:02:ff:ca:5d (oui Unknown) > 74:d4:35:ec:64:73 (oui Unknown), ethertype IPv4 (0x0800), length 118: 172.23.15.73.49186 > legolas.ssh: Flags [P.], seq 1057:1121, ack 4304, win 509, length 64
   88  18:22:53.085994 74:d4:35:ec:64:73 (oui Unknown) > 80:1f:02:ff:ca:5d (oui Unknown), ethertype IPv4 (0x0800), length 54: legolas.ssh > 172.23.15.73.49186: Flags [.], ack 1121, win 5623, length 0
   89  18:22:53.644669 74:d4:35:ec:64:73 (oui Unknown) > 80:1f:02:ff:ca:5d (oui Unknown), ethertype IPv4 (0x0800), length 246: legolas.ssh > 172.23.15.73.49186: Flags [P.], seq 4304:4496, ack 1121, win 5623, length 192
   90  18:22:53.651821 80:1f:02:ff:ca:5d (oui Unknown) > 74:d4:35:ec:64:73 (oui Unknown), ethertype IPv4 (0x0800), length 150: 172.23.15.73.49186 > legolas.ssh: Flags [P.], seq 1121:1217, ack 4496, win 508, length 96
   91  18:22:53.651907 80:1f:02:ff:ca:5d (oui Unknown) > 74:d4:35:ec:64:73 (oui Unknown), ethertype IPv4 (0x0800), length 118: 172.23.15.73.49186 > legolas.ssh: Flags [P.], seq 1217:1281, ack 4496, win 508, length 64
   92  18:22:53.651955 74:d4:35:ec:64:73 (oui Unknown) > 80:1f:02:ff:ca:5d (oui Unknown), ethertype IPv4 (0x0800), length 54: legolas.ssh > 172.23.15.73.49186: Flags [.], ack 1281, win 5623, length 0
   93  18:22:53.652124 74:d4:35:ec:64:73 (oui Unknown) > 80:1f:02:ff:ca:5d (oui Unknown), ethertype IPv4 (0x0800), length 102: legolas.ssh > 172.23.15.73.49186: Flags [P.], seq 4496:4544, ack 1281, win 5623, length 48
   94  18:22:53.654630 80:1f:02:ff:ca:5d (oui Unknown) > 74:d4:35:ec:64:73 (oui Unknown), ethertype IPv4 (0x0800), length 118: 172.23.15.73.49186 > legolas.ssh: Flags [P.], seq 1281:1345, ack 4496, win 508, length 64
   95  18:22:53.655231 74:d4:35:ec:64:73 (oui Unknown) > 80:1f:02:ff:ca:5d (oui Unknown), ethertype IPv4 (0x0800), length 102: legolas.ssh > 172.23.15.73.49186: Flags [P.], seq 4544:4592, ack 1345, win 5623, length 48
   96  18:22:53.660068 80:1f:02:ff:ca:5d (oui Unknown) > 74:d4:35:ec:64:73 (oui Unknown), ethertype IPv4 (0x0800), length 60: 172.23.15.73.49186 > legolas.ssh: Flags [.], ack 4592, win 508, length 0
   97  18:22:53.660606 80:1f:02:ff:ca:5d (oui Unknown) > 74:d4:35:ec:64:73 (oui Unknown), ethertype IPv4 (0x0800), length 118: 172.23.15.73.49186 > legolas.ssh: Flags [P.], seq 1345:1409, ack 4592, win 508, length 64
   98  18:22:53.662075 74:d4:35:ec:64:73 (oui Unknown) > 80:1f:02:ff:ca:5d (oui Unknown), ethertype IPv4 (0x0800), length 118: legolas.ssh > 172.23.15.73.49186: Flags [P.], seq 4592:4656, ack 1409, win 5623, length 64
   99  18:22:53.666955 74:d4:35:ec:64:73 (oui Unknown) > 80:1f:02:ff:ca:5d (oui Unknown), ethertype IPv4 (0x0800), length 246: legolas.ssh > 172.23.15.73.49186: Flags [P.], seq 4656:4848, ack 1409, win 5623, length 192
  100  18:22:53.667942 80:1f:02:ff:ca:5d (oui Unknown) > 74:d4:35:ec:64:73 (oui Unknown), ethertype IPv4 (0x0800), length 118: 172.23.15.73.49186 > legolas.ssh: Flags [P.], seq 1409:1473, ack 4656, win 508, length 64
  101  18:22:53.674700 80:1f:02:ff:ca:5d (oui Unknown) > 74:d4:35:ec:64:73 (oui Unknown), ethertype IPv4 (0x0800), length 118: 172.23.15.73.49186 > legolas.ssh: Flags [P.], seq 1473:1537, ack 4848, win 507, length 64
  102  18:22:53.674848 74:d4:35:ec:64:73 (oui Unknown) > 80:1f:02:ff:ca:5d (oui Unknown), ethertype IPv4 (0x0800), length 54: legolas.ssh > 172.23.15.73.49186: Flags [.], ack 1537, win 5623, length 0
  103  18:22:53.691547 74:d4:35:ec:64:73 (oui Unknown) > 80:1f:02:ff:ca:5d (oui Unknown), ethertype IPv4 (0x0800), length 246: legolas.ssh > 172.23.15.73.49186: Flags [P.], seq 4848:5040, ack 1537, win 5623, length 192
  104  18:22:53.701005 80:1f:02:ff:ca:5d (oui Unknown) > 74:d4:35:ec:64:73 (oui Unknown), ethertype IPv4 (0x0800), length 118: 172.23.15.73.49186 > legolas.ssh: Flags [P.], seq 1537:1601, ack 5040, win 512, length 64
  105  18:22:53.742885 74:d4:35:ec:64:73 (oui Unknown) > 80:1f:02:ff:ca:5d (oui Unknown), ethertype IPv4 (0x0800), length 54: legolas.ssh > 172.23.15.73.49186: Flags [.], ack 1601, win 5623, length 0
  106  18:22:53.768895 80:1f:02:ff:ca:5d (oui Unknown) > 74:d4:35:ec:64:73 (oui Unknown), ethertype IPv4 (0x0800), length 118: 172.23.15.73.49186 > legolas.ssh: Flags [P.], seq 1601:1665, ack 5040, win 512, length 64
  107  18:22:53.768924 74:d4:35:ec:64:73 (oui Unknown) > 80:1f:02:ff:ca:5d (oui Unknown), ethertype IPv4 (0x0800), length 54: legolas.ssh > 172.23.15.73.49186: Flags [.], ack 1665, win 5623, length 0
  108  18:22:53.817455 80:1f:02:ff:ca:5d (oui Unknown) > 74:d4:35:ec:64:73 (oui Unknown), ethertype IPv4 (0x0800), length 118: 172.23.15.73.49186 > legolas.ssh: Flags [P.], seq 1665:1729, ack 5040, win 512, length 64
  109  18:22:53.817484 74:d4:35:ec:64:73 (oui Unknown) > 80:1f:02:ff:ca:5d (oui Unknown), ethertype IPv4 (0x0800), length 54: legolas.ssh > 172.23.15.73.49186: Flags [.], ack 1729, win 5623, length 0
  110  18:22:53.818047 74:d4:35:ec:64:73 (oui Unknown) > 80:1f:02:ff:ca:5d (oui Unknown), ethertype IPv4 (0x0800), length 102: legolas.ssh > 172.23.15.73.49186: Flags [P.], seq 5040:5088, ack 1729, win 5623, length 48
  111  18:22:53.823908 80:1f:02:ff:ca:5d (oui Unknown) > 74:d4:35:ec:64:73 (oui Unknown), ethertype IPv4 (0x0800), length 118: 172.23.15.73.49186 > legolas.ssh: Flags [P.], seq 1729:1793, ack 5088, win 512, length 64
  112  18:22:53.823942 74:d4:35:ec:64:73 (oui Unknown) > 80:1f:02:ff:ca:5d (oui Unknown), ethertype IPv4 (0x0800), length 54: legolas.ssh > 172.23.15.73.49186: Flags [.], ack 1793, win 5623, length 0
  113  18:22:53.825299 74:d4:35:ec:64:73 (oui Unknown) > 80:1f:02:ff:ca:5d (oui Unknown), ethertype IPv4 (0x0800), length 118: legolas.ssh > 172.23.15.73.49186: Flags [P.], seq 5088:5152, ack 1793, win 5623, length 64
  114  18:22:53.827943 74:d4:35:ec:64:73 (oui Unknown) > 80:1f:02:ff:ca:5d (oui Unknown), ethertype IPv4 (0x0800), length 118: legolas.ssh > 172.23.15.73.49186: Flags [P.], seq 5152:5216, ack 1793, win 5623, length 64
  115  18:22:53.828774 74:d4:35:ec:64:73 (oui Unknown) > 80:1f:02:ff:ca:5d (oui Unknown), ethertype IPv4 (0x0800), length 150: legolas.ssh > 172.23.15.73.49186: Flags [P.], seq 5216:5312, ack 1793, win 5623, length 96
  116  18:22:53.829597 74:d4:35:ec:64:73 (oui Unknown) > 80:1f:02:ff:ca:5d (oui Unknown), ethertype IPv4 (0x0800), length 166: legolas.ssh > 172.23.15.73.49186: Flags [P.], seq 5312:5424, ack 1793, win 5623, length 112
  117  18:22:53.829659 74:d4:35:ec:64:73 (oui Unknown) > 80:1f:02:ff:ca:5d (oui Unknown), ethertype IPv4 (0x0800), length 102: legolas.ssh > 172.23.15.73.49186: Flags [P.], seq 5424:5472, ack 1793, win 5623, length 48
  118  18:22:53.830550 74:d4:35:ec:64:73 (oui Unknown) > 80:1f:02:ff:ca:5d (oui Unknown), ethertype IPv4 (0x0800), length 118: legolas.ssh > 172.23.15.73.49186: Flags [P.], seq 5472:5536, ack 1793, win 5623, length 64
  119  18:22:53.830645 74:d4:35:ec:64:73 (oui Unknown) > 80:1f:02:ff:ca:5d (oui Unknown), ethertype IPv4 (0x0800), length 102: legolas.ssh > 172.23.15.73.49186: Flags [P.], seq 5536:5584, ack 1793, win 5623, length 48
  120  18:22:53.830948 80:1f:02:ff:ca:5d (oui Unknown) > 74:d4:35:ec:64:73 (oui Unknown), ethertype IPv4 (0x0800), length 118: 172.23.15.73.49186 > legolas.ssh: Flags [P.], seq 1793:1857, ack 5152, win 511, length 64
  121  18:22:53.831005 74:d4:35:ec:64:73 (oui Unknown) > 80:1f:02:ff:ca:5d (oui Unknown), ethertype IPv4 (0x0800), length 54: legolas.ssh > 172.23.15.73.49186: Flags [.], ack 1857, win 5623, length 0
  122  18:22:53.831536 74:d4:35:ec:64:73 (oui Unknown) > 80:1f:02:ff:ca:5d (oui Unknown), ethertype IPv4 (0x0800), length 102: legolas.ssh > 172.23.15.73.49186: Flags [P.], seq 5584:5632, ack 1857, win 5623, length 48
  123  18:22:53.831638 74:d4:35:ec:64:73 (oui Unknown) > 80:1f:02:ff:ca:5d (oui Unknown), ethertype IPv4 (0x0800), length 102: legolas.ssh > 172.23.15.73.49186: Flags [P.], seq 5632:5680, ack 1857, win 5623, length 48
  124  18:22:53.833232 80:1f:02:ff:ca:5d (oui Unknown) > 74:d4:35:ec:64:73 (oui Unknown), ethertype IPv4 (0x0800), length 60: 172.23.15.73.49186 > legolas.ssh: Flags [.], ack 5312, win 511, length 0
  125  18:22:53.833724 80:1f:02:ff:ca:5d (oui Unknown) > 74:d4:35:ec:64:73 (oui Unknown), ethertype IPv4 (0x0800), length 60: 172.23.15.73.49186 > legolas.ssh: Flags [.], ack 5472, win 510, length 0
  126  18:22:53.835274 80:1f:02:ff:ca:5d (oui Unknown) > 74:d4:35:ec:64:73 (oui Unknown), ethertype IPv4 (0x0800), length 60: 172.23.15.73.49186 > legolas.ssh: Flags [.], ack 5584, win 510, length 0
  127  18:22:53.835777 80:1f:02:ff:ca:5d (oui Unknown) > 74:d4:35:ec:64:73 (oui Unknown), ethertype IPv4 (0x0800), length 60: 172.23.15.73.49186 > legolas.ssh: Flags [.], ack 5680, win 509, length 0
  128  18:22:53.851922 74:d4:35:ec:64:73 (oui Unknown) > 80:1f:02:ff:ca:5d (oui Unknown), ethertype IPv4 (0x0800), length 262: legolas.ssh > 172.23.15.73.49186: Flags [P.], seq 5680:5888, ack 1857, win 5623, length 208
  129  18:22:53.860670 80:1f:02:ff:ca:5d (oui Unknown) > 74:d4:35:ec:64:73 (oui Unknown), ethertype IPv4 (0x0800), length 118: 172.23.15.73.49186 > legolas.ssh: Flags [P.], seq 1857:1921, ack 5888, win 508, length 64
  130  18:22:53.902859 74:d4:35:ec:64:73 (oui Unknown) > 80:1f:02:ff:ca:5d (oui Unknown), ethertype IPv4 (0x0800), length 54: legolas.ssh > 172.23.15.73.49186: Flags [.], ack 1921, win 5623, length 0
  131  18:22:53.938858 80:1f:02:ff:ca:5d (oui Unknown) > 74:d4:35:ec:64:73 (oui Unknown), ethertype IPv4 (0x0800), length 118: 172.23.15.73.49186 > legolas.ssh: Flags [P.], seq 1921:1985, ack 5888, win 508, length 64
  132  18:22:53.938929 74:d4:35:ec:64:73 (oui Unknown) > 80:1f:02:ff:ca:5d (oui Unknown), ethertype IPv4 (0x0800), length 54: legolas.ssh > 172.23.15.73.49186: Flags [.], ack 1985, win 5623, length 0
  133  18:22:53.998690 80:1f:02:ff:ca:5d (oui Unknown) > 74:d4:35:ec:64:73 (oui Unknown), ethertype IPv4 (0x0800), length 118: 172.23.15.73.49186 > legolas.ssh: Flags [P.], seq 1985:2049, ack 5888, win 508, length 64
  134  18:22:53.998837 74:d4:35:ec:64:73 (oui Unknown) > 80:1f:02:ff:ca:5d (oui Unknown), ethertype IPv4 (0x0800), length 54: legolas.ssh > 172.23.15.73.49186: Flags [.], ack 2049, win 5623, length 0
  135  18:22:53.999318 74:d4:35:ec:64:73 (oui Unknown) > 80:1f:02:ff:ca:5d (oui Unknown), ethertype IPv4 (0x0800), length 102: legolas.ssh > 172.23.15.73.49186: Flags [P.], seq 5888:5936, ack 2049, win 5623, length 48
  136  18:22:54.004158 80:1f:02:ff:ca:5d (oui Unknown) > 74:d4:35:ec:64:73 (oui Unknown), ethertype IPv4 (0x0800), length 118: 172.23.15.73.49186 > legolas.ssh: Flags [P.], seq 2049:2113, ack 5936, win 508, length 64
  137  18:22:54.004291 74:d4:35:ec:64:73 (oui Unknown) > 80:1f:02:ff:ca:5d (oui Unknown), ethertype IPv4 (0x0800), length 54: legolas.ssh > 172.23.15.73.49186: Flags [.], ack 2113, win 5623, length 0
  138  18:22:54.005848 74:d4:35:ec:64:73 (oui Unknown) > 80:1f:02:ff:ca:5d (oui Unknown), ethertype IPv4 (0x0800), length 118: legolas.ssh > 172.23.15.73.49186: Flags [P.], seq 5936:6000, ack 2113, win 5623, length 64
  139  18:22:54.010114 80:1f:02:ff:ca:5d (oui Unknown) > 74:d4:35:ec:64:73 (oui Unknown), ethertype IPv4 (0x0800), length 118: 172.23.15.73.49186 > legolas.ssh: Flags [P.], seq 2113:2177, ack 6000, win 508, length 64
  140  18:22:54.010152 74:d4:35:ec:64:73 (oui Unknown) > 80:1f:02:ff:ca:5d (oui Unknown), ethertype IPv4 (0x0800), length 54: legolas.ssh > 172.23.15.73.49186: Flags [.], ack 2177, win 5623, length 0
  141  18:22:54.017390 74:d4:35:ec:64:73 (oui Unknown) > 80:1f:02:ff:ca:5d (oui Unknown), ethertype IPv4 (0x0800), length 406: legolas.ssh > 172.23.15.73.49186: Flags [P.], seq 6000:6352, ack 2177, win 5623, length 352
  142  18:22:54.024196 80:1f:02:ff:ca:5d (oui Unknown) > 74:d4:35:ec:64:73 (oui Unknown), ethertype IPv4 (0x0800), length 118: 172.23.15.73.49186 > legolas.ssh: Flags [P.], seq 2177:2241, ack 6352, win 507, length 64
  143  18:22:54.032877 74:d4:35:ec:64:73 (oui Unknown) > 80:1f:02:ff:ca:5d (oui Unknown), ethertype IPv4 (0x0800), length 486: legolas.ssh > 172.23.15.73.49186: Flags [P.], seq 6352:6784, ack 2241, win 5623, length 432
  144  18:22:54.041900 80:1f:02:ff:ca:5d (oui Unknown) > 74:d4:35:ec:64:73 (oui Unknown), ethertype IPv4 (0x0800), length 118: 172.23.15.73.49186 > legolas.ssh: Flags [P.], seq 2241:2305, ack 6784, win 512, length 64
  145  18:22:54.082889 74:d4:35:ec:64:73 (oui Unknown) > 80:1f:02:ff:ca:5d (oui Unknown), ethertype IPv4 (0x0800), length 54: legolas.ssh > 172.23.15.73.49186: Flags [.], ack 2305, win 5623, length 0
  146  18:22:54.138157 80:1f:02:ff:ca:5d (oui Unknown) > 74:d4:35:ec:64:73 (oui Unknown), ethertype IPv4 (0x0800), length 118: 172.23.15.73.49186 > legolas.ssh: Flags [P.], seq 2305:2369, ack 6784, win 512, length 64
  147  18:22:54.138251 74:d4:35:ec:64:73 (oui Unknown) > 80:1f:02:ff:ca:5d (oui Unknown), ethertype IPv4 (0x0800), length 54: legolas.ssh > 172.23.15.73.49186: Flags [.], ack 2369, win 5623, length 0
  148  18:22:54.470932 80:1f:02:ff:ca:5d (oui Unknown) > 74:d4:35:ec:64:73 (oui Unknown), ethertype IPv4 (0x0800), length 118: 172.23.15.73.49186 > legolas.ssh: Flags [P.], seq 2369:2433, ack 6784, win 512, length 64
  149  18:22:54.470942 74:d4:35:ec:64:73 (oui Unknown) > 80:1f:02:ff:ca:5d (oui Unknown), ethertype IPv4 (0x0800), length 54: legolas.ssh > 172.23.15.73.49186: Flags [.], ack 2433, win 5623, length 0
  150  18:22:54.471047 74:d4:35:ec:64:73 (oui Unknown) > 80:1f:02:ff:ca:5d (oui Unknown), ethertype IPv4 (0x0800), length 102: legolas.ssh > 172.23.15.73.49186: Flags [P.], seq 6784:6832, ack 2433, win 5623, length 48
  151  18:22:54.477121 80:1f:02:ff:ca:5d (oui Unknown) > 74:d4:35:ec:64:73 (oui Unknown), ethertype IPv4 (0x0800), length 118: 172.23.15.73.49186 > legolas.ssh: Flags [P.], seq 2433:2497, ack 6832, win 512, length 64
  152  18:22:54.477128 74:d4:35:ec:64:73 (oui Unknown) > 80:1f:02:ff:ca:5d (oui Unknown), ethertype IPv4 (0x0800), length 54: legolas.ssh > 172.23.15.73.49186: Flags [.], ack 2497, win 5623, length 0
  153  18:22:54.477492 74:d4:35:ec:64:73 (oui Unknown) > 80:1f:02:ff:ca:5d (oui Unknown), ethertype IPv4 (0x0800), length 118: legolas.ssh > 172.23.15.73.49186: Flags [P.], seq 6832:6896, ack 2497, win 5623, length 64
  154  18:22:54.482653 80:1f:02:ff:ca:5d (oui Unknown) > 74:d4:35:ec:64:73 (oui Unknown), ethertype IPv4 (0x0800), length 118: 172.23.15.73.49186 > legolas.ssh: Flags [P.], seq 2497:2561, ack 6896, win 511, length 64
  155  18:22:54.482664 74:d4:35:ec:64:73 (oui Unknown) > 80:1f:02:ff:ca:5d (oui Unknown), ethertype IPv4 (0x0800), length 54: legolas.ssh > 172.23.15.73.49186: Flags [.], ack 2561, win 5623, length 0
  156  18:22:54.503848 74:d4:35:ec:64:73 (oui Unknown) > 80:1f:02:ff:ca:5d (oui Unknown), ethertype IPv4 (0x0800), length 310: legolas.ssh > 172.23.15.73.49186: Flags [P.], seq 6896:7152, ack 2561, win 5623, length 256
  157  18:22:54.512389 80:1f:02:ff:ca:5d (oui Unknown) > 74:d4:35:ec:64:73 (oui Unknown), ethertype IPv4 (0x0800), length 118: 172.23.15.73.49186 > legolas.ssh: Flags [P.], seq 2561:2625, ack 7152, win 510, length 64
  158  18:22:54.554885 74:d4:35:ec:64:73 (oui Unknown) > 80:1f:02:ff:ca:5d (oui Unknown), ethertype IPv4 (0x0800), length 54: legolas.ssh > 172.23.15.73.49186: Flags [.], ack 2625, win 5623, length 0
  159  18:22:54.601861 80:1f:02:ff:ca:5d (oui Unknown) > 74:d4:35:ec:64:73 (oui Unknown), ethertype IPv4 (0x0800), length 118: 172.23.15.73.49186 > legolas.ssh: Flags [P.], seq 2625:2689, ack 7152, win 510, length 64
  160  18:22:54.601890 74:d4:35:ec:64:73 (oui Unknown) > 80:1f:02:ff:ca:5d (oui Unknown), ethertype IPv4 (0x0800), length 54: legolas.ssh > 172.23.15.73.49186: Flags [.], ack 2689, win 5623, length 0
  161  18:22:54.640440 80:1f:02:ff:ca:5d (oui Unknown) > 74:d4:35:ec:64:73 (oui Unknown), ethertype IPv4 (0x0800), length 118: 172.23.15.73.49186 > legolas.ssh: Flags [P.], seq 2689:2753, ack 7152, win 510, length 64
  162  18:22:54.640469 74:d4:35:ec:64:73 (oui Unknown) > 80:1f:02:ff:ca:5d (oui Unknown), ethertype IPv4 (0x0800), length 54: legolas.ssh > 172.23.15.73.49186: Flags [.], ack 2753, win 5623, length 0
  163  18:22:54.640936 74:d4:35:ec:64:73 (oui Unknown) > 80:1f:02:ff:ca:5d (oui Unknown), ethertype IPv4 (0x0800), length 102: legolas.ssh > 172.23.15.73.49186: Flags [P.], seq 7152:7200, ack 2753, win 5623, length 48
  164  18:22:54.646895 80:1f:02:ff:ca:5d (oui Unknown) > 74:d4:35:ec:64:73 (oui Unknown), ethertype IPv4 (0x0800), length 118: 172.23.15.73.49186 > legolas.ssh: Flags [P.], seq 2753:2817, ack 7200, win 510, length 64
  165  18:22:54.646929 74:d4:35:ec:64:73 (oui Unknown) > 80:1f:02:ff:ca:5d (oui Unknown), ethertype IPv4 (0x0800), length 54: legolas.ssh > 172.23.15.73.49186: Flags [.], ack 2817, win 5623, length 0
  166  18:22:54.648262 74:d4:35:ec:64:73 (oui Unknown) > 80:1f:02:ff:ca:5d (oui Unknown), ethertype IPv4 (0x0800), length 118: legolas.ssh > 172.23.15.73.49186: Flags [P.], seq 7200:7264, ack 2817, win 5623, length 64
  167  18:22:54.653684 80:1f:02:ff:ca:5d (oui Unknown) > 74:d4:35:ec:64:73 (oui Unknown), ethertype IPv4 (0x0800), length 118: 172.23.15.73.49186 > legolas.ssh: Flags [P.], seq 2817:2881, ack 7264, win 510, length 64
  168  18:22:54.653701 74:d4:35:ec:64:73 (oui Unknown) > 80:1f:02:ff:ca:5d (oui Unknown), ethertype IPv4 (0x0800), length 54: legolas.ssh > 172.23.15.73.49186: Flags [.], ack 2881, win 5623, length 0
  169  18:22:54.660019 74:d4:35:ec:64:73 (oui Unknown) > 80:1f:02:ff:ca:5d (oui Unknown), ethertype IPv4 (0x0800), length 262: legolas.ssh > 172.23.15.73.49186: Flags [P.], seq 7264:7472, ack 2881, win 5623, length 208
  170  18:22:54.668540 80:1f:02:ff:ca:5d (oui Unknown) > 74:d4:35:ec:64:73 (oui Unknown), ethertype IPv4 (0x0800), length 118: 172.23.15.73.49186 > legolas.ssh: Flags [P.], seq 2881:2945, ack 7472, win 509, length 64
  171  18:22:54.682366 74:d4:35:ec:64:73 (oui Unknown) > 80:1f:02:ff:ca:5d (oui Unknown), ethertype IPv4 (0x0800), length 502: legolas.ssh > 172.23.15.73.49186: Flags [P.], seq 7472:7920, ack 2945, win 5623, length 448
  172  18:22:54.692016 80:1f:02:ff:ca:5d (oui Unknown) > 74:d4:35:ec:64:73 (oui Unknown), ethertype IPv4 (0x0800), length 118: 172.23.15.73.49186 > legolas.ssh: Flags [P.], seq 2945:3009, ack 7920, win 507, length 64
  173  18:22:54.717694 80:1f:02:ff:ca:5d (oui Unknown) > 74:d4:35:ec:64:73 (oui Unknown), ethertype IPv4 (0x0800), length 118: 172.23.15.73.49186 > legolas.ssh: Flags [P.], seq 3009:3073, ack 7920, win 507, length 64
  174  18:22:54.717726 74:d4:35:ec:64:73 (oui Unknown) > 80:1f:02:ff:ca:5d (oui Unknown), ethertype IPv4 (0x0800), length 54: legolas.ssh > 172.23.15.73.49186: Flags [.], ack 3073, win 5623, length 0
  175  18:22:54.777013 00:1f:da:5e:d8:01 (oui Unknown) > 01:80:c2:00:00:00 (oui Unknown), 802.3, length 38: LLC, dsap STP (0x42) Individual, ssap STP (0x42) Command, ctrl 0x03: STP 802.1d, Config, Flags [none], bridge-id 8000.00:1f:da:5e:d8:01.8019, length 35
  176  18:22:54.833305 74:d4:35:ec:64:73 (oui Unknown) > 80:1f:02:ff:ca:5d (oui Unknown), ethertype IPv4 (0x0800), length 134: legolas.ssh > 172.23.15.73.49186: Flags [P.], seq 7920:8000, ack 3073, win 5623, length 80
  177  18:22:54.834144 74:d4:35:ec:64:73 (oui Unknown) > 80:1f:02:ff:ca:5d (oui Unknown), ethertype IPv4 (0x0800), length 150: legolas.ssh > 172.23.15.73.49186: Flags [P.], seq 8000:8096, ack 3073, win 5623, length 96
  178  18:22:54.835006 74:d4:35:ec:64:73 (oui Unknown) > 80:1f:02:ff:ca:5d (oui Unknown), ethertype IPv4 (0x0800), length 182: legolas.ssh > 172.23.15.73.49186: Flags [P.], seq 8096:8224, ack 3073, win 5623, length 128
  179  18:22:54.835066 74:d4:35:ec:64:73 (oui Unknown) > 80:1f:02:ff:ca:5d (oui Unknown), ethertype IPv4 (0x0800), length 102: legolas.ssh > 172.23.15.73.49186: Flags [P.], seq 8224:8272, ack 3073, win 5623, length 48
  180  18:22:54.835976 74:d4:35:ec:64:73 (oui Unknown) > 80:1f:02:ff:ca:5d (oui Unknown), ethertype IPv4 (0x0800), length 118: legolas.ssh > 172.23.15.73.49186: Flags [P.], seq 8272:8336, ack 3073, win 5623, length 64
  181  18:22:54.836073 74:d4:35:ec:64:73 (oui Unknown) > 80:1f:02:ff:ca:5d (oui Unknown), ethertype IPv4 (0x0800), length 102: legolas.ssh > 172.23.15.73.49186: Flags [P.], seq 8336:8384, ack 3073, win 5623, length 48
  182  18:22:54.836899 74:d4:35:ec:64:73 (oui Unknown) > 80:1f:02:ff:ca:5d (oui Unknown), ethertype IPv4 (0x0800), length 102: legolas.ssh > 172.23.15.73.49186: Flags [P.], seq 8384:8432, ack 3073, win 5623, length 48
  183  18:22:54.837003 74:d4:35:ec:64:73 (oui Unknown) > 80:1f:02:ff:ca:5d (oui Unknown), ethertype IPv4 (0x0800), length 102: legolas.ssh > 172.23.15.73.49186: Flags [P.], seq 8432:8480, ack 3073, win 5623, length 48
  184  18:22:54.839756 80:1f:02:ff:ca:5d (oui Unknown) > 74:d4:35:ec:64:73 (oui Unknown), ethertype IPv4 (0x0800), length 60: 172.23.15.73.49186 > legolas.ssh: Flags [.], ack 8096, win 507, length 0
  185  18:22:54.840341 80:1f:02:ff:ca:5d (oui Unknown) > 74:d4:35:ec:64:73 (oui Unknown), ethertype IPv4 (0x0800), length 60: 172.23.15.73.49186 > legolas.ssh: Flags [.], ack 8272, win 512, length 0
  186  18:22:54.840876 80:1f:02:ff:ca:5d (oui Unknown) > 74:d4:35:ec:64:73 (oui Unknown), ethertype IPv4 (0x0800), length 60: 172.23.15.73.49186 > legolas.ssh: Flags [.], ack 8384, win 511, length 0
  187  18:22:54.841252 80:1f:02:ff:ca:5d (oui Unknown) > 74:d4:35:ec:64:73 (oui Unknown), ethertype IPv4 (0x0800), length 60: 172.23.15.73.49186 > legolas.ssh: Flags [.], ack 8480, win 511, length 0
  188  18:22:54.872790 80:1f:02:ff:ca:5d (oui Unknown) > 74:d4:35:ec:64:73 (oui Unknown), ethertype IPv4 (0x0800), length 118: 172.23.15.73.49186 > legolas.ssh: Flags [P.], seq 3073:3137, ack 8480, win 511, length 64
