    1  18:14:35.463881 74:d4:35:ec:64:73 (oui Unknown) > 80:1f:02:ff:ca:5d (oui Unknown), ethertype IPv4 (0x0800), length 630: legolas.ssh > 172.23.15.73.49186: Flags [P.], seq 2923497824:2923498400, ack 2261249376, win 5393, length 576
    2  18:14:35.470878 80:1f:02:ff:ca:5d (oui Unknown) > 74:d4:35:ec:64:73 (oui Unknown), ethertype IPv4 (0x0800), length 150: 172.23.15.73.49186 > legolas.ssh: Flags [P.], seq 1:97, ack 576, win 512, length 96
    3  18:14:35.470957 74:d4:35:ec:64:73 (oui Unknown) > 80:1f:02:ff:ca:5d (oui Unknown), ethertype IPv4 (0x0800), length 102: legolas.ssh > 172.23.15.73.49186: Flags [P.], seq 576:624, ack 97, win 5393, length 48
    4  18:14:35.473700 80:1f:02:ff:ca:5d (oui Unknown) > 74:d4:35:ec:64:73 (oui Unknown), ethertype IPv4 (0x0800), length 118: 172.23.15.73.49186 > legolas.ssh: Flags [P.], seq 97:161, ack 576, win 512, length 64
    5  18:14:35.483105 80:1f:02:ff:ca:5d (oui Unknown) > 74:d4:35:ec:64:73 (oui Unknown), ethertype IPv4 (0x0800), length 118: 172.23.15.73.49186 > legolas.ssh: Flags [P.], seq 161:225, ack 624, win 512, length 64
    6  18:14:35.483136 74:d4:35:ec:64:73 (oui Unknown) > 80:1f:02:ff:ca:5d (oui Unknown), ethertype IPv4 (0x0800), length 54: legolas.ssh > 172.23.15.73.49186: Flags [.], ack 225, win 5393, length 0
    7  18:14:35.483284 74:d4:35:ec:64:73 (oui Unknown) > 80:1f:02:ff:ca:5d (oui Unknown), ethertype IPv4 (0x0800), length 102: legolas.ssh > 172.23.15.73.49186: Flags [P.], seq 624:672, ack 225, win 5393, length 48
    8  18:14:35.488126 80:1f:02:ff:ca:5d (oui Unknown) > 74:d4:35:ec:64:73 (oui Unknown), ethertype IPv4 (0x0800), length 118: 172.23.15.73.49186 > legolas.ssh: Flags [P.], seq 225:289, ack 672, win 511, length 64
    9  18:14:35.488697 74:d4:35:ec:64:73 (oui Unknown) > 80:1f:02:ff:ca:5d (oui Unknown), ethertype IPv4 (0x0800), length 118: legolas.ssh > 172.23.15.73.49186: Flags [P.], seq 672:736, ack 289, win 5393, length 64
   10  18:14:35.494092 80:1f:02:ff:ca:5d (oui Unknown) > 74:d4:35:ec:64:73 (oui Unknown), ethertype IPv4 (0x0800), length 118: 172.23.15.73.49186 > legolas.ssh: Flags [P.], seq 289:353, ack 736, win 511, length 64
   11  18:14:35.494837 74:d4:35:ec:64:73 (oui Unknown) > 80:1f:02:ff:ca:5d (oui Unknown), ethertype IPv4 (0x0800), length 790: legolas.ssh > 172.23.15.73.49186: Flags [P.], seq 736:1472, ack 353, win 5393, length 736
   12  18:14:35.504604 80:1f:02:ff:ca:5d (oui Unknown) > 74:d4:35:ec:64:73 (oui Unknown), ethertype IPv4 (0x0800), length 118: 172.23.15.73.49186 > legolas.ssh: Flags [P.], seq 353:417, ack 1472, win 508, length 64
   13  18:14:35.514819 80:1f:02:ff:ca:5d (oui Unknown) > 74:d4:35:ec:64:73 (oui Unknown), ethertype IPv4 (0x0800), length 118: 172.23.15.73.49186 > legolas.ssh: Flags [P.], seq 417:481, ack 1472, win 508, length 64
   14  18:14:35.514858 74:d4:35:ec:64:73 (oui Unknown) > 80:1f:02:ff:ca:5d (oui Unknown), ethertype IPv4 (0x0800), length 54: legolas.ssh > 172.23.15.73.49186: Flags [.], ack 481, win 5393, length 0
   15  18:14:35.515000 74:d4:35:ec:64:73 (oui Unknown) > 80:1f:02:ff:ca:5d (oui Unknown), ethertype IPv4 (0x0800), length 102: legolas.ssh > 172.23.15.73.49186: Flags [P.], seq 1472:1520, ack 481, win 5393, length 48
   16  18:14:35.521462 80:1f:02:ff:ca:5d (oui Unknown) > 74:d4:35:ec:64:73 (oui Unknown), ethertype IPv4 (0x0800), length 118: 172.23.15.73.49186 > legolas.ssh: Flags [P.], seq 481:545, ack 1520, win 508, length 64
   17  18:14:35.521981 74:d4:35:ec:64:73 (oui Unknown) > 80:1f:02:ff:ca:5d (oui Unknown), ethertype IPv4 (0x0800), length 118: legolas.ssh > 172.23.15.73.49186: Flags [P.], seq 1520:1584, ack 545, win 5393, length 64
   18  18:14:35.525914 74:d4:35:ec:64:73 (oui Unknown) > 80:1f:02:ff:ca:5d (oui Unknown), ethertype IPv4 (0x0800), length 374: legolas.ssh > 172.23.15.73.49186: Flags [P.], seq 1584:1904, ack 545, win 5393, length 320
   19  18:14:35.528557 80:1f:02:ff:ca:5d (oui Unknown) > 74:d4:35:ec:64:73 (oui Unknown), ethertype IPv4 (0x0800), length 118: 172.23.15.73.49186 > legolas.ssh: Flags [P.], seq 545:609, ack 1584, win 508, length 64
   20  18:14:35.534461 80:1f:02:ff:ca:5d (oui Unknown) > 74:d4:35:ec:64:73 (oui Unknown), ethertype IPv4 (0x0800), length 118: 172.23.15.73.49186 > legolas.ssh: Flags [P.], seq 609:673, ack 1904, win 507, length 64
   21  18:14:35.534491 74:d4:35:ec:64:73 (oui Unknown) > 80:1f:02:ff:ca:5d (oui Unknown), ethertype IPv4 (0x0800), length 54: legolas.ssh > 172.23.15.73.49186: Flags [.], ack 673, win 5393, length 0
   22  18:14:35.545635 80:1f:02:ff:ca:5d (oui Unknown) > 74:d4:35:ec:64:73 (oui Unknown), ethertype IPv4 (0x0800), length 118: 172.23.15.73.49186 > legolas.ssh: Flags [P.], seq 673:737, ack 1904, win 507, length 64
   23  18:14:35.586858 74:d4:35:ec:64:73 (oui Unknown) > 80:1f:02:ff:ca:5d (oui Unknown), ethertype IPv4 (0x0800), length 54: legolas.ssh > 172.23.15.73.49186: Flags [.], ack 737, win 5393, length 0
   24  18:14:36.090029 74:d4:35:ec:64:73 (oui Unknown) > 80:1f:02:ff:ca:5d (oui Unknown), ethertype IPv4 (0x0800), length 134: legolas.ssh > 172.23.15.73.49186: Flags [P.], seq 1904:1984, ack 737, win 5393, length 80
   25  18:14:36.090849 74:d4:35:ec:64:73 (oui Unknown) > 80:1f:02:ff:ca:5d (oui Unknown), ethertype IPv4 (0x0800), length 150: legolas.ssh > 172.23.15.73.49186: Flags [P.], seq 1984:2080, ack 737, win 5393, length 96
   26  18:14:36.091671 74:d4:35:ec:64:73 (oui Unknown) > 80:1f:02:ff:ca:5d (oui Unknown), ethertype IPv4 (0x0800), length 166: legolas.ssh > 172.23.15.73.49186: Flags [P.], seq 2080:2192, ack 737, win 5393, length 112
   27  18:14:36.091736 74:d4:35:ec:64:73 (oui Unknown) > 80:1f:02:ff:ca:5d (oui Unknown), ethertype IPv4 (0x0800), length 102: legolas.ssh > 172.23.15.73.49186: Flags [P.], seq 2192:2240, ack 737, win 5393, length 48
   28  18:14:36.092640 74:d4:35:ec:64:73 (oui Unknown) > 80:1f:02:ff:ca:5d (oui Unknown), ethertype IPv4 (0x0800), length 118: legolas.ssh > 172.23.15.73.49186: Flags [P.], seq 2240:2304, ack 737, win 5393, length 64
   29  18:14:36.092738 74:d4:35:ec:64:73 (oui Unknown) > 80:1f:02:ff:ca:5d (oui Unknown), ethertype IPv4 (0x0800), length 102: legolas.ssh > 172.23.15.73.49186: Flags [P.], seq 2304:2352, ack 737, win 5393, length 48
   30  18:14:36.093578 74:d4:35:ec:64:73 (oui Unknown) > 80:1f:02:ff:ca:5d (oui Unknown), ethertype IPv4 (0x0800), length 102: legolas.ssh > 172.23.15.73.49186: Flags [P.], seq 2352:2400, ack 737, win 5393, length 48
   31  18:14:36.093677 74:d4:35:ec:64:73 (oui Unknown) > 80:1f:02:ff:ca:5d (oui Unknown), ethertype IPv4 (0x0800), length 102: legolas.ssh > 172.23.15.73.49186: Flags [P.], seq 2400:2448, ack 737, win 5393, length 48
   32  18:14:36.096298 80:1f:02:ff:ca:5d (oui Unknown) > 74:d4:35:ec:64:73 (oui Unknown), ethertype IPv4 (0x0800), length 60: 172.23.15.73.49186 > legolas.ssh: Flags [.], ack 2080, win 512, length 0
   33  18:14:36.096298 80:1f:02:ff:ca:5d (oui Unknown) > 74:d4:35:ec:64:73 (oui Unknown), ethertype IPv4 (0x0800), length 60: 172.23.15.73.49186 > legolas.ssh: Flags [.], ack 2240, win 511, length 0
   34  18:14:36.096738 80:1f:02:ff:ca:5d (oui Unknown) > 74:d4:35:ec:64:73 (oui Unknown), ethertype IPv4 (0x0800), length 60: 172.23.15.73.49186 > legolas.ssh: Flags [.], ack 2352, win 511, length 0
   35  18:14:36.097763 80:1f:02:ff:ca:5d (oui Unknown) > 74:d4:35:ec:64:73 (oui Unknown), ethertype IPv4 (0x0800), length 60: 172.23.15.73.49186 > legolas.ssh: Flags [.], ack 2448, win 510, length 0
   36  18:14:36.123013 74:d4:35:ec:64:73 (oui Unknown) > 80:1f:02:ff:ca:5d (oui Unknown), ethertype IPv4 (0x0800), length 326: legolas.ssh > 172.23.15.73.49186: Flags [P.], seq 2448:2720, ack 737, win 5393, length 272
   37  18:14:36.131350 80:1f:02:ff:ca:5d (oui Unknown) > 74:d4:35:ec:64:73 (oui Unknown), ethertype IPv4 (0x0800), length 118: 172.23.15.73.49186 > legolas.ssh: Flags [P.], seq 737:801, ack 2720, win 509, length 64
   38  18:14:36.131367 74:d4:35:ec:64:73 (oui Unknown) > 80:1f:02:ff:ca:5d (oui Unknown), ethertype IPv4 (0x0800), length 54: legolas.ssh > 172.23.15.73.49186: Flags [.], ack 801, win 5393, length 0
   39  18:14:36.475607 74:d4:35:ec:64:73 (oui Unknown) > 80:1f:02:ff:ca:5d (oui Unknown), ethertype IPv4 (0x0800), length 96: legolas.56903 > ro-dc4.romania.luxoft.com.domain: 42925+ [1au] PTR? 73.15.23.172.in-addr.arpa. (54)
   40  18:14:36.476980 80:1f:02:ff:ca:5d (oui Unknown) > 74:d4:35:ec:64:73 (oui Unknown), ethertype IPv4 (0x0800), length 131: ro-dc4.romania.luxoft.com.domain > legolas.56903: 42925 NXDomain 0/1/1 (89)
   41  18:14:36.477087 74:d4:35:ec:64:73 (oui Unknown) > 80:1f:02:ff:ca:5d (oui Unknown), ethertype IPv4 (0x0800), length 85: legolas.56903 > ro-dc4.romania.luxoft.com.domain: 42925+ PTR? 73.15.23.172.in-addr.arpa. (43)
   42  18:14:36.477449 80:1f:02:ff:ca:5d (oui Unknown) > 74:d4:35:ec:64:73 (oui Unknown), ethertype IPv4 (0x0800), length 120: ro-dc4.romania.luxoft.com.domain > legolas.56903: 42925 NXDomain 0/1/0 (78)
   43  18:14:36.725148 74:d4:35:ec:64:73 (oui Unknown) > 80:1f:02:ff:ca:5d (oui Unknown), ethertype IPv4 (0x0800), length 262: legolas.ssh > 172.23.15.73.49186: Flags [P.], seq 2720:2928, ack 801, win 5393, length 208
   44  18:14:36.733236 80:1f:02:ff:ca:5d (oui Unknown) > 74:d4:35:ec:64:73 (oui Unknown), ethertype IPv4 (0x0800), length 118: 172.23.15.73.49186 > legolas.ssh: Flags [P.], seq 801:865, ack 2928, win 508, length 64
   45  18:14:36.733284 74:d4:35:ec:64:73 (oui Unknown) > 80:1f:02:ff:ca:5d (oui Unknown), ethertype IPv4 (0x0800), length 54: legolas.ssh > 172.23.15.73.49186: Flags [.], ack 865, win 5393, length 0
   46  18:14:36.762854 00:1f:da:5e:d8:01 (oui Unknown) > 01:80:c2:00:00:00 (oui Unknown), 802.3, length 38: LLC, dsap STP (0x42) Individual, ssap STP (0x42) Command, ctrl 0x03: STP 802.1d, Config, Flags [none], bridge-id 8000.00:1f:da:5e:d8:01.8019, length 35
   47  18:14:37.096103 74:d4:35:ec:64:73 (oui Unknown) > 80:1f:02:ff:ca:5d (oui Unknown), ethertype IPv4 (0x0800), length 134: legolas.ssh > 172.23.15.73.49186: Flags [P.], seq 2928:3008, ack 865, win 5393, length 80
   48  18:14:37.096926 74:d4:35:ec:64:73 (oui Unknown) > 80:1f:02:ff:ca:5d (oui Unknown), ethertype IPv4 (0x0800), length 150: legolas.ssh > 172.23.15.73.49186: Flags [P.], seq 3008:3104, ack 865, win 5393, length 96
   49  18:14:37.097761 74:d4:35:ec:64:73 (oui Unknown) > 80:1f:02:ff:ca:5d (oui Unknown), ethertype IPv4 (0x0800), length 166: legolas.ssh > 172.23.15.73.49186: Flags [P.], seq 3104:3216, ack 865, win 5393, length 112
   50  18:14:37.097807 74:d4:35:ec:64:73 (oui Unknown) > 80:1f:02:ff:ca:5d (oui Unknown), ethertype IPv4 (0x0800), length 102: legolas.ssh > 172.23.15.73.49186: Flags [P.], seq 3216:3264, ack 865, win 5393, length 48
   51  18:14:37.098713 74:d4:35:ec:64:73 (oui Unknown) > 80:1f:02:ff:ca:5d (oui Unknown), ethertype IPv4 (0x0800), length 134: legolas.ssh > 172.23.15.73.49186: Flags [P.], seq 3264:3344, ack 865, win 5393, length 80
   52  18:14:37.098800 74:d4:35:ec:64:73 (oui Unknown) > 80:1f:02:ff:ca:5d (oui Unknown), ethertype IPv4 (0x0800), length 102: legolas.ssh > 172.23.15.73.49186: Flags [P.], seq 3344:3392, ack 865, win 5393, length 48
   53  18:14:37.099634 74:d4:35:ec:64:73 (oui Unknown) > 80:1f:02:ff:ca:5d (oui Unknown), ethertype IPv4 (0x0800), length 102: legolas.ssh > 172.23.15.73.49186: Flags [P.], seq 3392:3440, ack 865, win 5393, length 48
   54  18:14:37.099740 74:d4:35:ec:64:73 (oui Unknown) > 80:1f:02:ff:ca:5d (oui Unknown), ethertype IPv4 (0x0800), length 102: legolas.ssh > 172.23.15.73.49186: Flags [P.], seq 3440:3488, ack 865, win 5393, length 48
   55  18:14:37.101395 80:1f:02:ff:ca:5d (oui Unknown) > 74:d4:35:ec:64:73 (oui Unknown), ethertype IPv4 (0x0800), length 60: 172.23.15.73.49186 > legolas.ssh: Flags [.], ack 3104, win 508, length 0
   56  18:14:37.101581 80:1f:02:ff:ca:5d (oui Unknown) > 74:d4:35:ec:64:73 (oui Unknown), ethertype IPv4 (0x0800), length 60: 172.23.15.73.49186 > legolas.ssh: Flags [.], ack 3264, win 507, length 0
   57  18:14:37.103219 80:1f:02:ff:ca:5d (oui Unknown) > 74:d4:35:ec:64:73 (oui Unknown), ethertype IPv4 (0x0800), length 60: 172.23.15.73.49186 > legolas.ssh: Flags [.], ack 3392, win 507, length 0
   58  18:14:37.103447 80:1f:02:ff:ca:5d (oui Unknown) > 74:d4:35:ec:64:73 (oui Unknown), ethertype IPv4 (0x0800), length 60: 172.23.15.73.49186 > legolas.ssh: Flags [.], ack 3488, win 512, length 0
   59  18:14:37.325535 74:d4:35:ec:64:73 (oui Unknown) > 80:1f:02:ff:ca:5d (oui Unknown), ethertype IPv4 (0x0800), length 246: legolas.ssh > 172.23.15.73.49186: Flags [P.], seq 3488:3680, ack 865, win 5393, length 192
   60  18:14:37.334664 80:1f:02:ff:ca:5d (oui Unknown) > 74:d4:35:ec:64:73 (oui Unknown), ethertype IPv4 (0x0800), length 118: 172.23.15.73.49186 > legolas.ssh: Flags [P.], seq 865:929, ack 3680, win 511, length 64
   61  18:14:37.334675 74:d4:35:ec:64:73 (oui Unknown) > 80:1f:02:ff:ca:5d (oui Unknown), ethertype IPv4 (0x0800), length 54: legolas.ssh > 172.23.15.73.49186: Flags [.], ack 929, win 5393, length 0
   62  18:14:37.898609 1c:1b:0d:8a:d3:34 (oui Unknown) > Broadcast, ethertype ARP (0x0806), length 60: Request who-has 10.10.0.120 tell hmi, length 46
   63  18:14:37.927389 74:d4:35:ec:64:73 (oui Unknown) > 80:1f:02:ff:ca:5d (oui Unknown), ethertype IPv4 (0x0800), length 246: legolas.ssh > 172.23.15.73.49186: Flags [P.], seq 3680:3872, ack 929, win 5393, length 192
   64  18:14:37.937459 80:1f:02:ff:ca:5d (oui Unknown) > 74:d4:35:ec:64:73 (oui Unknown), ethertype IPv4 (0x0800), length 102: 172.23.15.73.49186 > legolas.ssh: Flags [P.], seq 929:977, ack 3872, win 510, length 48
   65  18:14:37.937506 74:d4:35:ec:64:73 (oui Unknown) > 80:1f:02:ff:ca:5d (oui Unknown), ethertype IPv4 (0x0800), length 54: legolas.ssh > 172.23.15.73.49186: Flags [.], ack 977, win 5393, length 0
   66  18:14:38.102132 74:d4:35:ec:64:73 (oui Unknown) > 80:1f:02:ff:ca:5d (oui Unknown), ethertype IPv4 (0x0800), length 134: legolas.ssh > 172.23.15.73.49186: Flags [P.], seq 3872:3952, ack 977, win 5393, length 80
   67  18:14:38.102955 74:d4:35:ec:64:73 (oui Unknown) > 80:1f:02:ff:ca:5d (oui Unknown), ethertype IPv4 (0x0800), length 134: legolas.ssh > 172.23.15.73.49186: Flags [P.], seq 3952:4032, ack 977, win 5393, length 80
   68  18:14:38.103802 74:d4:35:ec:64:73 (oui Unknown) > 80:1f:02:ff:ca:5d (oui Unknown), ethertype IPv4 (0x0800), length 166: legolas.ssh > 172.23.15.73.49186: Flags [P.], seq 4032:4144, ack 977, win 5393, length 112
   69  18:14:38.103848 74:d4:35:ec:64:73 (oui Unknown) > 80:1f:02:ff:ca:5d (oui Unknown), ethertype IPv4 (0x0800), length 102: legolas.ssh > 172.23.15.73.49186: Flags [P.], seq 4144:4192, ack 977, win 5393, length 48
   70  18:14:38.104758 74:d4:35:ec:64:73 (oui Unknown) > 80:1f:02:ff:ca:5d (oui Unknown), ethertype IPv4 (0x0800), length 118: legolas.ssh > 172.23.15.73.49186: Flags [P.], seq 4192:4256, ack 977, win 5393, length 64
   71  18:14:38.104846 74:d4:35:ec:64:73 (oui Unknown) > 80:1f:02:ff:ca:5d (oui Unknown), ethertype IPv4 (0x0800), length 102: legolas.ssh > 172.23.15.73.49186: Flags [P.], seq 4256:4304, ack 977, win 5393, length 48
   72  18:14:38.105658 74:d4:35:ec:64:73 (oui Unknown) > 80:1f:02:ff:ca:5d (oui Unknown), ethertype IPv4 (0x0800), length 102: legolas.ssh > 172.23.15.73.49186: Flags [P.], seq 4304:4352, ack 977, win 5393, length 48
   73  18:14:38.105764 74:d4:35:ec:64:73 (oui Unknown) > 80:1f:02:ff:ca:5d (oui Unknown), ethertype IPv4 (0x0800), length 102: legolas.ssh > 172.23.15.73.49186: Flags [P.], seq 4352:4400, ack 977, win 5393, length 48
   74  18:14:38.107494 80:1f:02:ff:ca:5d (oui Unknown) > 74:d4:35:ec:64:73 (oui Unknown), ethertype IPv4 (0x0800), length 60: 172.23.15.73.49186 > legolas.ssh: Flags [.], ack 4032, win 510, length 0
   75  18:14:38.107935 80:1f:02:ff:ca:5d (oui Unknown) > 74:d4:35:ec:64:73 (oui Unknown), ethertype IPv4 (0x0800), length 60: 172.23.15.73.49186 > legolas.ssh: Flags [.], ack 4192, win 509, length 0
   76  18:14:38.109250 80:1f:02:ff:ca:5d (oui Unknown) > 74:d4:35:ec:64:73 (oui Unknown), ethertype IPv4 (0x0800), length 60: 172.23.15.73.49186 > legolas.ssh: Flags [.], ack 4304, win 509, length 0
   77  18:14:38.109509 80:1f:02:ff:ca:5d (oui Unknown) > 74:d4:35:ec:64:73 (oui Unknown), ethertype IPv4 (0x0800), length 60: 172.23.15.73.49186 > legolas.ssh: Flags [.], ack 4400, win 508, length 0
   78  18:14:38.523100 74:d4:35:ec:64:73 (oui Unknown) > 80:1f:02:ff:ca:5d (oui Unknown), ethertype IPv4 (0x0800), length 95: legolas.44867 > ro-dc4.romania.luxoft.com.domain: 35574+ [1au] PTR? 120.0.10.10.in-addr.arpa. (53)
   79  18:14:38.527747 74:d4:35:ec:64:73 (oui Unknown) > 80:1f:02:ff:ca:5d (oui Unknown), ethertype IPv4 (0x0800), length 246: legolas.ssh > 172.23.15.73.49186: Flags [P.], seq 4400:4592, ack 977, win 5393, length 192
   80  18:14:38.537204 80:1f:02:ff:ca:5d (oui Unknown) > 74:d4:35:ec:64:73 (oui Unknown), ethertype IPv4 (0x0800), length 118: 172.23.15.73.49186 > legolas.ssh: Flags [P.], seq 977:1041, ack 4592, win 507, length 64
   81  18:14:38.537252 74:d4:35:ec:64:73 (oui Unknown) > 80:1f:02:ff:ca:5d (oui Unknown), ethertype IPv4 (0x0800), length 54: legolas.ssh > 172.23.15.73.49186: Flags [.], ack 1041, win 5393, length 0
   82  18:14:38.550730 80:1f:02:ff:ca:5d (oui Unknown) > 74:d4:35:ec:64:73 (oui Unknown), ethertype IPv4 (0x0800), length 95: ro-dc4.romania.luxoft.com.domain > legolas.44867: 35574 NXDomain 0/0/1 (53)
   83  18:14:38.550958 74:d4:35:ec:64:73 (oui Unknown) > 80:1f:02:ff:ca:5d (oui Unknown), ethertype IPv4 (0x0800), length 84: legolas.44867 > ro-dc4.romania.luxoft.com.domain: 35574+ PTR? 120.0.10.10.in-addr.arpa. (42)
   84  18:14:38.551623 80:1f:02:ff:ca:5d (oui Unknown) > 74:d4:35:ec:64:73 (oui Unknown), ethertype IPv4 (0x0800), length 84: ro-dc4.romania.luxoft.com.domain > legolas.44867: 35574 NXDomain 0/0/0 (42)
   85  18:14:38.763034 00:1f:da:5e:d8:01 (oui Unknown) > 01:80:c2:00:00:00 (oui Unknown), 802.3, length 38: LLC, dsap STP (0x42) Individual, ssap STP (0x42) Command, ctrl 0x03: STP 802.1d, Config, Flags [none], bridge-id 8000.00:1f:da:5e:d8:01.8019, length 35
   86  18:14:38.923539 1c:1b:0d:8a:d3:34 (oui Unknown) > Broadcast, ethertype ARP (0x0806), length 60: Request who-has 10.10.0.120 tell hmi, length 46
   87  18:14:39.107862 74:d4:35:ec:64:73 (oui Unknown) > 80:1f:02:ff:ca:5d (oui Unknown), ethertype IPv4 (0x0800), length 118: legolas.ssh > 172.23.15.73.49186: Flags [P.], seq 4592:4656, ack 1041, win 5393, length 64
   88  18:14:39.108616 74:d4:35:ec:64:73 (oui Unknown) > 80:1f:02:ff:ca:5d (oui Unknown), ethertype IPv4 (0x0800), length 134: legolas.ssh > 172.23.15.73.49186: Flags [P.], seq 4656:4736, ack 1041, win 5393, length 80
   89  18:14:39.109167 74:d4:35:ec:64:73 (oui Unknown) > 80:1f:02:ff:ca:5d (oui Unknown), ethertype IPv4 (0x0800), length 182: legolas.ssh > 172.23.15.73.49186: Flags [P.], seq 4736:4864, ack 1041, win 5393, length 128
   90  18:14:39.109197 74:d4:35:ec:64:73 (oui Unknown) > 80:1f:02:ff:ca:5d (oui Unknown), ethertype IPv4 (0x0800), length 102: legolas.ssh > 172.23.15.73.49186: Flags [P.], seq 4864:4912, ack 1041, win 5393, length 48
   91  18:14:39.109799 74:d4:35:ec:64:73 (oui Unknown) > 80:1f:02:ff:ca:5d (oui Unknown), ethertype IPv4 (0x0800), length 118: legolas.ssh > 172.23.15.73.49186: Flags [P.], seq 4912:4976, ack 1041, win 5393, length 64
   92  18:14:39.109899 74:d4:35:ec:64:73 (oui Unknown) > 80:1f:02:ff:ca:5d (oui Unknown), ethertype IPv4 (0x0800), length 102: legolas.ssh > 172.23.15.73.49186: Flags [P.], seq 4976:5024, ack 1041, win 5393, length 48
   93  18:14:39.110717 74:d4:35:ec:64:73 (oui Unknown) > 80:1f:02:ff:ca:5d (oui Unknown), ethertype IPv4 (0x0800), length 102: legolas.ssh > 172.23.15.73.49186: Flags [P.], seq 5024:5072, ack 1041, win 5393, length 48
   94  18:14:39.110831 74:d4:35:ec:64:73 (oui Unknown) > 80:1f:02:ff:ca:5d (oui Unknown), ethertype IPv4 (0x0800), length 102: legolas.ssh > 172.23.15.73.49186: Flags [P.], seq 5072:5120, ack 1041, win 5393, length 48
   95  18:14:39.128212 74:d4:35:ec:64:73 (oui Unknown) > 80:1f:02:ff:ca:5d (oui Unknown), ethertype IPv4 (0x0800), length 246: legolas.ssh > 172.23.15.73.49186: Flags [P.], seq 5120:5312, ack 1041, win 5393, length 192
   96  18:14:39.144280 80:1f:02:ff:ca:5d (oui Unknown) > 74:d4:35:ec:64:73 (oui Unknown), ethertype IPv4 (0x0800), length 60: 172.23.15.73.49186 > legolas.ssh: Flags [.], ack 4736, win 507, length 0
   97  18:14:39.144707 80:1f:02:ff:ca:5d (oui Unknown) > 74:d4:35:ec:64:73 (oui Unknown), ethertype IPv4 (0x0800), length 60: 172.23.15.73.49186 > legolas.ssh: Flags [.], ack 4912, win 512, length 0
   98  18:14:39.144907 80:1f:02:ff:ca:5d (oui Unknown) > 74:d4:35:ec:64:73 (oui Unknown), ethertype IPv4 (0x0800), length 60: 172.23.15.73.49186 > legolas.ssh: Flags [.], ack 5024, win 511, length 0
   99  18:14:39.145055 80:1f:02:ff:ca:5d (oui Unknown) > 74:d4:35:ec:64:73 (oui Unknown), ethertype IPv4 (0x0800), length 60: 172.23.15.73.49186 > legolas.ssh: Flags [.], ack 5120, win 511, length 0
  100  18:14:39.148383 80:1f:02:ff:ca:5d (oui Unknown) > 74:d4:35:ec:64:73 (oui Unknown), ethertype IPv4 (0x0800), length 118: 172.23.15.73.49186 > legolas.ssh: Flags [P.], seq 1041:1105, ack 5312, win 510, length 64
  101  18:14:39.148400 74:d4:35:ec:64:73 (oui Unknown) > 80:1f:02:ff:ca:5d (oui Unknown), ethertype IPv4 (0x0800), length 54: legolas.ssh > 172.23.15.73.49186: Flags [.], ack 1105, win 5393, length 0
  102  18:14:39.376938 00:1f:da:5e:d8:01 (oui Unknown) > 01:00:81:00:01:01 (oui Unknown), 802.3, length 19: LLC, dsap SNAP (0xaa) Individual, ssap SNAP (0xaa) Command, ctrl 0x03: oui Nortel Networks SONMP (0x000081), pid Unknown (0x01a1), length 11: 
	0x0000:  aaaa 0300 0081 01a1 c0a8 0101 0001 199f  ................
	0x0010:  0c02 00                                  ...
  103  18:14:39.730082 74:d4:35:ec:64:73 (oui Unknown) > 80:1f:02:ff:ca:5d (oui Unknown), ethertype IPv4 (0x0800), length 246: legolas.ssh > 172.23.15.73.49186: Flags [P.], seq 5312:5504, ack 1105, win 5393, length 192
  104  18:14:39.738957 80:1f:02:ff:ca:5d (oui Unknown) > 74:d4:35:ec:64:73 (oui Unknown), ethertype IPv4 (0x0800), length 118: 172.23.15.73.49186 > legolas.ssh: Flags [P.], seq 1105:1169, ack 5504, win 509, length 64
  105  18:14:39.739005 74:d4:35:ec:64:73 (oui Unknown) > 80:1f:02:ff:ca:5d (oui Unknown), ethertype IPv4 (0x0800), length 54: legolas.ssh > 172.23.15.73.49186: Flags [.], ack 1169, win 5393, length 0
  106  18:14:39.947458 1c:1b:0d:8a:d3:34 (oui Unknown) > Broadcast, ethertype ARP (0x0806), length 60: Request who-has 10.10.0.120 tell hmi, length 46
  107  18:14:40.112519 74:d4:35:ec:64:73 (oui Unknown) > 80:1f:02:ff:ca:5d (oui Unknown), ethertype IPv4 (0x0800), length 134: legolas.ssh > 172.23.15.73.49186: Flags [P.], seq 5504:5584, ack 1169, win 5393, length 80
  108  18:14:40.113319 74:d4:35:ec:64:73 (oui Unknown) > 80:1f:02:ff:ca:5d (oui Unknown), ethertype IPv4 (0x0800), length 134: legolas.ssh > 172.23.15.73.49186: Flags [P.], seq 5584:5664, ack 1169, win 5393, length 80
  109  18:14:40.114334 74:d4:35:ec:64:73 (oui Unknown) > 80:1f:02:ff:ca:5d (oui Unknown), ethertype IPv4 (0x0800), length 182: legolas.ssh > 172.23.15.73.49186: Flags [P.], seq 5664:5792, ack 1169, win 5393, length 128
  110  18:14:40.114361 74:d4:35:ec:64:73 (oui Unknown) > 80:1f:02:ff:ca:5d (oui Unknown), ethertype IPv4 (0x0800), length 102: legolas.ssh > 172.23.15.73.49186: Flags [P.], seq 5792:5840, ack 1169, win 5393, length 48
  111  18:14:40.115150 74:d4:35:ec:64:73 (oui Unknown) > 80:1f:02:ff:ca:5d (oui Unknown), ethertype IPv4 (0x0800), length 118: legolas.ssh > 172.23.15.73.49186: Flags [P.], seq 5840:5904, ack 1169, win 5393, length 64
  112  18:14:40.115247 74:d4:35:ec:64:73 (oui Unknown) > 80:1f:02:ff:ca:5d (oui Unknown), ethertype IPv4 (0x0800), length 102: legolas.ssh > 172.23.15.73.49186: Flags [P.], seq 5904:5952, ack 1169, win 5393, length 48
  113  18:14:40.116074 74:d4:35:ec:64:73 (oui Unknown) > 80:1f:02:ff:ca:5d (oui Unknown), ethertype IPv4 (0x0800), length 102: legolas.ssh > 172.23.15.73.49186: Flags [P.], seq 5952:6000, ack 1169, win 5393, length 48
  114  18:14:40.116175 74:d4:35:ec:64:73 (oui Unknown) > 80:1f:02:ff:ca:5d (oui Unknown), ethertype IPv4 (0x0800), length 102: legolas.ssh > 172.23.15.73.49186: Flags [P.], seq 6000:6048, ack 1169, win 5393, length 48
  115  18:14:40.118273 80:1f:02:ff:ca:5d (oui Unknown) > 74:d4:35:ec:64:73 (oui Unknown), ethertype IPv4 (0x0800), length 60: 172.23.15.73.49186 > legolas.ssh: Flags [.], ack 5664, win 509, length 0
  116  18:14:40.118756 80:1f:02:ff:ca:5d (oui Unknown) > 74:d4:35:ec:64:73 (oui Unknown), ethertype IPv4 (0x0800), length 60: 172.23.15.73.49186 > legolas.ssh: Flags [.], ack 5840, win 508, length 0
  117  18:14:40.119238 80:1f:02:ff:ca:5d (oui Unknown) > 74:d4:35:ec:64:73 (oui Unknown), ethertype IPv4 (0x0800), length 60: 172.23.15.73.49186 > legolas.ssh: Flags [.], ack 5952, win 508, length 0
  118  18:14:40.120377 80:1f:02:ff:ca:5d (oui Unknown) > 74:d4:35:ec:64:73 (oui Unknown), ethertype IPv4 (0x0800), length 60: 172.23.15.73.49186 > legolas.ssh: Flags [.], ack 6048, win 507, length 0
  119  18:14:40.330253 74:d4:35:ec:64:73 (oui Unknown) > 80:1f:02:ff:ca:5d (oui Unknown), ethertype IPv4 (0x0800), length 246: legolas.ssh > 172.23.15.73.49186: Flags [P.], seq 6048:6240, ack 1169, win 5393, length 192
  120  18:14:40.338418 80:1f:02:ff:ca:5d (oui Unknown) > 74:d4:35:ec:64:73 (oui Unknown), ethertype IPv4 (0x0800), length 118: 172.23.15.73.49186 > legolas.ssh: Flags [P.], seq 1169:1233, ack 6240, win 507, length 64
  121  18:14:40.338425 74:d4:35:ec:64:73 (oui Unknown) > 80:1f:02:ff:ca:5d (oui Unknown), ethertype IPv4 (0x0800), length 54: legolas.ssh > 172.23.15.73.49186: Flags [.], ack 1233, win 5393, length 0
  122  18:14:40.764078 00:1f:da:5e:d8:01 (oui Unknown) > 01:80:c2:00:00:00 (oui Unknown), 802.3, length 38: LLC, dsap STP (0x42) Individual, ssap STP (0x42) Command, ctrl 0x03: STP 802.1d, Config, Flags [none], bridge-id 8000.00:1f:da:5e:d8:01.8019, length 35
  123  18:14:40.932079 74:d4:35:ec:64:73 (oui Unknown) > 80:1f:02:ff:ca:5d (oui Unknown), ethertype IPv4 (0x0800), length 246: legolas.ssh > 172.23.15.73.49186: Flags [P.], seq 6240:6432, ack 1233, win 5393, length 192
  124  18:14:40.941175 80:1f:02:ff:ca:5d (oui Unknown) > 74:d4:35:ec:64:73 (oui Unknown), ethertype IPv4 (0x0800), length 118: 172.23.15.73.49186 > legolas.ssh: Flags [P.], seq 1233:1297, ack 6432, win 512, length 64
  125  18:14:40.941222 74:d4:35:ec:64:73 (oui Unknown) > 80:1f:02:ff:ca:5d (oui Unknown), ethertype IPv4 (0x0800), length 54: legolas.ssh > 172.23.15.73.49186: Flags [.], ack 1297, win 5393, length 0
  126  18:14:40.971628 1c:1b:0d:8a:d3:34 (oui Unknown) > Broadcast, ethertype ARP (0x0806), length 60: Request who-has 10.10.0.120 tell hmi, length 46
  127  18:14:41.118268 74:d4:35:ec:64:73 (oui Unknown) > 80:1f:02:ff:ca:5d (oui Unknown), ethertype IPv4 (0x0800), length 134: legolas.ssh > 172.23.15.73.49186: Flags [P.], seq 6432:6512, ack 1297, win 5393, length 80
  128  18:14:41.119109 74:d4:35:ec:64:73 (oui Unknown) > 80:1f:02:ff:ca:5d (oui Unknown), ethertype IPv4 (0x0800), length 150: legolas.ssh > 172.23.15.73.49186: Flags [P.], seq 6512:6608, ack 1297, win 5393, length 96
  129  18:14:41.119944 74:d4:35:ec:64:73 (oui Unknown) > 80:1f:02:ff:ca:5d (oui Unknown), ethertype IPv4 (0x0800), length 166: legolas.ssh > 172.23.15.73.49186: Flags [P.], seq 6608:6720, ack 1297, win 5393, length 112
  130  18:14:41.119989 74:d4:35:ec:64:73 (oui Unknown) > 80:1f:02:ff:ca:5d (oui Unknown), ethertype IPv4 (0x0800), length 102: legolas.ssh > 172.23.15.73.49186: Flags [P.], seq 6720:6768, ack 1297, win 5393, length 48
  131  18:14:41.120892 74:d4:35:ec:64:73 (oui Unknown) > 80:1f:02:ff:ca:5d (oui Unknown), ethertype IPv4 (0x0800), length 118: legolas.ssh > 172.23.15.73.49186: Flags [P.], seq 6768:6832, ack 1297, win 5393, length 64
  132  18:14:41.120986 74:d4:35:ec:64:73 (oui Unknown) > 80:1f:02:ff:ca:5d (oui Unknown), ethertype IPv4 (0x0800), length 102: legolas.ssh > 172.23.15.73.49186: Flags [P.], seq 6832:6880, ack 1297, win 5393, length 48
  133  18:14:41.121811 74:d4:35:ec:64:73 (oui Unknown) > 80:1f:02:ff:ca:5d (oui Unknown), ethertype IPv4 (0x0800), length 102: legolas.ssh > 172.23.15.73.49186: Flags [P.], seq 6880:6928, ack 1297, win 5393, length 48
  134  18:14:41.121912 74:d4:35:ec:64:73 (oui Unknown) > 80:1f:02:ff:ca:5d (oui Unknown), ethertype IPv4 (0x0800), length 102: legolas.ssh > 172.23.15.73.49186: Flags [P.], seq 6928:6976, ack 1297, win 5393, length 48
  135  18:14:41.123849 80:1f:02:ff:ca:5d (oui Unknown) > 74:d4:35:ec:64:73 (oui Unknown), ethertype IPv4 (0x0800), length 60: 172.23.15.73.49186 > legolas.ssh: Flags [.], ack 6608, win 511, length 0
  136  18:14:41.124124 80:1f:02:ff:ca:5d (oui Unknown) > 74:d4:35:ec:64:73 (oui Unknown), ethertype IPv4 (0x0800), length 150: 172.23.15.73.49186 > legolas.ssh: Flags [P.], seq 1297:1393, ack 6608, win 511, length 96
  137  18:14:41.124124 80:1f:02:ff:ca:5d (oui Unknown) > 74:d4:35:ec:64:73 (oui Unknown), ethertype IPv4 (0x0800), length 60: 172.23.15.73.49186 > legolas.ssh: Flags [.], ack 6768, win 510, length 0
  138  18:14:41.124138 74:d4:35:ec:64:73 (oui Unknown) > 80:1f:02:ff:ca:5d (oui Unknown), ethertype IPv4 (0x0800), length 54: legolas.ssh > 172.23.15.73.49186: Flags [.], ack 1393, win 5393, length 0
  139  18:14:41.124251 74:d4:35:ec:64:73 (oui Unknown) > 80:1f:02:ff:ca:5d (oui Unknown), ethertype IPv4 (0x0800), length 102: legolas.ssh > 172.23.15.73.49186: Flags [P.], seq 6976:7024, ack 1393, win 5393, length 48
  140  18:14:41.125232 80:1f:02:ff:ca:5d (oui Unknown) > 74:d4:35:ec:64:73 (oui Unknown), ethertype IPv4 (0x0800), length 60: 172.23.15.73.49186 > legolas.ssh: Flags [.], ack 6880, win 510, length 0
  141  18:14:41.126134 80:1f:02:ff:ca:5d (oui Unknown) > 74:d4:35:ec:64:73 (oui Unknown), ethertype IPv4 (0x0800), length 60: 172.23.15.73.49186 > legolas.ssh: Flags [.], ack 6976, win 510, length 0
  142  18:14:41.183204 80:1f:02:ff:ca:5d (oui Unknown) > 74:d4:35:ec:64:73 (oui Unknown), ethertype IPv4 (0x0800), length 60: 172.23.15.73.49186 > legolas.ssh: Flags [.], ack 7024, win 509, length 0
  143  18:14:41.533154 74:d4:35:ec:64:73 (oui Unknown) > 80:1f:02:ff:ca:5d (oui Unknown), ethertype IPv4 (0x0800), length 246: legolas.ssh > 172.23.15.73.49186: Flags [P.], seq 7024:7216, ack 1393, win 5393, length 192
  144  18:14:41.542961 80:1f:02:ff:ca:5d (oui Unknown) > 74:d4:35:ec:64:73 (oui Unknown), ethertype IPv4 (0x0800), length 118: 172.23.15.73.49186 > legolas.ssh: Flags [P.], seq 1393:1457, ack 7216, win 509, length 64
  145  18:14:41.542996 74:d4:35:ec:64:73 (oui Unknown) > 80:1f:02:ff:ca:5d (oui Unknown), ethertype IPv4 (0x0800), length 54: legolas.ssh > 172.23.15.73.49186: Flags [.], ack 1457, win 5393, length 0
  146  18:14:41.987684 80:1f:02:ff:ca:5d (oui Unknown) > 74:d4:35:ec:64:73 (oui Unknown), ethertype IPv4 (0x0800), length 118: 172.23.15.73.49186 > legolas.ssh: Flags [P.], seq 1457:1521, ack 7216, win 509, length 64
  147  18:14:41.987693 74:d4:35:ec:64:73 (oui Unknown) > 80:1f:02:ff:ca:5d (oui Unknown), ethertype IPv4 (0x0800), length 54: legolas.ssh > 172.23.15.73.49186: Flags [.], ack 1521, win 5393, length 0
  148  18:14:41.987893 74:d4:35:ec:64:73 (oui Unknown) > 80:1f:02:ff:ca:5d (oui Unknown), ethertype IPv4 (0x0800), length 102: legolas.ssh > 172.23.15.73.49186: Flags [P.], seq 7216:7264, ack 1521, win 5393, length 48
  149  18:14:41.993130 80:1f:02:ff:ca:5d (oui Unknown) > 74:d4:35:ec:64:73 (oui Unknown), ethertype IPv4 (0x0800), length 118: 172.23.15.73.49186 > legolas.ssh: Flags [P.], seq 1521:1585, ack 7264, win 509, length 64
  150  18:14:41.993138 74:d4:35:ec:64:73 (oui Unknown) > 80:1f:02:ff:ca:5d (oui Unknown), ethertype IPv4 (0x0800), length 54: legolas.ssh > 172.23.15.73.49186: Flags [.], ack 1585, win 5393, length 0
  151  18:14:41.993603 74:d4:35:ec:64:73 (oui Unknown) > 80:1f:02:ff:ca:5d (oui Unknown), ethertype IPv4 (0x0800), length 118: legolas.ssh > 172.23.15.73.49186: Flags [P.], seq 7264:7328, ack 1585, win 5393, length 64
  152  18:14:41.995509 1c:1b:0d:8a:d3:34 (oui Unknown) > Broadcast, ethertype ARP (0x0806), length 60: Request who-has 10.10.0.120 tell hmi, length 46
  153  18:14:41.999015 80:1f:02:ff:ca:5d (oui Unknown) > 74:d4:35:ec:64:73 (oui Unknown), ethertype IPv4 (0x0800), length 118: 172.23.15.73.49186 > legolas.ssh: Flags [P.], seq 1585:1649, ack 7328, win 508, length 64
  154  18:14:42.020713 74:d4:35:ec:64:73 (oui Unknown) > 80:1f:02:ff:ca:5d (oui Unknown), ethertype IPv4 (0x0800), length 262: legolas.ssh > 172.23.15.73.49186: Flags [P.], seq 7328:7536, ack 1649, win 5393, length 208
  155  18:14:42.026123 80:1f:02:ff:ca:5d (oui Unknown) > 74:d4:35:ec:64:73 (oui Unknown), ethertype IPv4 (0x0800), length 118: 172.23.15.73.49186 > legolas.ssh: Flags [P.], seq 1649:1713, ack 7536, win 507, length 64
  156  18:14:42.029181 80:1f:02:ff:ca:5d (oui Unknown) > 74:d4:35:ec:64:73 (oui Unknown), ethertype IPv4 (0x0800), length 118: 172.23.15.73.49186 > legolas.ssh: Flags [P.], seq 1713:1777, ack 7536, win 507, length 64
  157  18:14:42.029307 74:d4:35:ec:64:73 (oui Unknown) > 80:1f:02:ff:ca:5d (oui Unknown), ethertype IPv4 (0x0800), length 54: legolas.ssh > 172.23.15.73.49186: Flags [.], ack 1777, win 5393, length 0
  158  18:14:42.124078 74:d4:35:ec:64:73 (oui Unknown) > 80:1f:02:ff:ca:5d (oui Unknown), ethertype IPv4 (0x0800), length 118: legolas.ssh > 172.23.15.73.49186: Flags [P.], seq 7536:7600, ack 1777, win 5393, length 64
  159  18:14:42.124896 74:d4:35:ec:64:73 (oui Unknown) > 80:1f:02:ff:ca:5d (oui Unknown), ethertype IPv4 (0x0800), length 134: legolas.ssh > 172.23.15.73.49186: Flags [P.], seq 7600:7680, ack 1777, win 5393, length 80
  160  18:14:42.125743 74:d4:35:ec:64:73 (oui Unknown) > 80:1f:02:ff:ca:5d (oui Unknown), ethertype IPv4 (0x0800), length 182: legolas.ssh > 172.23.15.73.49186: Flags [P.], seq 7680:7808, ack 1777, win 5393, length 128
  161  18:14:42.125789 74:d4:35:ec:64:73 (oui Unknown) > 80:1f:02:ff:ca:5d (oui Unknown), ethertype IPv4 (0x0800), length 102: legolas.ssh > 172.23.15.73.49186: Flags [P.], seq 7808:7856, ack 1777, win 5393, length 48
  162  18:14:42.126676 74:d4:35:ec:64:73 (oui Unknown) > 80:1f:02:ff:ca:5d (oui Unknown), ethertype IPv4 (0x0800), length 118: legolas.ssh > 172.23.15.73.49186: Flags [P.], seq 7856:7920, ack 1777, win 5393, length 64
  163  18:14:42.126765 74:d4:35:ec:64:73 (oui Unknown) > 80:1f:02:ff:ca:5d (oui Unknown), ethertype IPv4 (0x0800), length 102: legolas.ssh > 172.23.15.73.49186: Flags [P.], seq 7920:7968, ack 1777, win 5393, length 48
  164  18:14:42.127589 74:d4:35:ec:64:73 (oui Unknown) > 80:1f:02:ff:ca:5d (oui Unknown), ethertype IPv4 (0x0800), length 102: legolas.ssh > 172.23.15.73.49186: Flags [P.], seq 7968:8016, ack 1777, win 5393, length 48
  165  18:14:42.127695 74:d4:35:ec:64:73 (oui Unknown) > 80:1f:02:ff:ca:5d (oui Unknown), ethertype IPv4 (0x0800), length 102: legolas.ssh > 172.23.15.73.49186: Flags [P.], seq 8016:8064, ack 1777, win 5393, length 48
  166  18:14:42.130288 80:1f:02:ff:ca:5d (oui Unknown) > 74:d4:35:ec:64:73 (oui Unknown), ethertype IPv4 (0x0800), length 60: 172.23.15.73.49186 > legolas.ssh: Flags [.], ack 7680, win 507, length 0
  167  18:14:42.130470 80:1f:02:ff:ca:5d (oui Unknown) > 74:d4:35:ec:64:73 (oui Unknown), ethertype IPv4 (0x0800), length 60: 172.23.15.73.49186 > legolas.ssh: Flags [.], ack 7856, win 512, length 0
  168  18:14:42.130649 80:1f:02:ff:ca:5d (oui Unknown) > 74:d4:35:ec:64:73 (oui Unknown), ethertype IPv4 (0x0800), length 60: 172.23.15.73.49186 > legolas.ssh: Flags [.], ack 7968, win 511, length 0
  169  18:14:42.132076 80:1f:02:ff:ca:5d (oui Unknown) > 74:d4:35:ec:64:73 (oui Unknown), ethertype IPv4 (0x0800), length 60: 172.23.15.73.49186 > legolas.ssh: Flags [.], ack 8064, win 511, length 0
  170  18:14:42.187150 80:1f:02:ff:ca:5d (oui Unknown) > 74:d4:35:ec:64:73 (oui Unknown), ethertype IPv4 (0x0800), length 118: 172.23.15.73.49186 > legolas.ssh: Flags [P.], seq 1777:1841, ack 8064, win 511, length 64
  171  18:14:42.187446 74:d4:35:ec:64:73 (oui Unknown) > 80:1f:02:ff:ca:5d (oui Unknown), ethertype IPv4 (0x0800), length 102: legolas.ssh > 172.23.15.73.49186: Flags [P.], seq 8064:8112, ack 1841, win 5393, length 48
  172  18:14:42.193740 80:1f:02:ff:ca:5d (oui Unknown) > 74:d4:35:ec:64:73 (oui Unknown), ethertype IPv4 (0x0800), length 118: 172.23.15.73.49186 > legolas.ssh: Flags [P.], seq 1841:1905, ack 8112, win 511, length 64
  173  18:14:42.194260 74:d4:35:ec:64:73 (oui Unknown) > 80:1f:02:ff:ca:5d (oui Unknown), ethertype IPv4 (0x0800), length 118: legolas.ssh > 172.23.15.73.49186: Flags [P.], seq 8112:8176, ack 1905, win 5393, length 64
  174  18:14:42.199687 80:1f:02:ff:ca:5d (oui Unknown) > 74:d4:35:ec:64:73 (oui Unknown), ethertype IPv4 (0x0800), length 118: 172.23.15.73.49186 > legolas.ssh: Flags [P.], seq 1905:1969, ack 8176, win 511, length 64
  175  18:14:42.205952 74:d4:35:ec:64:73 (oui Unknown) > 80:1f:02:ff:ca:5d (oui Unknown), ethertype IPv4 (0x0800), length 406: legolas.ssh > 172.23.15.73.49186: Flags [P.], seq 8176:8528, ack 1969, win 5393, length 352
  176  18:14:42.215622 80:1f:02:ff:ca:5d (oui Unknown) > 74:d4:35:ec:64:73 (oui Unknown), ethertype IPv4 (0x0800), length 118: 172.23.15.73.49186 > legolas.ssh: Flags [P.], seq 1969:2033, ack 8528, win 509, length 64
  177  18:14:42.230432 74:d4:35:ec:64:73 (oui Unknown) > 80:1f:02:ff:ca:5d (oui Unknown), ethertype IPv4 (0x0800), length 470: legolas.ssh > 172.23.15.73.49186: Flags [P.], seq 8528:8944, ack 2033, win 5393, length 416
  178  18:14:42.239383 80:1f:02:ff:ca:5d (oui Unknown) > 74:d4:35:ec:64:73 (oui Unknown), ethertype IPv4 (0x0800), length 118: 172.23.15.73.49186 > legolas.ssh: Flags [P.], seq 2033:2097, ack 8944, win 508, length 64
  179  18:14:42.282856 74:d4:35:ec:64:73 (oui Unknown) > 80:1f:02:ff:ca:5d (oui Unknown), ethertype IPv4 (0x0800), length 54: legolas.ssh > 172.23.15.73.49186: Flags [.], ack 2097, win 5393, length 0
  180  18:14:42.327446 80:1f:02:ff:ca:5d (oui Unknown) > 74:d4:35:ec:64:73 (oui Unknown), ethertype IPv4 (0x0800), length 118: 172.23.15.73.49186 > legolas.ssh: Flags [P.], seq 2097:2161, ack 8944, win 508, length 64
  181  18:14:42.327518 74:d4:35:ec:64:73 (oui Unknown) > 80:1f:02:ff:ca:5d (oui Unknown), ethertype IPv4 (0x0800), length 54: legolas.ssh > 172.23.15.73.49186: Flags [.], ack 2161, win 5393, length 0
  182  18:14:42.762961 00:1f:da:5e:d8:01 (oui Unknown) > 01:80:c2:00:00:00 (oui Unknown), 802.3, length 38: LLC, dsap STP (0x42) Individual, ssap STP (0x42) Command, ctrl 0x03: STP 802.1d, Config, Flags [none], bridge-id 8000.00:1f:da:5e:d8:01.8019, length 35
  183  18:14:42.776718 80:1f:02:ff:ca:5d (oui Unknown) > 74:d4:35:ec:64:73 (oui Unknown), ethertype IPv4 (0x0800), length 118: 172.23.15.73.49186 > legolas.ssh: Flags [P.], seq 2161:2225, ack 8944, win 508, length 64
  184  18:14:42.776762 74:d4:35:ec:64:73 (oui Unknown) > 80:1f:02:ff:ca:5d (oui Unknown), ethertype IPv4 (0x0800), length 54: legolas.ssh > 172.23.15.73.49186: Flags [.], ack 2225, win 5393, length 0
  185  18:14:42.777283 74:d4:35:ec:64:73 (oui Unknown) > 80:1f:02:ff:ca:5d (oui Unknown), ethertype IPv4 (0x0800), length 102: legolas.ssh > 172.23.15.73.49186: Flags [P.], seq 8944:8992, ack 2225, win 5393, length 48
  186  18:14:42.782134 80:1f:02:ff:ca:5d (oui Unknown) > 74:d4:35:ec:64:73 (oui Unknown), ethertype IPv4 (0x0800), length 118: 172.23.15.73.49186 > legolas.ssh: Flags [P.], seq 2225:2289, ack 8992, win 507, length 64
  187  18:14:42.782181 74:d4:35:ec:64:73 (oui Unknown) > 80:1f:02:ff:ca:5d (oui Unknown), ethertype IPv4 (0x0800), length 54: legolas.ssh > 172.23.15.73.49186: Flags [.], ack 2289, win 5393, length 0
  188  18:14:42.783600 74:d4:35:ec:64:73 (oui Unknown) > 80:1f:02:ff:ca:5d (oui Unknown), ethertype IPv4 (0x0800), length 118: legolas.ssh > 172.23.15.73.49186: Flags [P.], seq 8992:9056, ack 2289, win 5393, length 64
  189  18:14:42.789279 80:1f:02:ff:ca:5d (oui Unknown) > 74:d4:35:ec:64:73 (oui Unknown), ethertype IPv4 (0x0800), length 118: 172.23.15.73.49186 > legolas.ssh: Flags [P.], seq 2289:2353, ack 9056, win 507, length 64
  190  18:14:42.789314 74:d4:35:ec:64:73 (oui Unknown) > 80:1f:02:ff:ca:5d (oui Unknown), ethertype IPv4 (0x0800), length 54: legolas.ssh > 172.23.15.73.49186: Flags [.], ack 2353, win 5393, length 0
  191  18:14:42.810039 74:d4:35:ec:64:73 (oui Unknown) > 80:1f:02:ff:ca:5d (oui Unknown), ethertype IPv4 (0x0800), length 310: legolas.ssh > 172.23.15.73.49186: Flags [P.], seq 9056:9312, ack 2353, win 5393, length 256
  192  18:14:42.819133 80:1f:02:ff:ca:5d (oui Unknown) > 74:d4:35:ec:64:73 (oui Unknown), ethertype IPv4 (0x0800), length 118: 172.23.15.73.49186 > legolas.ssh: Flags [P.], seq 2353:2417, ack 9312, win 512, length 64
  193  18:14:42.862884 74:d4:35:ec:64:73 (oui Unknown) > 80:1f:02:ff:ca:5d (oui Unknown), ethertype IPv4 (0x0800), length 54: legolas.ssh > 172.23.15.73.49186: Flags [.], ack 2417, win 5393, length 0
  194  18:14:42.930441 80:1f:02:ff:ca:5d (oui Unknown) > 74:d4:35:ec:64:73 (oui Unknown), ethertype IPv4 (0x0800), length 118: 172.23.15.73.49186 > legolas.ssh: Flags [P.], seq 2417:2481, ack 9312, win 512, length 64
  195  18:14:42.930470 74:d4:35:ec:64:73 (oui Unknown) > 80:1f:02:ff:ca:5d (oui Unknown), ethertype IPv4 (0x0800), length 54: legolas.ssh > 172.23.15.73.49186: Flags [.], ack 2481, win 5393, length 0
  196  18:14:42.993129 80:1f:02:ff:ca:5d (oui Unknown) > 74:d4:35:ec:64:73 (oui Unknown), ethertype IPv4 (0x0800), length 118: 172.23.15.73.49186 > legolas.ssh: Flags [P.], seq 2481:2545, ack 9312, win 512, length 64
  197  18:14:42.993157 74:d4:35:ec:64:73 (oui Unknown) > 80:1f:02:ff:ca:5d (oui Unknown), ethertype IPv4 (0x0800), length 54: legolas.ssh > 172.23.15.73.49186: Flags [.], ack 2545, win 5393, length 0
  198  18:14:42.993723 74:d4:35:ec:64:73 (oui Unknown) > 80:1f:02:ff:ca:5d (oui Unknown), ethertype IPv4 (0x0800), length 102: legolas.ssh > 172.23.15.73.49186: Flags [P.], seq 9312:9360, ack 2545, win 5393, length 48
  199  18:14:42.998914 80:1f:02:ff:ca:5d (oui Unknown) > 74:d4:35:ec:64:73 (oui Unknown), ethertype IPv4 (0x0800), length 118: 172.23.15.73.49186 > legolas.ssh: Flags [P.], seq 2545:2609, ack 9360, win 512, length 64
  200  18:14:42.998948 74:d4:35:ec:64:73 (oui Unknown) > 80:1f:02:ff:ca:5d (oui Unknown), ethertype IPv4 (0x0800), length 54: legolas.ssh > 172.23.15.73.49186: Flags [.], ack 2609, win 5393, length 0
  201  18:14:43.000381 74:d4:35:ec:64:73 (oui Unknown) > 80:1f:02:ff:ca:5d (oui Unknown), ethertype IPv4 (0x0800), length 118: legolas.ssh > 172.23.15.73.49186: Flags [P.], seq 9360:9424, ack 2609, win 5393, length 64
  202  18:14:43.005652 80:1f:02:ff:ca:5d (oui Unknown) > 74:d4:35:ec:64:73 (oui Unknown), ethertype IPv4 (0x0800), length 118: 172.23.15.73.49186 > legolas.ssh: Flags [P.], seq 2609:2673, ack 9424, win 511, length 64
  203  18:14:43.005675 74:d4:35:ec:64:73 (oui Unknown) > 80:1f:02:ff:ca:5d (oui Unknown), ethertype IPv4 (0x0800), length 54: legolas.ssh > 172.23.15.73.49186: Flags [.], ack 2673, win 5393, length 0
  204  18:14:43.011994 74:d4:35:ec:64:73 (oui Unknown) > 80:1f:02:ff:ca:5d (oui Unknown), ethertype IPv4 (0x0800), length 262: legolas.ssh > 172.23.15.73.49186: Flags [P.], seq 9424:9632, ack 2673, win 5393, length 208
  205  18:14:43.019535 1c:1b:0d:8a:d3:34 (oui Unknown) > Broadcast, ethertype ARP (0x0806), length 60: Request who-has 10.10.0.120 tell hmi, length 46
  206  18:14:43.021102 80:1f:02:ff:ca:5d (oui Unknown) > 74:d4:35:ec:64:73 (oui Unknown), ethertype IPv4 (0x0800), length 118: 172.23.15.73.49186 > legolas.ssh: Flags [P.], seq 2673:2737, ack 9632, win 511, length 64
  207  18:14:43.031005 74:d4:35:ec:64:73 (oui Unknown) > 80:1f:02:ff:ca:5d (oui Unknown), ethertype IPv4 (0x0800), length 518: legolas.ssh > 172.23.15.73.49186: Flags [P.], seq 9632:10096, ack 2737, win 5393, length 464
  208  18:14:43.040945 80:1f:02:ff:ca:5d (oui Unknown) > 74:d4:35:ec:64:73 (oui Unknown), ethertype IPv4 (0x0800), length 118: 172.23.15.73.49186 > legolas.ssh: Flags [P.], seq 2737:2801, ack 10096, win 509, length 64
  209  18:14:43.082856 74:d4:35:ec:64:73 (oui Unknown) > 80:1f:02:ff:ca:5d (oui Unknown), ethertype IPv4 (0x0800), length 54: legolas.ssh > 172.23.15.73.49186: Flags [.], ack 2801, win 5393, length 0
  210  18:14:43.115730 80:1f:02:ff:ca:5d (oui Unknown) > 74:d4:35:ec:64:73 (oui Unknown), ethertype IPv4 (0x0800), length 118: 172.23.15.73.49186 > legolas.ssh: Flags [P.], seq 2801:2865, ack 10096, win 509, length 64
  211  18:14:43.115856 74:d4:35:ec:64:73 (oui Unknown) > 80:1f:02:ff:ca:5d (oui Unknown), ethertype IPv4 (0x0800), length 54: legolas.ssh > 172.23.15.73.49186: Flags [.], ack 2865, win 5393, length 0
  212  18:14:43.130874 74:d4:35:ec:64:73 (oui Unknown) > 80:1f:02:ff:ca:5d (oui Unknown), ethertype IPv4 (0x0800), length 134: legolas.ssh > 172.23.15.73.49186: Flags [P.], seq 10096:10176, ack 2865, win 5393, length 80
  213  18:14:43.131746 74:d4:35:ec:64:73 (oui Unknown) > 80:1f:02:ff:ca:5d (oui Unknown), ethertype IPv4 (0x0800), length 150: legolas.ssh > 172.23.15.73.49186: Flags [P.], seq 10176:10272, ack 2865, win 5393, length 96
  214  18:14:43.132628 74:d4:35:ec:64:73 (oui Unknown) > 80:1f:02:ff:ca:5d (oui Unknown), ethertype IPv4 (0x0800), length 166: legolas.ssh > 172.23.15.73.49186: Flags [P.], seq 10272:10384, ack 2865, win 5393, length 112
  215  18:14:43.132699 74:d4:35:ec:64:73 (oui Unknown) > 80:1f:02:ff:ca:5d (oui Unknown), ethertype IPv4 (0x0800), length 102: legolas.ssh > 172.23.15.73.49186: Flags [P.], seq 10384:10432, ack 2865, win 5393, length 48
  216  18:14:43.133609 74:d4:35:ec:64:73 (oui Unknown) > 80:1f:02:ff:ca:5d (oui Unknown), ethertype IPv4 (0x0800), length 134: legolas.ssh > 172.23.15.73.49186: Flags [P.], seq 10432:10512, ack 2865, win 5393, length 80
  217  18:14:43.133709 74:d4:35:ec:64:73 (oui Unknown) > 80:1f:02:ff:ca:5d (oui Unknown), ethertype IPv4 (0x0800), length 102: legolas.ssh > 172.23.15.73.49186: Flags [P.], seq 10512:10560, ack 2865, win 5393, length 48
  218  18:14:43.134562 74:d4:35:ec:64:73 (oui Unknown) > 80:1f:02:ff:ca:5d (oui Unknown), ethertype IPv4 (0x0800), length 102: legolas.ssh > 172.23.15.73.49186: Flags [P.], seq 10560:10608, ack 2865, win 5393, length 48
  219  18:14:43.134667 74:d4:35:ec:64:73 (oui Unknown) > 80:1f:02:ff:ca:5d (oui Unknown), ethertype IPv4 (0x0800), length 102: legolas.ssh > 172.23.15.73.49186: Flags [P.], seq 10608:10656, ack 2865, win 5393, length 48
  220  18:14:43.136243 80:1f:02:ff:ca:5d (oui Unknown) > 74:d4:35:ec:64:73 (oui Unknown), ethertype IPv4 (0x0800), length 60: 172.23.15.73.49186 > legolas.ssh: Flags [.], ack 10272, win 508, length 0
  221  18:14:43.137057 80:1f:02:ff:ca:5d (oui Unknown) > 74:d4:35:ec:64:73 (oui Unknown), ethertype IPv4 (0x0800), length 60: 172.23.15.73.49186 > legolas.ssh: Flags [.], ack 10432, win 507, length 0
  222  18:14:43.138280 80:1f:02:ff:ca:5d (oui Unknown) > 74:d4:35:ec:64:73 (oui Unknown), ethertype IPv4 (0x0800), length 60: 172.23.15.73.49186 > legolas.ssh: Flags [.], ack 10560, win 507, length 0
  223  18:14:43.138515 80:1f:02:ff:ca:5d (oui Unknown) > 74:d4:35:ec:64:73 (oui Unknown), ethertype IPv4 (0x0800), length 60: 172.23.15.73.49186 > legolas.ssh: Flags [.], ack 10656, win 507, length 0
  224  18:14:43.293882 80:1f:02:ff:ca:5d (oui Unknown) > 74:d4:35:ec:64:73 (oui Unknown), ethertype IPv4 (0x0800), length 118: 172.23.15.73.49186 > legolas.ssh: Flags [P.], seq 2865:2929, ack 10656, win 507, length 64
  225  18:14:43.293906 74:d4:35:ec:64:73 (oui Unknown) > 80:1f:02:ff:ca:5d (oui Unknown), ethertype IPv4 (0x0800), length 54: legolas.ssh > 172.23.15.73.49186: Flags [.], ack 2929, win 5393, length 0
  226  18:14:43.294083 74:d4:35:ec:64:73 (oui Unknown) > 80:1f:02:ff:ca:5d (oui Unknown), ethertype IPv4 (0x0800), length 102: legolas.ssh > 172.23.15.73.49186: Flags [P.], seq 10656:10704, ack 2929, win 5393, length 48
  227  18:14:43.299402 80:1f:02:ff:ca:5d (oui Unknown) > 74:d4:35:ec:64:73 (oui Unknown), ethertype IPv4 (0x0800), length 118: 172.23.15.73.49186 > legolas.ssh: Flags [P.], seq 2929:2993, ack 10704, win 512, length 64
  228  18:14:43.299425 74:d4:35:ec:64:73 (oui Unknown) > 80:1f:02:ff:ca:5d (oui Unknown), ethertype IPv4 (0x0800), length 54: legolas.ssh > 172.23.15.73.49186: Flags [.], ack 2993, win 5393, length 0
  229  18:14:43.299858 74:d4:35:ec:64:73 (oui Unknown) > 80:1f:02:ff:ca:5d (oui Unknown), ethertype IPv4 (0x0800), length 118: legolas.ssh > 172.23.15.73.49186: Flags [P.], seq 10704:10768, ack 2993, win 5393, length 64
  230  18:14:43.304857 80:1f:02:ff:ca:5d (oui Unknown) > 74:d4:35:ec:64:73 (oui Unknown), ethertype IPv4 (0x0800), length 118: 172.23.15.73.49186 > legolas.ssh: Flags [P.], seq 2993:3057, ack 10768, win 512, length 64
  231  18:14:43.325522 74:d4:35:ec:64:73 (oui Unknown) > 80:1f:02:ff:ca:5d (oui Unknown), ethertype IPv4 (0x0800), length 310: legolas.ssh > 172.23.15.73.49186: Flags [P.], seq 10768:11024, ack 3057, win 5393, length 256
  232  18:14:43.333892 80:1f:02:ff:ca:5d (oui Unknown) > 74:d4:35:ec:64:73 (oui Unknown), ethertype IPv4 (0x0800), length 118: 172.23.15.73.49186 > legolas.ssh: Flags [P.], seq 3057:3121, ack 11024, win 511, length 64
  233  18:14:43.374851 74:d4:35:ec:64:73 (oui Unknown) > 80:1f:02:ff:ca:5d (oui Unknown), ethertype IPv4 (0x0800), length 54: legolas.ssh > 172.23.15.73.49186: Flags [.], ack 3121, win 5393, length 0
  234  18:14:43.448023 80:1f:02:ff:ca:5d (oui Unknown) > 74:d4:35:ec:64:73 (oui Unknown), ethertype IPv4 (0x0800), length 118: 172.23.15.73.49186 > legolas.ssh: Flags [P.], seq 3121:3185, ack 11024, win 511, length 64
  235  18:14:43.448045 74:d4:35:ec:64:73 (oui Unknown) > 80:1f:02:ff:ca:5d (oui Unknown), ethertype IPv4 (0x0800), length 54: legolas.ssh > 172.23.15.73.49186: Flags [.], ack 3185, win 5393, length 0
  236  18:14:43.448140 80:1f:02:ff:ca:5d (oui Unknown) > 74:d4:35:ec:64:73 (oui Unknown), ethertype IPv4 (0x0800), length 118: 172.23.15.73.49186 > legolas.ssh: Flags [P.], seq 3185:3249, ack 11024, win 511, length 64
  237  18:14:43.448190 74:d4:35:ec:64:73 (oui Unknown) > 80:1f:02:ff:ca:5d (oui Unknown), ethertype IPv4 (0x0800), length 54: legolas.ssh > 172.23.15.73.49186: Flags [.], ack 3249, win 5393, length 0
  238  18:14:43.448195 74:d4:35:ec:64:73 (oui Unknown) > 80:1f:02:ff:ca:5d (oui Unknown), ethertype IPv4 (0x0800), length 102: legolas.ssh > 172.23.15.73.49186: Flags [P.], seq 11024:11072, ack 3249, win 5393, length 48
  239  18:14:43.454478 80:1f:02:ff:ca:5d (oui Unknown) > 74:d4:35:ec:64:73 (oui Unknown), ethertype IPv4 (0x0800), length 118: 172.23.15.73.49186 > legolas.ssh: Flags [P.], seq 3249:3313, ack 11072, win 510, length 64
  240  18:14:43.454501 74:d4:35:ec:64:73 (oui Unknown) > 80:1f:02:ff:ca:5d (oui Unknown), ethertype IPv4 (0x0800), length 54: legolas.ssh > 172.23.15.73.49186: Flags [.], ack 3313, win 5393, length 0
  241  18:14:43.455248 74:d4:35:ec:64:73 (oui Unknown) > 80:1f:02:ff:ca:5d (oui Unknown), ethertype IPv4 (0x0800), length 118: legolas.ssh > 172.23.15.73.49186: Flags [P.], seq 11072:11136, ack 3313, win 5393, length 64
  242  18:14:43.460651 80:1f:02:ff:ca:5d (oui Unknown) > 74:d4:35:ec:64:73 (oui Unknown), ethertype IPv4 (0x0800), length 118: 172.23.15.73.49186 > legolas.ssh: Flags [P.], seq 3313:3377, ack 11136, win 510, length 64
  243  18:14:43.460695 74:d4:35:ec:64:73 (oui Unknown) > 80:1f:02:ff:ca:5d (oui Unknown), ethertype IPv4 (0x0800), length 54: legolas.ssh > 172.23.15.73.49186: Flags [.], ack 3377, win 5393, length 0
  244  18:14:43.466866 74:d4:35:ec:64:73 (oui Unknown) > 80:1f:02:ff:ca:5d (oui Unknown), ethertype IPv4 (0x0800), length 262: legolas.ssh > 172.23.15.73.49186: Flags [P.], seq 11136:11344, ack 3377, win 5393, length 208
  245  18:14:43.474706 80:1f:02:ff:ca:5d (oui Unknown) > 74:d4:35:ec:64:73 (oui Unknown), ethertype IPv4 (0x0800), length 118: 172.23.15.73.49186 > legolas.ssh: Flags [P.], seq 3377:3441, ack 11344, win 509, length 64
  246  18:14:43.482414 74:d4:35:ec:64:73 (oui Unknown) > 80:1f:02:ff:ca:5d (oui Unknown), ethertype IPv4 (0x0800), length 454: legolas.ssh > 172.23.15.73.49186: Flags [P.], seq 11344:11744, ack 3441, win 5393, length 400
  247  18:14:43.491699 80:1f:02:ff:ca:5d (oui Unknown) > 74:d4:35:ec:64:73 (oui Unknown), ethertype IPv4 (0x0800), length 118: 172.23.15.73.49186 > legolas.ssh: Flags [P.], seq 3441:3505, ack 11744, win 508, length 64
  248  18:14:43.534855 74:d4:35:ec:64:73 (oui Unknown) > 80:1f:02:ff:ca:5d (oui Unknown), ethertype IPv4 (0x0800), length 54: legolas.ssh > 172.23.15.73.49186: Flags [.], ack 3505, win 5393, length 0
  249  18:14:43.579670 80:1f:02:ff:ca:5d (oui Unknown) > 74:d4:35:ec:64:73 (oui Unknown), ethertype IPv4 (0x0800), length 118: 172.23.15.73.49186 > legolas.ssh: Flags [P.], seq 3505:3569, ack 11744, win 508, length 64
  250  18:14:43.579771 74:d4:35:ec:64:73 (oui Unknown) > 80:1f:02:ff:ca:5d (oui Unknown), ethertype IPv4 (0x0800), length 54: legolas.ssh > 172.23.15.73.49186: Flags [.], ack 3569, win 5393, length 0
  251  18:14:44.056704 74:d4:35:ec:64:73 (oui Unknown) > 80:1f:02:ff:ca:5d (oui Unknown), ethertype IPv4 (0x0800), length 278: legolas.ssh > 172.23.15.73.49186: Flags [P.], seq 11744:11968, ack 3569, win 5393, length 224
  252  18:14:44.065446 80:1f:02:ff:ca:5d (oui Unknown) > 74:d4:35:ec:64:73 (oui Unknown), ethertype IPv4 (0x0800), length 118: 172.23.15.73.49186 > legolas.ssh: Flags [P.], seq 3569:3633, ack 11968, win 507, length 64
  253  18:14:44.065497 74:d4:35:ec:64:73 (oui Unknown) > 80:1f:02:ff:ca:5d (oui Unknown), ethertype IPv4 (0x0800), length 54: legolas.ssh > 172.23.15.73.49186: Flags [.], ack 3633, win 5393, length 0
  254  18:14:44.136844 74:d4:35:ec:64:73 (oui Unknown) > 80:1f:02:ff:ca:5d (oui Unknown), ethertype IPv4 (0x0800), length 134: legolas.ssh > 172.23.15.73.49186: Flags [P.], seq 11968:12048, ack 3633, win 5393, length 80
  255  18:14:44.137706 74:d4:35:ec:64:73 (oui Unknown) > 80:1f:02:ff:ca:5d (oui Unknown), ethertype IPv4 (0x0800), length 134: legolas.ssh > 172.23.15.73.49186: Flags [P.], seq 12048:12128, ack 3633, win 5393, length 80
  256  18:14:44.138574 74:d4:35:ec:64:73 (oui Unknown) > 80:1f:02:ff:ca:5d (oui Unknown), ethertype IPv4 (0x0800), length 182: legolas.ssh > 172.23.15.73.49186: Flags [P.], seq 12128:12256, ack 3633, win 5393, length 128
  257  18:14:44.138640 74:d4:35:ec:64:73 (oui Unknown) > 80:1f:02:ff:ca:5d (oui Unknown), ethertype IPv4 (0x0800), length 102: legolas.ssh > 172.23.15.73.49186: Flags [P.], seq 12256:12304, ack 3633, win 5393, length 48
  258  18:14:44.139572 74:d4:35:ec:64:73 (oui Unknown) > 80:1f:02:ff:ca:5d (oui Unknown), ethertype IPv4 (0x0800), length 118: legolas.ssh > 172.23.15.73.49186: Flags [P.], seq 12304:12368, ack 3633, win 5393, length 64
  259  18:14:44.139670 74:d4:35:ec:64:73 (oui Unknown) > 80:1f:02:ff:ca:5d (oui Unknown), ethertype IPv4 (0x0800), length 102: legolas.ssh > 172.23.15.73.49186: Flags [P.], seq 12368:12416, ack 3633, win 5393, length 48
  260  18:14:44.140531 74:d4:35:ec:64:73 (oui Unknown) > 80:1f:02:ff:ca:5d (oui Unknown), ethertype IPv4 (0x0800), length 102: legolas.ssh > 172.23.15.73.49186: Flags [P.], seq 12416:12464, ack 3633, win 5393, length 48
  261  18:14:44.140639 74:d4:35:ec:64:73 (oui Unknown) > 80:1f:02:ff:ca:5d (oui Unknown), ethertype IPv4 (0x0800), length 102: legolas.ssh > 172.23.15.73.49186: Flags [P.], seq 12464:12512, ack 3633, win 5393, length 48
  262  18:14:44.142538 80:1f:02:ff:ca:5d (oui Unknown) > 74:d4:35:ec:64:73 (oui Unknown), ethertype IPv4 (0x0800), length 60: 172.23.15.73.49186 > legolas.ssh: Flags [.], ack 12128, win 512, length 0
  263  18:14:44.142762 80:1f:02:ff:ca:5d (oui Unknown) > 74:d4:35:ec:64:73 (oui Unknown), ethertype IPv4 (0x0800), length 60: 172.23.15.73.49186 > legolas.ssh: Flags [.], ack 12304, win 511, length 0
  264  18:14:44.143929 80:1f:02:ff:ca:5d (oui Unknown) > 74:d4:35:ec:64:73 (oui Unknown), ethertype IPv4 (0x0800), length 60: 172.23.15.73.49186 > legolas.ssh: Flags [.], ack 12416, win 511, length 0
  265  18:14:44.144436 80:1f:02:ff:ca:5d (oui Unknown) > 74:d4:35:ec:64:73 (oui Unknown), ethertype IPv4 (0x0800), length 60: 172.23.15.73.49186 > legolas.ssh: Flags [.], ack 12512, win 510, length 0
  266  18:14:44.657683 74:d4:35:ec:64:73 (oui Unknown) > 80:1f:02:ff:ca:5d (oui Unknown), ethertype IPv4 (0x0800), length 246: legolas.ssh > 172.23.15.73.49186: Flags [P.], seq 12512:12704, ack 3633, win 5393, length 192
  267  18:14:44.665169 80:1f:02:ff:ca:5d (oui Unknown) > 74:d4:35:ec:64:73 (oui Unknown), ethertype IPv4 (0x0800), length 118: 172.23.15.73.49186 > legolas.ssh: Flags [P.], seq 3633:3697, ack 12704, win 510, length 64
  268  18:14:44.665177 74:d4:35:ec:64:73 (oui Unknown) > 80:1f:02:ff:ca:5d (oui Unknown), ethertype IPv4 (0x0800), length 54: legolas.ssh > 172.23.15.73.49186: Flags [.], ack 3697, win 5393, length 0
  269  18:14:44.763103 00:1f:da:5e:d8:01 (oui Unknown) > 01:80:c2:00:00:00 (oui Unknown), 802.3, length 38: LLC, dsap STP (0x42) Individual, ssap STP (0x42) Command, ctrl 0x03: STP 802.1d, Config, Flags [none], bridge-id 8000.00:1f:da:5e:d8:01.8019, length 35
  270  18:14:45.064146 74:d4:35:ec:64:73 (oui Unknown) > 80:1f:02:ff:ca:5d (oui Unknown), ethertype IPv4 (0x0800), length 118: legolas.38838 > platform-nas.ssh: Flags [P.], seq 2494656143:2494656195, ack 1360694106, win 4581, options [nop,nop,TS val 4064583061 ecr 3148098198], length 52
  271  18:14:45.142792 74:d4:35:ec:64:73 (oui Unknown) > 80:1f:02:ff:ca:5d (oui Unknown), ethertype IPv4 (0x0800), length 118: legolas.ssh > 172.23.15.73.49186: Flags [P.], seq 12704:12768, ack 3697, win 5393, length 64
  272  18:14:45.143649 74:d4:35:ec:64:73 (oui Unknown) > 80:1f:02:ff:ca:5d (oui Unknown), ethertype IPv4 (0x0800), length 134: legolas.ssh > 172.23.15.73.49186: Flags [P.], seq 12768:12848, ack 3697, win 5393, length 80
  273  18:14:45.144504 74:d4:35:ec:64:73 (oui Unknown) > 80:1f:02:ff:ca:5d (oui Unknown), ethertype IPv4 (0x0800), length 166: legolas.ssh > 172.23.15.73.49186: Flags [P.], seq 12848:12960, ack 3697, win 5393, length 112
  274  18:14:45.144570 74:d4:35:ec:64:73 (oui Unknown) > 80:1f:02:ff:ca:5d (oui Unknown), ethertype IPv4 (0x0800), length 102: legolas.ssh > 172.23.15.73.49186: Flags [P.], seq 12960:13008, ack 3697, win 5393, length 48
  275  18:14:45.145504 74:d4:35:ec:64:73 (oui Unknown) > 80:1f:02:ff:ca:5d (oui Unknown), ethertype IPv4 (0x0800), length 118: legolas.ssh > 172.23.15.73.49186: Flags [P.], seq 13008:13072, ack 3697, win 5393, length 64
  276  18:14:45.145599 74:d4:35:ec:64:73 (oui Unknown) > 80:1f:02:ff:ca:5d (oui Unknown), ethertype IPv4 (0x0800), length 102: legolas.ssh > 172.23.15.73.49186: Flags [P.], seq 13072:13120, ack 3697, win 5393, length 48
  277  18:14:45.146447 74:d4:35:ec:64:73 (oui Unknown) > 80:1f:02:ff:ca:5d (oui Unknown), ethertype IPv4 (0x0800), length 102: legolas.ssh > 172.23.15.73.49186: Flags [P.], seq 13120:13168, ack 3697, win 5393, length 48
  278  18:14:45.146551 74:d4:35:ec:64:73 (oui Unknown) > 80:1f:02:ff:ca:5d (oui Unknown), ethertype IPv4 (0x0800), length 102: legolas.ssh > 172.23.15.73.49186: Flags [P.], seq 13168:13216, ack 3697, win 5393, length 48
  279  18:14:45.148301 80:1f:02:ff:ca:5d (oui Unknown) > 74:d4:35:ec:64:73 (oui Unknown), ethertype IPv4 (0x0800), length 60: 172.23.15.73.49186 > legolas.ssh: Flags [.], ack 12848, win 509, length 0
  280  18:14:45.148811 80:1f:02:ff:ca:5d (oui Unknown) > 74:d4:35:ec:64:73 (oui Unknown), ethertype IPv4 (0x0800), length 60: 172.23.15.73.49186 > legolas.ssh: Flags [.], ack 13008, win 508, length 0
  281  18:14:45.149591 80:1f:02:ff:ca:5d (oui Unknown) > 74:d4:35:ec:64:73 (oui Unknown), ethertype IPv4 (0x0800), length 60: 172.23.15.73.49186 > legolas.ssh: Flags [.], ack 13120, win 508, length 0
  282  18:14:45.150359 80:1f:02:ff:ca:5d (oui Unknown) > 74:d4:35:ec:64:73 (oui Unknown), ethertype IPv4 (0x0800), length 60: 172.23.15.73.49186 > legolas.ssh: Flags [.], ack 13216, win 508, length 0
  283  18:14:45.185716 80:1f:02:ff:ca:5d (oui Unknown) > 74:d4:35:ec:64:73 (oui Unknown), ethertype IPv4 (0x0800), length 94: platform-nas.ssh > legolas.38838: Flags [P.], seq 1:29, ack 52, win 6156, options [nop,nop,TS val 3148113300 ecr 4064583061], length 28
  284  18:14:45.185732 74:d4:35:ec:64:73 (oui Unknown) > 80:1f:02:ff:ca:5d (oui Unknown), ethertype IPv4 (0x0800), length 66: legolas.38838 > platform-nas.ssh: Flags [.], ack 29, win 4581, options [nop,nop,TS val 4064583183 ecr 3148113300], length 0
  285  18:14:45.203338 80:1f:02:ff:ca:5d (oui Unknown) > 74:d4:35:ec:64:73 (oui Unknown), ethertype IPv4 (0x0800), length 118: 172.23.15.73.49186 > legolas.ssh: Flags [P.], seq 3697:3761, ack 13216, win 508, length 64
  286  18:14:45.203348 74:d4:35:ec:64:73 (oui Unknown) > 80:1f:02:ff:ca:5d (oui Unknown), ethertype IPv4 (0x0800), length 54: legolas.ssh > 172.23.15.73.49186: Flags [.], ack 3761, win 5393, length 0
  287  18:14:45.203533 74:d4:35:ec:64:73 (oui Unknown) > 80:1f:02:ff:ca:5d (oui Unknown), ethertype IPv4 (0x0800), length 102: legolas.ssh > 172.23.15.73.49186: Flags [P.], seq 13216:13264, ack 3761, win 5393, length 48
  288  18:14:45.208642 80:1f:02:ff:ca:5d (oui Unknown) > 74:d4:35:ec:64:73 (oui Unknown), ethertype IPv4 (0x0800), length 118: 172.23.15.73.49186 > legolas.ssh: Flags [P.], seq 3761:3825, ack 13264, win 507, length 64
  289  18:14:45.208653 74:d4:35:ec:64:73 (oui Unknown) > 80:1f:02:ff:ca:5d (oui Unknown), ethertype IPv4 (0x0800), length 54: legolas.ssh > 172.23.15.73.49186: Flags [.], ack 3825, win 5393, length 0
  290  18:14:45.209069 74:d4:35:ec:64:73 (oui Unknown) > 80:1f:02:ff:ca:5d (oui Unknown), ethertype IPv4 (0x0800), length 118: legolas.ssh > 172.23.15.73.49186: Flags [P.], seq 13264:13328, ack 3825, win 5393, length 64
  291  18:14:45.214038 80:1f:02:ff:ca:5d (oui Unknown) > 74:d4:35:ec:64:73 (oui Unknown), ethertype IPv4 (0x0800), length 118: 172.23.15.73.49186 > legolas.ssh: Flags [P.], seq 3825:3889, ack 13328, win 507, length 64
  292  18:14:45.214053 74:d4:35:ec:64:73 (oui Unknown) > 80:1f:02:ff:ca:5d (oui Unknown), ethertype IPv4 (0x0800), length 54: legolas.ssh > 172.23.15.73.49186: Flags [.], ack 3889, win 5393, length 0
  293  18:14:45.220249 74:d4:35:ec:64:73 (oui Unknown) > 80:1f:02:ff:ca:5d (oui Unknown), ethertype IPv4 (0x0800), length 262: legolas.ssh > 172.23.15.73.49186: Flags [P.], seq 13328:13536, ack 3889, win 5393, length 208
  294  18:14:45.230185 80:1f:02:ff:ca:5d (oui Unknown) > 74:d4:35:ec:64:73 (oui Unknown), ethertype IPv4 (0x0800), length 118: 172.23.15.73.49186 > legolas.ssh: Flags [P.], seq 3889:3953, ack 13536, win 512, length 64
  295  18:14:45.234570 74:d4:35:ec:64:73 (oui Unknown) > 80:1f:02:ff:ca:5d (oui Unknown), ethertype IPv4 (0x0800), length 118: legolas.ssh > 172.23.15.73.49186: Flags [P.], seq 13536:13600, ack 3953, win 5393, length 64
  296  18:14:45.239148 80:1f:02:ff:ca:5d (oui Unknown) > 74:d4:35:ec:64:73 (oui Unknown), ethertype IPv4 (0x0800), length 118: 172.23.15.73.49186 > legolas.ssh: Flags [P.], seq 3953:4017, ack 13600, win 512, length 64
  297  18:14:45.239716 74:d4:35:ec:64:73 (oui Unknown) > 80:1f:02:ff:ca:5d (oui Unknown), ethertype IPv4 (0x0800), length 278: legolas.ssh > 172.23.15.73.49186: Flags [P.], seq 13600:13824, ack 4017, win 5393, length 224
  298  18:14:45.248819 80:1f:02:ff:ca:5d (oui Unknown) > 74:d4:35:ec:64:73 (oui Unknown), ethertype IPv4 (0x0800), length 118: 172.23.15.73.49186 > legolas.ssh: Flags [P.], seq 4017:4081, ack 13824, win 511, length 64
  299  18:14:45.290856 74:d4:35:ec:64:73 (oui Unknown) > 80:1f:02:ff:ca:5d (oui Unknown), ethertype IPv4 (0x0800), length 54: legolas.ssh > 172.23.15.73.49186: Flags [.], ack 4081, win 5393, length 0
  300  18:14:45.340329 80:1f:02:ff:ca:5d (oui Unknown) > 74:d4:35:ec:64:73 (oui Unknown), ethertype IPv4 (0x0800), length 118: 172.23.15.73.49186 > legolas.ssh: Flags [P.], seq 4081:4145, ack 13824, win 511, length 64
  301  18:14:45.340358 74:d4:35:ec:64:73 (oui Unknown) > 80:1f:02:ff:ca:5d (oui Unknown), ethertype IPv4 (0x0800), length 54: legolas.ssh > 172.23.15.73.49186: Flags [.], ack 4145, win 5393, length 0
  302  18:14:45.811327 74:d4:35:ec:64:73 (oui Unknown) > 80:1f:02:ff:ca:5d (oui Unknown), ethertype IPv4 (0x0800), length 262: legolas.ssh > 172.23.15.73.49186: Flags [P.], seq 13824:14032, ack 4145, win 5393, length 208
  303  18:14:45.819390 80:1f:02:ff:ca:5d (oui Unknown) > 74:d4:35:ec:64:73 (oui Unknown), ethertype IPv4 (0x0800), length 118: 172.23.15.73.49186 > legolas.ssh: Flags [P.], seq 4145:4209, ack 14032, win 510, length 64
  304  18:14:45.819440 74:d4:35:ec:64:73 (oui Unknown) > 80:1f:02:ff:ca:5d (oui Unknown), ethertype IPv4 (0x0800), length 54: legolas.ssh > 172.23.15.73.49186: Flags [.], ack 4209, win 5393, length 0
  305  18:14:46.148616 74:d4:35:ec:64:73 (oui Unknown) > 80:1f:02:ff:ca:5d (oui Unknown), ethertype IPv4 (0x0800), length 118: legolas.ssh > 172.23.15.73.49186: Flags [P.], seq 14032:14096, ack 4209, win 5393, length 64
  306  18:14:46.149656 74:d4:35:ec:64:73 (oui Unknown) > 80:1f:02:ff:ca:5d (oui Unknown), ethertype IPv4 (0x0800), length 134: legolas.ssh > 172.23.15.73.49186: Flags [P.], seq 14096:14176, ack 4209, win 5393, length 80
  307  18:14:46.150360 74:d4:35:ec:64:73 (oui Unknown) > 80:1f:02:ff:ca:5d (oui Unknown), ethertype IPv4 (0x0800), length 182: legolas.ssh > 172.23.15.73.49186: Flags [P.], seq 14176:14304, ack 4209, win 5393, length 128
  308  18:14:46.150440 74:d4:35:ec:64:73 (oui Unknown) > 80:1f:02:ff:ca:5d (oui Unknown), ethertype IPv4 (0x0800), length 102: legolas.ssh > 172.23.15.73.49186: Flags [P.], seq 14304:14352, ack 4209, win 5393, length 48
  309  18:14:46.151371 74:d4:35:ec:64:73 (oui Unknown) > 80:1f:02:ff:ca:5d (oui Unknown), ethertype IPv4 (0x0800), length 118: legolas.ssh > 172.23.15.73.49186: Flags [P.], seq 14352:14416, ack 4209, win 5393, length 64
  310  18:14:46.151472 74:d4:35:ec:64:73 (oui Unknown) > 80:1f:02:ff:ca:5d (oui Unknown), ethertype IPv4 (0x0800), length 102: legolas.ssh > 172.23.15.73.49186: Flags [P.], seq 14416:14464, ack 4209, win 5393, length 48
  311  18:14:46.152337 74:d4:35:ec:64:73 (oui Unknown) > 80:1f:02:ff:ca:5d (oui Unknown), ethertype IPv4 (0x0800), length 102: legolas.ssh > 172.23.15.73.49186: Flags [P.], seq 14464:14512, ack 4209, win 5393, length 48
  312  18:14:46.152449 74:d4:35:ec:64:73 (oui Unknown) > 80:1f:02:ff:ca:5d (oui Unknown), ethertype IPv4 (0x0800), length 102: legolas.ssh > 172.23.15.73.49186: Flags [P.], seq 14512:14560, ack 4209, win 5393, length 48
  313  18:14:46.154240 80:1f:02:ff:ca:5d (oui Unknown) > 74:d4:35:ec:64:73 (oui Unknown), ethertype IPv4 (0x0800), length 60: 172.23.15.73.49186 > legolas.ssh: Flags [.], ack 14176, win 509, length 0
  314  18:14:46.154471 80:1f:02:ff:ca:5d (oui Unknown) > 74:d4:35:ec:64:73 (oui Unknown), ethertype IPv4 (0x0800), length 60: 172.23.15.73.49186 > legolas.ssh: Flags [.], ack 14352, win 509, length 0
  315  18:14:46.157199 80:1f:02:ff:ca:5d (oui Unknown) > 74:d4:35:ec:64:73 (oui Unknown), ethertype IPv4 (0x0800), length 60: 172.23.15.73.49186 > legolas.ssh: Flags [.], ack 14464, win 508, length 0
  316  18:14:46.157468 80:1f:02:ff:ca:5d (oui Unknown) > 74:d4:35:ec:64:73 (oui Unknown), ethertype IPv4 (0x0800), length 60: 172.23.15.73.49186 > legolas.ssh: Flags [.], ack 14560, win 508, length 0
  317  18:14:46.411640 74:d4:35:ec:64:73 (oui Unknown) > 80:1f:02:ff:ca:5d (oui Unknown), ethertype IPv4 (0x0800), length 246: legolas.ssh > 172.23.15.73.49186: Flags [P.], seq 14560:14752, ack 4209, win 5393, length 192
  318  18:14:46.420333 80:1f:02:ff:ca:5d (oui Unknown) > 74:d4:35:ec:64:73 (oui Unknown), ethertype IPv4 (0x0800), length 118: 172.23.15.73.49186 > legolas.ssh: Flags [P.], seq 4209:4273, ack 14752, win 507, length 64
  319  18:14:46.420345 74:d4:35:ec:64:73 (oui Unknown) > 80:1f:02:ff:ca:5d (oui Unknown), ethertype IPv4 (0x0800), length 54: legolas.ssh > 172.23.15.73.49186: Flags [.], ack 4273, win 5393, length 0
  320  18:14:46.763187 00:1f:da:5e:d8:01 (oui Unknown) > 01:80:c2:00:00:00 (oui Unknown), 802.3, length 38: LLC, dsap STP (0x42) Individual, ssap STP (0x42) Command, ctrl 0x03: STP 802.1d, Config, Flags [none], bridge-id 8000.00:1f:da:5e:d8:01.8019, length 35
  321  18:14:47.012872 74:d4:35:ec:64:73 (oui Unknown) > 80:1f:02:ff:ca:5d (oui Unknown), ethertype IPv4 (0x0800), length 246: legolas.ssh > 172.23.15.73.49186: Flags [P.], seq 14752:14944, ack 4273, win 5393, length 192
  322  18:14:47.021645 80:1f:02:ff:ca:5d (oui Unknown) > 74:d4:35:ec:64:73 (oui Unknown), ethertype IPv4 (0x0800), length 118: 172.23.15.73.49186 > legolas.ssh: Flags [P.], seq 4273:4337, ack 14944, win 512, length 64
  323  18:14:47.021695 74:d4:35:ec:64:73 (oui Unknown) > 80:1f:02:ff:ca:5d (oui Unknown), ethertype IPv4 (0x0800), length 54: legolas.ssh > 172.23.15.73.49186: Flags [.], ack 4337, win 5393, length 0
  324  18:14:47.154583 74:d4:35:ec:64:73 (oui Unknown) > 80:1f:02:ff:ca:5d (oui Unknown), ethertype IPv4 (0x0800), length 134: legolas.ssh > 172.23.15.73.49186: Flags [P.], seq 14944:15024, ack 4337, win 5393, length 80
  325  18:14:47.155436 74:d4:35:ec:64:73 (oui Unknown) > 80:1f:02:ff:ca:5d (oui Unknown), ethertype IPv4 (0x0800), length 150: legolas.ssh > 172.23.15.73.49186: Flags [P.], seq 15024:15120, ack 4337, win 5393, length 96
  326  18:14:47.156278 74:d4:35:ec:64:73 (oui Unknown) > 80:1f:02:ff:ca:5d (oui Unknown), ethertype IPv4 (0x0800), length 166: legolas.ssh > 172.23.15.73.49186: Flags [P.], seq 15120:15232, ack 4337, win 5393, length 112
  327  18:14:47.156354 74:d4:35:ec:64:73 (oui Unknown) > 80:1f:02:ff:ca:5d (oui Unknown), ethertype IPv4 (0x0800), length 102: legolas.ssh > 172.23.15.73.49186: Flags [P.], seq 15232:15280, ack 4337, win 5393, length 48
  328  18:14:47.157282 74:d4:35:ec:64:73 (oui Unknown) > 80:1f:02:ff:ca:5d (oui Unknown), ethertype IPv4 (0x0800), length 134: legolas.ssh > 172.23.15.73.49186: Flags [P.], seq 15280:15360, ack 4337, win 5393, length 80
  329  18:14:47.157380 74:d4:35:ec:64:73 (oui Unknown) > 80:1f:02:ff:ca:5d (oui Unknown), ethertype IPv4 (0x0800), length 102: legolas.ssh > 172.23.15.73.49186: Flags [P.], seq 15360:15408, ack 4337, win 5393, length 48
  330  18:14:47.158235 74:d4:35:ec:64:73 (oui Unknown) > 80:1f:02:ff:ca:5d (oui Unknown), ethertype IPv4 (0x0800), length 102: legolas.ssh > 172.23.15.73.49186: Flags [P.], seq 15408:15456, ack 4337, win 5393, length 48
  331  18:14:47.158342 74:d4:35:ec:64:73 (oui Unknown) > 80:1f:02:ff:ca:5d (oui Unknown), ethertype IPv4 (0x0800), length 102: legolas.ssh > 172.23.15.73.49186: Flags [P.], seq 15456:15504, ack 4337, win 5393, length 48
  332  18:14:47.161001 80:1f:02:ff:ca:5d (oui Unknown) > 74:d4:35:ec:64:73 (oui Unknown), ethertype IPv4 (0x0800), length 60: 172.23.15.73.49186 > legolas.ssh: Flags [.], ack 15120, win 511, length 0
  333  18:14:47.161071 80:1f:02:ff:ca:5d (oui Unknown) > 74:d4:35:ec:64:73 (oui Unknown), ethertype IPv4 (0x0800), length 60: 172.23.15.73.49186 > legolas.ssh: Flags [.], ack 15280, win 510, length 0
  334  18:14:47.162248 80:1f:02:ff:ca:5d (oui Unknown) > 74:d4:35:ec:64:73 (oui Unknown), ethertype IPv4 (0x0800), length 60: 172.23.15.73.49186 > legolas.ssh: Flags [.], ack 15408, win 510, length 0
  335  18:14:47.162459 80:1f:02:ff:ca:5d (oui Unknown) > 74:d4:35:ec:64:73 (oui Unknown), ethertype IPv4 (0x0800), length 150: 172.23.15.73.49186 > legolas.ssh: Flags [P.], seq 4337:4433, ack 15408, win 510, length 96
  336  18:14:47.162477 74:d4:35:ec:64:73 (oui Unknown) > 80:1f:02:ff:ca:5d (oui Unknown), ethertype IPv4 (0x0800), length 54: legolas.ssh > 172.23.15.73.49186: Flags [.], ack 4433, win 5393, length 0
  337  18:14:47.162547 80:1f:02:ff:ca:5d (oui Unknown) > 74:d4:35:ec:64:73 (oui Unknown), ethertype IPv4 (0x0800), length 60: 172.23.15.73.49186 > legolas.ssh: Flags [.], ack 15504, win 510, length 0
  338  18:14:47.162551 74:d4:35:ec:64:73 (oui Unknown) > 80:1f:02:ff:ca:5d (oui Unknown), ethertype IPv4 (0x0800), length 102: legolas.ssh > 172.23.15.73.49186: Flags [P.], seq 15504:15552, ack 4433, win 5393, length 48
  339  18:14:47.179835 80:1f:02:ff:ca:5d (oui Unknown) > 74:d4:35:ec:64:73 (oui Unknown), ethertype IPv4 (0x0800), length 118: 172.23.15.73.49186 > legolas.ssh: Flags [P.], seq 4433:4497, ack 15552, win 509, length 64
  340  18:14:47.179852 74:d4:35:ec:64:73 (oui Unknown) > 80:1f:02:ff:ca:5d (oui Unknown), ethertype IPv4 (0x0800), length 54: legolas.ssh > 172.23.15.73.49186: Flags [.], ack 4497, win 5393, length 0
  341  18:14:47.180091 74:d4:35:ec:64:73 (oui Unknown) > 80:1f:02:ff:ca:5d (oui Unknown), ethertype IPv4 (0x0800), length 102: legolas.ssh > 172.23.15.73.49186: Flags [P.], seq 15552:15600, ack 4497, win 5393, length 48
  342  18:14:47.185617 80:1f:02:ff:ca:5d (oui Unknown) > 74:d4:35:ec:64:73 (oui Unknown), ethertype IPv4 (0x0800), length 118: 172.23.15.73.49186 > legolas.ssh: Flags [P.], seq 4497:4561, ack 15600, win 509, length 64
  343  18:14:47.185629 74:d4:35:ec:64:73 (oui Unknown) > 80:1f:02:ff:ca:5d (oui Unknown), ethertype IPv4 (0x0800), length 54: legolas.ssh > 172.23.15.73.49186: Flags [.], ack 4561, win 5393, length 0
  344  18:14:47.186196 74:d4:35:ec:64:73 (oui Unknown) > 80:1f:02:ff:ca:5d (oui Unknown), ethertype IPv4 (0x0800), length 118: legolas.ssh > 172.23.15.73.49186: Flags [P.], seq 15600:15664, ack 4561, win 5393, length 64
  345  18:14:47.186452 74:d4:35:ec:64:73 (oui Unknown) > 80:1f:02:ff:ca:5d (oui Unknown), ethertype IPv4 (0x0800), length 246: legolas.ssh > 172.23.15.73.49186: Flags [P.], seq 15664:15856, ack 4561, win 5393, length 192
  346  18:14:47.190763 80:1f:02:ff:ca:5d (oui Unknown) > 74:d4:35:ec:64:73 (oui Unknown), ethertype IPv4 (0x0800), length 60: 172.23.15.73.49186 > legolas.ssh: Flags [.], ack 15856, win 508, length 0
  347  18:14:47.191172 80:1f:02:ff:ca:5d (oui Unknown) > 74:d4:35:ec:64:73 (oui Unknown), ethertype IPv4 (0x0800), length 118: 172.23.15.73.49186 > legolas.ssh: Flags [P.], seq 4561:4625, ack 15856, win 508, length 64
  348  18:14:47.193833 80:1f:02:ff:ca:5d (oui Unknown) > 74:d4:35:ec:64:73 (oui Unknown), ethertype IPv4 (0x0800), length 118: 172.23.15.73.49186 > legolas.ssh: Flags [P.], seq 4625:4689, ack 15856, win 508, length 64
  349  18:14:47.193854 74:d4:35:ec:64:73 (oui Unknown) > 80:1f:02:ff:ca:5d (oui Unknown), ethertype IPv4 (0x0800), length 54: legolas.ssh > 172.23.15.73.49186: Flags [.], ack 4689, win 5393, length 0
  350  18:14:47.219458 74:d4:35:ec:64:73 (oui Unknown) > 80:1f:02:ff:ca:5d (oui Unknown), ethertype IPv4 (0x0800), length 246: legolas.ssh > 172.23.15.73.49186: Flags [P.], seq 15856:16048, ack 4689, win 5393, length 192
  351  18:14:47.228641 80:1f:02:ff:ca:5d (oui Unknown) > 74:d4:35:ec:64:73 (oui Unknown), ethertype IPv4 (0x0800), length 118: 172.23.15.73.49186 > legolas.ssh: Flags [P.], seq 4689:4753, ack 16048, win 507, length 64
  352  18:14:47.270886 74:d4:35:ec:64:73 (oui Unknown) > 80:1f:02:ff:ca:5d (oui Unknown), ethertype IPv4 (0x0800), length 54: legolas.ssh > 172.23.15.73.49186: Flags [.], ack 4753, win 5393, length 0
  353  18:14:47.364552 80:1f:02:ff:ca:5d (oui Unknown) > 74:d4:35:ec:64:73 (oui Unknown), ethertype IPv4 (0x0800), length 118: 172.23.15.73.49186 > legolas.ssh: Flags [P.], seq 4753:4817, ack 16048, win 507, length 64
  354  18:14:47.364612 80:1f:02:ff:ca:5d (oui Unknown) > 74:d4:35:ec:64:73 (oui Unknown), ethertype IPv4 (0x0800), length 118: 172.23.15.73.49186 > legolas.ssh: Flags [P.], seq 4817:4881, ack 16048, win 507, length 64
  355  18:14:47.364659 74:d4:35:ec:64:73 (oui Unknown) > 80:1f:02:ff:ca:5d (oui Unknown), ethertype IPv4 (0x0800), length 54: legolas.ssh > 172.23.15.73.49186: Flags [.], ack 4881, win 5393, length 0
  356  18:14:47.365292 74:d4:35:ec:64:73 (oui Unknown) > 80:1f:02:ff:ca:5d (oui Unknown), ethertype IPv4 (0x0800), length 102: legolas.ssh > 172.23.15.73.49186: Flags [P.], seq 16048:16096, ack 4881, win 5393, length 48
  357  18:14:47.370147 80:1f:02:ff:ca:5d (oui Unknown) > 74:d4:35:ec:64:73 (oui Unknown), ethertype IPv4 (0x0800), length 118: 172.23.15.73.49186 > legolas.ssh: Flags [P.], seq 4881:4945, ack 16096, win 507, length 64
  358  18:14:47.370254 74:d4:35:ec:64:73 (oui Unknown) > 80:1f:02:ff:ca:5d (oui Unknown), ethertype IPv4 (0x0800), length 54: legolas.ssh > 172.23.15.73.49186: Flags [.], ack 4945, win 5393, length 0
  359  18:14:47.371588 74:d4:35:ec:64:73 (oui Unknown) > 80:1f:02:ff:ca:5d (oui Unknown), ethertype IPv4 (0x0800), length 118: legolas.ssh > 172.23.15.73.49186: Flags [P.], seq 16096:16160, ack 4945, win 5393, length 64
  360  18:14:47.375926 80:1f:02:ff:ca:5d (oui Unknown) > 74:d4:35:ec:64:73 (oui Unknown), ethertype IPv4 (0x0800), length 118: 172.23.15.73.49186 > legolas.ssh: Flags [P.], seq 4945:5009, ack 16160, win 507, length 64
  361  18:14:47.375969 74:d4:35:ec:64:73 (oui Unknown) > 80:1f:02:ff:ca:5d (oui Unknown), ethertype IPv4 (0x0800), length 54: legolas.ssh > 172.23.15.73.49186: Flags [.], ack 5009, win 5393, length 0
  362  18:14:47.383189 74:d4:35:ec:64:73 (oui Unknown) > 80:1f:02:ff:ca:5d (oui Unknown), ethertype IPv4 (0x0800), length 262: legolas.ssh > 172.23.15.73.49186: Flags [P.], seq 16160:16368, ack 5009, win 5393, length 208
  363  18:14:47.389990 80:1f:02:ff:ca:5d (oui Unknown) > 74:d4:35:ec:64:73 (oui Unknown), ethertype IPv4 (0x0800), length 118: 172.23.15.73.49186 > legolas.ssh: Flags [P.], seq 5009:5073, ack 16368, win 512, length 64
  364  18:14:47.398707 74:d4:35:ec:64:73 (oui Unknown) > 80:1f:02:ff:ca:5d (oui Unknown), ethertype IPv4 (0x0800), length 278: legolas.ssh > 172.23.15.73.49186: Flags [P.], seq 16368:16592, ack 5073, win 5393, length 224
  365  18:14:47.404203 80:1f:02:ff:ca:5d (oui Unknown) > 74:d4:35:ec:64:73 (oui Unknown), ethertype IPv4 (0x0800), length 166: 172.23.15.73.49186 > legolas.ssh: Flags [P.], seq 5073:5185, ack 16592, win 511, length 112
  366  18:14:47.404272 74:d4:35:ec:64:73 (oui Unknown) > 80:1f:02:ff:ca:5d (oui Unknown), ethertype IPv4 (0x0800), length 102: legolas.ssh > 172.23.15.73.49186: Flags [P.], seq 16592:16640, ack 5185, win 5393, length 48
  367  18:14:47.407422 80:1f:02:ff:ca:5d (oui Unknown) > 74:d4:35:ec:64:73 (oui Unknown), ethertype IPv4 (0x0800), length 118: 172.23.15.73.49186 > legolas.ssh: Flags [P.], seq 5185:5249, ack 16592, win 511, length 64
  368  18:14:47.441976 80:1f:02:ff:ca:5d (oui Unknown) > 74:d4:35:ec:64:73 (oui Unknown), ethertype IPv4 (0x0800), length 66: test-nas.microsoft-ds > legolas.36664: Flags [F.], seq 3550077645, ack 2801552334, win 9384, options [nop,nop,TS val 234766114 ecr 411009797], length 0
  369  18:14:47.442043 74:d4:35:ec:64:73 (oui Unknown) > 80:1f:02:ff:ca:5d (oui Unknown), ethertype IPv4 (0x0800), length 66: legolas.36664 > test-nas.microsoft-ds: Flags [F.], seq 1, ack 1, win 501, options [nop,nop,TS val 411056021 ecr 234766114], length 0
  370  18:14:47.442079 74:d4:35:ec:64:73 (oui Unknown) > 80:1f:02:ff:ca:5d (oui Unknown), ethertype IPv4 (0x0800), length 74: legolas.36666 > test-nas.microsoft-ds: Flags [S], seq 549753015, win 64240, options [mss 1460,sackOK,TS val 411056021 ecr 0,nop,wscale 7], length 0
  371  18:14:47.449301 80:1f:02:ff:ca:5d (oui Unknown) > 74:d4:35:ec:64:73 (oui Unknown), ethertype IPv4 (0x0800), length 60: 172.23.15.73.49186 > legolas.ssh: Flags [.], ack 16640, win 511, length 0
  372  18:14:47.450858 74:d4:35:ec:64:73 (oui Unknown) > 80:1f:02:ff:ca:5d (oui Unknown), ethertype IPv4 (0x0800), length 54: legolas.ssh > 172.23.15.73.49186: Flags [.], ack 5249, win 5393, length 0
  373  18:14:47.482178 80:1f:02:ff:ca:5d (oui Unknown) > 74:d4:35:ec:64:73 (oui Unknown), ethertype IPv4 (0x0800), length 118: 172.23.15.73.49186 > legolas.ssh: Flags [P.], seq 5249:5313, ack 16640, win 511, length 64
  374  18:14:47.482279 74:d4:35:ec:64:73 (oui Unknown) > 80:1f:02:ff:ca:5d (oui Unknown), ethertype IPv4 (0x0800), length 54: legolas.ssh > 172.23.15.73.49186: Flags [.], ack 5313, win 5393, length 0
  375  18:14:47.576477 80:1f:02:ff:ca:5d (oui Unknown) > 74:d4:35:ec:64:73 (oui Unknown), ethertype IPv4 (0x0800), length 66: test-nas.microsoft-ds > legolas.36664: Flags [.], ack 2, win 9384, options [nop,nop,TS val 234766250 ecr 411056021], length 0
  376  18:14:47.576734 80:1f:02:ff:ca:5d (oui Unknown) > 74:d4:35:ec:64:73 (oui Unknown), ethertype IPv4 (0x0800), length 74: test-nas.microsoft-ds > legolas.36666: Flags [S.], seq 3003966066, ack 549753016, win 14480, options [mss 1388,sackOK,TS val 234766250 ecr 411056021,nop,wscale 1], length 0
  377  18:14:47.576789 74:d4:35:ec:64:73 (oui Unknown) > 80:1f:02:ff:ca:5d (oui Unknown), ethertype IPv4 (0x0800), length 66: legolas.36666 > test-nas.microsoft-ds: Flags [.], ack 1, win 502, options [nop,nop,TS val 411056156 ecr 234766250], length 0

