    1  18:29:17.644397 80:1f:02:ff:ca:5d (oui Unknown) > 74:d4:35:ec:64:73 (oui Unknown), ethertype IPv4 (0x0800), length 118: 172.23.15.73.49186 > legolas.ssh: Flags [P.], seq 2262129280:2262129344, ack 2926696448, win 512, length 64
    2  18:29:17.644957 74:d4:35:ec:64:73 (oui Unknown) > 80:1f:02:ff:ca:5d (oui Unknown), ethertype IPv4 (0x0800), length 118: legolas.ssh > 172.23.15.73.49186: Flags [P.], seq 1:65, ack 64, win 5896, length 64
    3  18:29:17.645468 74:d4:35:ec:64:73 (oui Unknown) > 80:1f:02:ff:ca:5d (oui Unknown), ethertype IPv4 (0x0800), length 630: legolas.ssh > 172.23.15.73.49186: Flags [P.], seq 65:641, ack 64, win 5896, length 576
    4  18:29:17.650250 80:1f:02:ff:ca:5d (oui Unknown) > 74:d4:35:ec:64:73 (oui Unknown), ethertype IPv4 (0x0800), length 60: 172.23.15.73.49186 > legolas.ssh: Flags [.], ack 641, win 509, length 0
    5  18:29:17.653164 80:1f:02:ff:ca:5d (oui Unknown) > 74:d4:35:ec:64:73 (oui Unknown), ethertype IPv4 (0x0800), length 118: 172.23.15.73.49186 > legolas.ssh: Flags [P.], seq 64:128, ack 641, win 509, length 64
    6  18:29:17.655170 80:1f:02:ff:ca:5d (oui Unknown) > 74:d4:35:ec:64:73 (oui Unknown), ethertype IPv4 (0x0800), length 118: 172.23.15.73.49186 > legolas.ssh: Flags [P.], seq 128:192, ack 641, win 509, length 64
    7  18:29:17.655196 74:d4:35:ec:64:73 (oui Unknown) > 80:1f:02:ff:ca:5d (oui Unknown), ethertype IPv4 (0x0800), length 54: legolas.ssh > 172.23.15.73.49186: Flags [.], ack 192, win 5896, length 0
    8  18:29:17.676661 74:d4:35:ec:64:73 (oui Unknown) > 80:1f:02:ff:ca:5d (oui Unknown), ethertype IPv4 (0x0800), length 710: legolas.ssh > 172.23.15.73.49186: Flags [P.], seq 641:1297, ack 192, win 5896, length 656
    9  18:29:17.684164 80:1f:02:ff:ca:5d (oui Unknown) > 74:d4:35:ec:64:73 (oui Unknown), ethertype IPv4 (0x0800), length 118: 172.23.15.73.49186 > legolas.ssh: Flags [P.], seq 192:256, ack 1297, win 507, length 64
   10  18:29:17.686938 80:1f:02:ff:ca:5d (oui Unknown) > 74:d4:35:ec:64:73 (oui Unknown), ethertype IPv4 (0x0800), length 118: 172.23.15.73.49186 > legolas.ssh: Flags [P.], seq 256:320, ack 1297, win 507, length 64
   11  18:29:17.686964 74:d4:35:ec:64:73 (oui Unknown) > 80:1f:02:ff:ca:5d (oui Unknown), ethertype IPv4 (0x0800), length 54: legolas.ssh > 172.23.15.73.49186: Flags [.], ack 320, win 5896, length 0
   12  18:29:17.687084 74:d4:35:ec:64:73 (oui Unknown) > 80:1f:02:ff:ca:5d (oui Unknown), ethertype IPv4 (0x0800), length 102: legolas.ssh > 172.23.15.73.49186: Flags [P.], seq 1297:1345, ack 320, win 5896, length 48
   13  18:29:17.693735 80:1f:02:ff:ca:5d (oui Unknown) > 74:d4:35:ec:64:73 (oui Unknown), ethertype IPv4 (0x0800), length 118: 172.23.15.73.49186 > legolas.ssh: Flags [P.], seq 320:384, ack 1345, win 507, length 64
   14  18:29:17.694155 74:d4:35:ec:64:73 (oui Unknown) > 80:1f:02:ff:ca:5d (oui Unknown), ethertype IPv4 (0x0800), length 118: legolas.ssh > 172.23.15.73.49186: Flags [P.], seq 1345:1409, ack 384, win 5896, length 64
   15  18:29:17.699645 80:1f:02:ff:ca:5d (oui Unknown) > 74:d4:35:ec:64:73 (oui Unknown), ethertype IPv4 (0x0800), length 118: 172.23.15.73.49186 > legolas.ssh: Flags [P.], seq 384:448, ack 1409, win 512, length 64
   16  18:29:17.708128 74:d4:35:ec:64:73 (oui Unknown) > 80:1f:02:ff:ca:5d (oui Unknown), ethertype IPv4 (0x0800), length 374: legolas.ssh > 172.23.15.73.49186: Flags [P.], seq 1409:1729, ack 448, win 5896, length 320
   17  18:29:17.717645 80:1f:02:ff:ca:5d (oui Unknown) > 74:d4:35:ec:64:73 (oui Unknown), ethertype IPv4 (0x0800), length 118: 172.23.15.73.49186 > legolas.ssh: Flags [P.], seq 448:512, ack 1729, win 511, length 64
   18  18:29:17.720934 80:1f:02:ff:ca:5d (oui Unknown) > 74:d4:35:ec:64:73 (oui Unknown), ethertype IPv4 (0x0800), length 118: 172.23.15.73.49186 > legolas.ssh: Flags [P.], seq 512:576, ack 1729, win 511, length 64
   19  18:29:17.721004 74:d4:35:ec:64:73 (oui Unknown) > 80:1f:02:ff:ca:5d (oui Unknown), ethertype IPv4 (0x0800), length 54: legolas.ssh > 172.23.15.73.49186: Flags [.], ack 576, win 5896, length 0
   20  18:29:17.721194 74:d4:35:ec:64:73 (oui Unknown) > 80:1f:02:ff:ca:5d (oui Unknown), ethertype IPv4 (0x0800), length 102: legolas.ssh > 172.23.15.73.49186: Flags [P.], seq 1729:1777, ack 576, win 5896, length 48
   21  18:29:17.726422 80:1f:02:ff:ca:5d (oui Unknown) > 74:d4:35:ec:64:73 (oui Unknown), ethertype IPv4 (0x0800), length 118: 172.23.15.73.49186 > legolas.ssh: Flags [P.], seq 576:640, ack 1777, win 510, length 64
   22  18:29:17.726976 74:d4:35:ec:64:73 (oui Unknown) > 80:1f:02:ff:ca:5d (oui Unknown), ethertype IPv4 (0x0800), length 118: legolas.ssh > 172.23.15.73.49186: Flags [P.], seq 1777:1841, ack 640, win 5896, length 64
   23  18:29:17.732418 80:1f:02:ff:ca:5d (oui Unknown) > 74:d4:35:ec:64:73 (oui Unknown), ethertype IPv4 (0x0800), length 118: 172.23.15.73.49186 > legolas.ssh: Flags [P.], seq 640:704, ack 1841, win 510, length 64
   24  18:29:17.738898 74:d4:35:ec:64:73 (oui Unknown) > 80:1f:02:ff:ca:5d (oui Unknown), ethertype IPv4 (0x0800), length 294: legolas.ssh > 172.23.15.73.49186: Flags [P.], seq 1841:2081, ack 704, win 5896, length 240
   25  18:29:17.748402 80:1f:02:ff:ca:5d (oui Unknown) > 74:d4:35:ec:64:73 (oui Unknown), ethertype IPv4 (0x0800), length 118: 172.23.15.73.49186 > legolas.ssh: Flags [P.], seq 704:768, ack 2081, win 509, length 64
   26  18:29:17.754180 80:1f:02:ff:ca:5d (oui Unknown) > 74:d4:35:ec:64:73 (oui Unknown), ethertype IPv4 (0x0800), length 118: 172.23.15.73.49186 > legolas.ssh: Flags [P.], seq 768:832, ack 2081, win 509, length 64
   27  18:29:17.754251 74:d4:35:ec:64:73 (oui Unknown) > 80:1f:02:ff:ca:5d (oui Unknown), ethertype IPv4 (0x0800), length 54: legolas.ssh > 172.23.15.73.49186: Flags [.], ack 832, win 5896, length 0
   28  18:29:17.754440 74:d4:35:ec:64:73 (oui Unknown) > 80:1f:02:ff:ca:5d (oui Unknown), ethertype IPv4 (0x0800), length 102: legolas.ssh > 172.23.15.73.49186: Flags [P.], seq 2081:2129, ack 832, win 5896, length 48
   29  18:29:17.759423 80:1f:02:ff:ca:5d (oui Unknown) > 74:d4:35:ec:64:73 (oui Unknown), ethertype IPv4 (0x0800), length 118: 172.23.15.73.49186 > legolas.ssh: Flags [P.], seq 832:896, ack 2129, win 509, length 64
   30  18:29:17.759966 74:d4:35:ec:64:73 (oui Unknown) > 80:1f:02:ff:ca:5d (oui Unknown), ethertype IPv4 (0x0800), length 118: legolas.ssh > 172.23.15.73.49186: Flags [P.], seq 2129:2193, ack 896, win 5896, length 64
   31  18:29:17.765412 80:1f:02:ff:ca:5d (oui Unknown) > 74:d4:35:ec:64:73 (oui Unknown), ethertype IPv4 (0x0800), length 118: 172.23.15.73.49186 > legolas.ssh: Flags [P.], seq 896:960, ack 2193, win 509, length 64
   32  18:29:17.769909 74:d4:35:ec:64:73 (oui Unknown) > 80:1f:02:ff:ca:5d (oui Unknown), ethertype IPv4 (0x0800), length 294: legolas.ssh > 172.23.15.73.49186: Flags [P.], seq 2193:2433, ack 960, win 5896, length 240
   33  18:29:17.776199 80:1f:02:ff:ca:5d (oui Unknown) > 74:d4:35:ec:64:73 (oui Unknown), ethertype IPv4 (0x0800), length 150: 172.23.15.73.49186 > legolas.ssh: Flags [P.], seq 960:1056, ack 2433, win 508, length 96
   34  18:29:17.776309 74:d4:35:ec:64:73 (oui Unknown) > 80:1f:02:ff:ca:5d (oui Unknown), ethertype IPv4 (0x0800), length 102: legolas.ssh > 172.23.15.73.49186: Flags [P.], seq 2433:2481, ack 1056, win 5896, length 48
   35  18:29:17.779921 80:1f:02:ff:ca:5d (oui Unknown) > 74:d4:35:ec:64:73 (oui Unknown), ethertype IPv4 (0x0800), length 118: 172.23.15.73.49186 > legolas.ssh: Flags [P.], seq 1056:1120, ack 2433, win 508, length 64
   36  18:29:17.810904 80:1f:02:ff:ca:5d (oui Unknown) > 74:d4:35:ec:64:73 (oui Unknown), ethertype IPv4 (0x0800), length 118: 172.23.15.73.49186 > legolas.ssh: Flags [P.], seq 1120:1184, ack 2481, win 508, length 64
   37  18:29:17.810926 74:d4:35:ec:64:73 (oui Unknown) > 80:1f:02:ff:ca:5d (oui Unknown), ethertype IPv4 (0x0800), length 54: legolas.ssh > 172.23.15.73.49186: Flags [.], ack 1184, win 5896, length 0
   38  18:29:17.811132 80:1f:02:ff:ca:5d (oui Unknown) > 74:d4:35:ec:64:73 (oui Unknown), ethertype IPv4 (0x0800), length 118: 172.23.15.73.49186 > legolas.ssh: Flags [P.], seq 1184:1248, ack 2481, win 508, length 64
   39  18:29:17.811186 74:d4:35:ec:64:73 (oui Unknown) > 80:1f:02:ff:ca:5d (oui Unknown), ethertype IPv4 (0x0800), length 102: legolas.ssh > 172.23.15.73.49186: Flags [P.], seq 2481:2529, ack 1248, win 5896, length 48
   40  18:29:17.817165 80:1f:02:ff:ca:5d (oui Unknown) > 74:d4:35:ec:64:73 (oui Unknown), ethertype IPv4 (0x0800), length 118: 172.23.15.73.49186 > legolas.ssh: Flags [P.], seq 1248:1312, ack 2529, win 507, length 64
   41  18:29:17.817848 74:d4:35:ec:64:73 (oui Unknown) > 80:1f:02:ff:ca:5d (oui Unknown), ethertype IPv4 (0x0800), length 118: legolas.ssh > 172.23.15.73.49186: Flags [P.], seq 2529:2593, ack 1312, win 5896, length 64
   42  18:29:17.823141 80:1f:02:ff:ca:5d (oui Unknown) > 74:d4:35:ec:64:73 (oui Unknown), ethertype IPv4 (0x0800), length 118: 172.23.15.73.49186 > legolas.ssh: Flags [P.], seq 1312:1376, ack 2593, win 507, length 64
   43  18:29:17.829385 74:d4:35:ec:64:73 (oui Unknown) > 80:1f:02:ff:ca:5d (oui Unknown), ethertype IPv4 (0x0800), length 262: legolas.ssh > 172.23.15.73.49186: Flags [P.], seq 2593:2801, ack 1376, win 5896, length 208
   44  18:29:17.838444 80:1f:02:ff:ca:5d (oui Unknown) > 74:d4:35:ec:64:73 (oui Unknown), ethertype IPv4 (0x0800), length 118: 172.23.15.73.49186 > legolas.ssh: Flags [P.], seq 1376:1440, ack 2801, win 512, length 64
   45  18:29:17.844158 74:d4:35:ec:64:73 (oui Unknown) > 80:1f:02:ff:ca:5d (oui Unknown), ethertype IPv4 (0x0800), length 438: legolas.ssh > 172.23.15.73.49186: Flags [P.], seq 2801:3185, ack 1440, win 5896, length 384
   46  18:29:17.854405 80:1f:02:ff:ca:5d (oui Unknown) > 74:d4:35:ec:64:73 (oui Unknown), ethertype IPv4 (0x0800), length 118: 172.23.15.73.49186 > legolas.ssh: Flags [P.], seq 1440:1504, ack 3185, win 510, length 64
   47  18:29:17.894859 74:d4:35:ec:64:73 (oui Unknown) > 80:1f:02:ff:ca:5d (oui Unknown), ethertype IPv4 (0x0800), length 54: legolas.ssh > 172.23.15.73.49186: Flags [.], ack 1504, win 5896, length 0
   48  18:29:17.921049 74:d4:35:ec:64:73 (oui Unknown) > 80:1f:02:ff:ca:5d (oui Unknown), ethertype IPv4 (0x0800), length 134: legolas.ssh > 172.23.15.73.49186: Flags [P.], seq 3185:3265, ack 1504, win 5896, length 80
   49  18:29:17.921905 74:d4:35:ec:64:73 (oui Unknown) > 80:1f:02:ff:ca:5d (oui Unknown), ethertype IPv4 (0x0800), length 166: legolas.ssh > 172.23.15.73.49186: Flags [P.], seq 3265:3377, ack 1504, win 5896, length 112
   50  18:29:17.922719 74:d4:35:ec:64:73 (oui Unknown) > 80:1f:02:ff:ca:5d (oui Unknown), ethertype IPv4 (0x0800), length 182: legolas.ssh > 172.23.15.73.49186: Flags [P.], seq 3377:3505, ack 1504, win 5896, length 128
   51  18:29:17.922792 74:d4:35:ec:64:73 (oui Unknown) > 80:1f:02:ff:ca:5d (oui Unknown), ethertype IPv4 (0x0800), length 102: legolas.ssh > 172.23.15.73.49186: Flags [P.], seq 3505:3553, ack 1504, win 5896, length 48
   52  18:29:17.923715 74:d4:35:ec:64:73 (oui Unknown) > 80:1f:02:ff:ca:5d (oui Unknown), ethertype IPv4 (0x0800), length 118: legolas.ssh > 172.23.15.73.49186: Flags [P.], seq 3553:3617, ack 1504, win 5896, length 64
   53  18:29:17.923820 74:d4:35:ec:64:73 (oui Unknown) > 80:1f:02:ff:ca:5d (oui Unknown), ethertype IPv4 (0x0800), length 102: legolas.ssh > 172.23.15.73.49186: Flags [P.], seq 3617:3665, ack 1504, win 5896, length 48
   54  18:29:17.924676 74:d4:35:ec:64:73 (oui Unknown) > 80:1f:02:ff:ca:5d (oui Unknown), ethertype IPv4 (0x0800), length 102: legolas.ssh > 172.23.15.73.49186: Flags [P.], seq 3665:3713, ack 1504, win 5896, length 48
   55  18:29:17.924785 74:d4:35:ec:64:73 (oui Unknown) > 80:1f:02:ff:ca:5d (oui Unknown), ethertype IPv4 (0x0800), length 102: legolas.ssh > 172.23.15.73.49186: Flags [P.], seq 3713:3761, ack 1504, win 5896, length 48
   56  18:29:17.927434 80:1f:02:ff:ca:5d (oui Unknown) > 74:d4:35:ec:64:73 (oui Unknown), ethertype IPv4 (0x0800), length 60: 172.23.15.73.49186 > legolas.ssh: Flags [.], ack 3377, win 510, length 0
   57  18:29:17.927547 80:1f:02:ff:ca:5d (oui Unknown) > 74:d4:35:ec:64:73 (oui Unknown), ethertype IPv4 (0x0800), length 60: 172.23.15.73.49186 > legolas.ssh: Flags [.], ack 3553, win 509, length 0
   58  18:29:17.927641 80:1f:02:ff:ca:5d (oui Unknown) > 74:d4:35:ec:64:73 (oui Unknown), ethertype IPv4 (0x0800), length 60: 172.23.15.73.49186 > legolas.ssh: Flags [.], ack 3665, win 508, length 0
   59  18:29:17.928770 80:1f:02:ff:ca:5d (oui Unknown) > 74:d4:35:ec:64:73 (oui Unknown), ethertype IPv4 (0x0800), length 60: 172.23.15.73.49186 > legolas.ssh: Flags [.], ack 3761, win 508, length 0
   60  18:29:18.419509 74:d4:35:ec:64:73 (oui Unknown) > 80:1f:02:ff:ca:5d (oui Unknown), ethertype IPv4 (0x0800), length 326: legolas.ssh > 172.23.15.73.49186: Flags [P.], seq 3761:4033, ack 1504, win 5896, length 272
   61  18:29:18.427705 80:1f:02:ff:ca:5d (oui Unknown) > 74:d4:35:ec:64:73 (oui Unknown), ethertype IPv4 (0x0800), length 118: 172.23.15.73.49186 > legolas.ssh: Flags [P.], seq 1504:1568, ack 4033, win 507, length 64
   62  18:29:18.427716 74:d4:35:ec:64:73 (oui Unknown) > 80:1f:02:ff:ca:5d (oui Unknown), ethertype IPv4 (0x0800), length 54: legolas.ssh > 172.23.15.73.49186: Flags [.], ack 1568, win 5896, length 0
   63  18:29:18.528499 c4:e9:84:03:91:37 (oui Unknown) > 01:00:5e:7f:ff:fa (oui Unknown), ethertype IPv4 (0x0800), length 215: 10.10.0.95.63779 > 239.255.255.250.1900: UDP, length 173
   64  18:29:18.651642 74:d4:35:ec:64:73 (oui Unknown) > 80:1f:02:ff:ca:5d (oui Unknown), ethertype IPv4 (0x0800), length 96: legolas.35680 > ro-dc4.romania.luxoft.com.domain: 13850+ [1au] PTR? 73.15.23.172.in-addr.arpa. (54)
   65  18:29:18.652246 80:1f:02:ff:ca:5d (oui Unknown) > 74:d4:35:ec:64:73 (oui Unknown), ethertype IPv4 (0x0800), length 131: ro-dc4.romania.luxoft.com.domain > legolas.35680: 13850 NXDomain 0/1/1 (89)
   66  18:29:18.652308 74:d4:35:ec:64:73 (oui Unknown) > 80:1f:02:ff:ca:5d (oui Unknown), ethertype IPv4 (0x0800), length 85: legolas.35680 > ro-dc4.romania.luxoft.com.domain: 13850+ PTR? 73.15.23.172.in-addr.arpa. (43)
   67  18:29:18.653123 80:1f:02:ff:ca:5d (oui Unknown) > 74:d4:35:ec:64:73 (oui Unknown), ethertype IPv4 (0x0800), length 120: ro-dc4.romania.luxoft.com.domain > legolas.35680: 13850 NXDomain 0/1/0 (78)
   68  18:29:18.654092 74:d4:35:ec:64:73 (oui Unknown) > 80:1f:02:ff:ca:5d (oui Unknown), ethertype IPv4 (0x0800), length 99: legolas.46912 > ro-dc4.romania.luxoft.com.domain: 56626+ [1au] PTR? 250.255.255.239.in-addr.arpa. (57)
   69  18:29:18.654709 80:1f:02:ff:ca:5d (oui Unknown) > 74:d4:35:ec:64:73 (oui Unknown), ethertype IPv4 (0x0800), length 156: ro-dc4.romania.luxoft.com.domain > legolas.46912: 56626 NXDomain 0/1/1 (114)
   70  18:29:18.654766 74:d4:35:ec:64:73 (oui Unknown) > 80:1f:02:ff:ca:5d (oui Unknown), ethertype IPv4 (0x0800), length 88: legolas.46912 > ro-dc4.romania.luxoft.com.domain: 56626+ PTR? 250.255.255.239.in-addr.arpa. (46)
   71  18:29:18.655293 80:1f:02:ff:ca:5d (oui Unknown) > 74:d4:35:ec:64:73 (oui Unknown), ethertype IPv4 (0x0800), length 145: ro-dc4.romania.luxoft.com.domain > legolas.46912: 56626 NXDomain 0/1/0 (103)
   72  18:29:18.655742 74:d4:35:ec:64:73 (oui Unknown) > 80:1f:02:ff:ca:5d (oui Unknown), ethertype IPv4 (0x0800), length 94: legolas.48495 > ro-dc4.romania.luxoft.com.domain: 27517+ [1au] PTR? 95.0.10.10.in-addr.arpa. (52)
   73  18:29:18.656321 80:1f:02:ff:ca:5d (oui Unknown) > 74:d4:35:ec:64:73 (oui Unknown), ethertype IPv4 (0x0800), length 129: ro-dc4.romania.luxoft.com.domain > legolas.48495: 27517 NXDomain 0/1/1 (87)
   74  18:29:18.656377 74:d4:35:ec:64:73 (oui Unknown) > 80:1f:02:ff:ca:5d (oui Unknown), ethertype IPv4 (0x0800), length 83: legolas.48495 > ro-dc4.romania.luxoft.com.domain: 27517+ PTR? 95.0.10.10.in-addr.arpa. (41)
   75  18:29:18.656803 80:1f:02:ff:ca:5d (oui Unknown) > 74:d4:35:ec:64:73 (oui Unknown), ethertype IPv4 (0x0800), length 118: ro-dc4.romania.luxoft.com.domain > legolas.48495: 27517 NXDomain 0/1/0 (76)
   76  18:29:18.784031 00:1f:da:5e:d8:01 (oui Unknown) > 01:80:c2:00:00:00 (oui Unknown), 802.3, length 38: LLC, dsap STP (0x42) Individual, ssap STP (0x42) Command, ctrl 0x03: STP 802.1d, Config, Flags [none], bridge-id 8000.00:1f:da:5e:d8:01.8019, length 35
   77  18:29:18.926770 74:d4:35:ec:64:73 (oui Unknown) > 80:1f:02:ff:ca:5d (oui Unknown), ethertype IPv4 (0x0800), length 134: legolas.ssh > 172.23.15.73.49186: Flags [P.], seq 4033:4113, ack 1568, win 5896, length 80
   78  18:29:18.927629 74:d4:35:ec:64:73 (oui Unknown) > 80:1f:02:ff:ca:5d (oui Unknown), ethertype IPv4 (0x0800), length 134: legolas.ssh > 172.23.15.73.49186: Flags [P.], seq 4113:4193, ack 1568, win 5896, length 80
   79  18:29:18.928475 74:d4:35:ec:64:73 (oui Unknown) > 80:1f:02:ff:ca:5d (oui Unknown), ethertype IPv4 (0x0800), length 182: legolas.ssh > 172.23.15.73.49186: Flags [P.], seq 4193:4321, ack 1568, win 5896, length 128
   80  18:29:18.928536 74:d4:35:ec:64:73 (oui Unknown) > 80:1f:02:ff:ca:5d (oui Unknown), ethertype IPv4 (0x0800), length 102: legolas.ssh > 172.23.15.73.49186: Flags [P.], seq 4321:4369, ack 1568, win 5896, length 48
   81  18:29:18.929470 74:d4:35:ec:64:73 (oui Unknown) > 80:1f:02:ff:ca:5d (oui Unknown), ethertype IPv4 (0x0800), length 118: legolas.ssh > 172.23.15.73.49186: Flags [P.], seq 4369:4433, ack 1568, win 5896, length 64
   82  18:29:18.929565 74:d4:35:ec:64:73 (oui Unknown) > 80:1f:02:ff:ca:5d (oui Unknown), ethertype IPv4 (0x0800), length 102: legolas.ssh > 172.23.15.73.49186: Flags [P.], seq 4433:4481, ack 1568, win 5896, length 48
   83  18:29:18.930416 74:d4:35:ec:64:73 (oui Unknown) > 80:1f:02:ff:ca:5d (oui Unknown), ethertype IPv4 (0x0800), length 102: legolas.ssh > 172.23.15.73.49186: Flags [P.], seq 4481:4529, ack 1568, win 5896, length 48
   84  18:29:18.930523 74:d4:35:ec:64:73 (oui Unknown) > 80:1f:02:ff:ca:5d (oui Unknown), ethertype IPv4 (0x0800), length 102: legolas.ssh > 172.23.15.73.49186: Flags [P.], seq 4529:4577, ack 1568, win 5896, length 48
   85  18:29:18.931767 80:1f:02:ff:ca:5d (oui Unknown) > 74:d4:35:ec:64:73 (oui Unknown), ethertype IPv4 (0x0800), length 60: 172.23.15.73.49186 > legolas.ssh: Flags [.], ack 4193, win 512, length 0
   86  18:29:18.932984 80:1f:02:ff:ca:5d (oui Unknown) > 74:d4:35:ec:64:73 (oui Unknown), ethertype IPv4 (0x0800), length 60: 172.23.15.73.49186 > legolas.ssh: Flags [.], ack 4369, win 511, length 0
   87  18:29:18.933493 80:1f:02:ff:ca:5d (oui Unknown) > 74:d4:35:ec:64:73 (oui Unknown), ethertype IPv4 (0x0800), length 60: 172.23.15.73.49186 > legolas.ssh: Flags [.], ack 4481, win 511, length 0
   88  18:29:18.934480 80:1f:02:ff:ca:5d (oui Unknown) > 74:d4:35:ec:64:73 (oui Unknown), ethertype IPv4 (0x0800), length 60: 172.23.15.73.49186 > legolas.ssh: Flags [.], ack 4577, win 510, length 0
   89  18:29:19.020823 74:d4:35:ec:64:73 (oui Unknown) > 80:1f:02:ff:ca:5d (oui Unknown), ethertype IPv4 (0x0800), length 262: legolas.ssh > 172.23.15.73.49186: Flags [P.], seq 4577:4785, ack 1568, win 5896, length 208
   90  18:29:19.029234 80:1f:02:ff:ca:5d (oui Unknown) > 74:d4:35:ec:64:73 (oui Unknown), ethertype IPv4 (0x0800), length 102: 172.23.15.73.49186 > legolas.ssh: Flags [P.], seq 1568:1616, ack 4785, win 509, length 48
   91  18:29:19.029251 74:d4:35:ec:64:73 (oui Unknown) > 80:1f:02:ff:ca:5d (oui Unknown), ethertype IPv4 (0x0800), length 54: legolas.ssh > 172.23.15.73.49186: Flags [.], ack 1616, win 5896, length 0
   92  18:29:19.397658 00:1f:da:5e:d8:01 (oui Unknown) > 01:00:81:00:01:01 (oui Unknown), 802.3, length 19: LLC, dsap SNAP (0xaa) Individual, ssap SNAP (0xaa) Command, ctrl 0x03: oui Nortel Networks SONMP (0x000081), pid Unknown (0x01a1), length 11: 
	0x0000:  aaaa 0300 0081 01a1 c0a8 0101 0001 199f  ................
	0x0010:  0c02 00                                  ...
   93  18:29:19.529086 c4:e9:84:03:91:37 (oui Unknown) > 01:00:5e:7f:ff:fa (oui Unknown), ethertype IPv4 (0x0800), length 215: 10.10.0.95.63779 > 239.255.255.250.1900: UDP, length 173
   94  18:29:19.622174 74:d4:35:ec:64:73 (oui Unknown) > 80:1f:02:ff:ca:5d (oui Unknown), ethertype IPv4 (0x0800), length 246: legolas.ssh > 172.23.15.73.49186: Flags [P.], seq 4785:4977, ack 1616, win 5896, length 192
   95  18:29:19.632856 80:1f:02:ff:ca:5d (oui Unknown) > 74:d4:35:ec:64:73 (oui Unknown), ethertype IPv4 (0x0800), length 118: 172.23.15.73.49186 > legolas.ssh: Flags [P.], seq 1616:1680, ack 4977, win 509, length 64
   96  18:29:19.632864 74:d4:35:ec:64:73 (oui Unknown) > 80:1f:02:ff:ca:5d (oui Unknown), ethertype IPv4 (0x0800), length 54: legolas.ssh > 172.23.15.73.49186: Flags [.], ack 1680, win 5896, length 0
   97  18:29:19.932528 74:d4:35:ec:64:73 (oui Unknown) > 80:1f:02:ff:ca:5d (oui Unknown), ethertype IPv4 (0x0800), length 118: legolas.ssh > 172.23.15.73.49186: Flags [P.], seq 4977:5041, ack 1680, win 5896, length 64
   98  18:29:19.933566 74:d4:35:ec:64:73 (oui Unknown) > 80:1f:02:ff:ca:5d (oui Unknown), ethertype IPv4 (0x0800), length 134: legolas.ssh > 172.23.15.73.49186: Flags [P.], seq 5041:5121, ack 1680, win 5896, length 80
   99  18:29:19.934239 74:d4:35:ec:64:73 (oui Unknown) > 80:1f:02:ff:ca:5d (oui Unknown), ethertype IPv4 (0x0800), length 166: legolas.ssh > 172.23.15.73.49186: Flags [P.], seq 5121:5233, ack 1680, win 5896, length 112
  100  18:29:19.934320 74:d4:35:ec:64:73 (oui Unknown) > 80:1f:02:ff:ca:5d (oui Unknown), ethertype IPv4 (0x0800), length 102: legolas.ssh > 172.23.15.73.49186: Flags [P.], seq 5233:5281, ack 1680, win 5896, length 48
  101  18:29:19.935252 74:d4:35:ec:64:73 (oui Unknown) > 80:1f:02:ff:ca:5d (oui Unknown), ethertype IPv4 (0x0800), length 118: legolas.ssh > 172.23.15.73.49186: Flags [P.], seq 5281:5345, ack 1680, win 5896, length 64
  102  18:29:19.935352 74:d4:35:ec:64:73 (oui Unknown) > 80:1f:02:ff:ca:5d (oui Unknown), ethertype IPv4 (0x0800), length 102: legolas.ssh > 172.23.15.73.49186: Flags [P.], seq 5345:5393, ack 1680, win 5896, length 48
  103  18:29:19.936203 74:d4:35:ec:64:73 (oui Unknown) > 80:1f:02:ff:ca:5d (oui Unknown), ethertype IPv4 (0x0800), length 102: legolas.ssh > 172.23.15.73.49186: Flags [P.], seq 5393:5441, ack 1680, win 5896, length 48
  104  18:29:19.936307 74:d4:35:ec:64:73 (oui Unknown) > 80:1f:02:ff:ca:5d (oui Unknown), ethertype IPv4 (0x0800), length 102: legolas.ssh > 172.23.15.73.49186: Flags [P.], seq 5441:5489, ack 1680, win 5896, length 48
  105  18:29:19.938943 80:1f:02:ff:ca:5d (oui Unknown) > 74:d4:35:ec:64:73 (oui Unknown), ethertype IPv4 (0x0800), length 60: 172.23.15.73.49186 > legolas.ssh: Flags [.], ack 5121, win 508, length 0
  106  18:29:19.938943 80:1f:02:ff:ca:5d (oui Unknown) > 74:d4:35:ec:64:73 (oui Unknown), ethertype IPv4 (0x0800), length 60: 172.23.15.73.49186 > legolas.ssh: Flags [.], ack 5281, win 508, length 0
  107  18:29:19.939383 80:1f:02:ff:ca:5d (oui Unknown) > 74:d4:35:ec:64:73 (oui Unknown), ethertype IPv4 (0x0800), length 150: 172.23.15.73.49186 > legolas.ssh: Flags [P.], seq 1680:1776, ack 5281, win 508, length 96
  108  18:29:19.939394 74:d4:35:ec:64:73 (oui Unknown) > 80:1f:02:ff:ca:5d (oui Unknown), ethertype IPv4 (0x0800), length 54: legolas.ssh > 172.23.15.73.49186: Flags [.], ack 1776, win 5896, length 0
  109  18:29:19.939411 80:1f:02:ff:ca:5d (oui Unknown) > 74:d4:35:ec:64:73 (oui Unknown), ethertype IPv4 (0x0800), length 60: 172.23.15.73.49186 > legolas.ssh: Flags [.], ack 5393, win 507, length 0
  110  18:29:19.939469 74:d4:35:ec:64:73 (oui Unknown) > 80:1f:02:ff:ca:5d (oui Unknown), ethertype IPv4 (0x0800), length 102: legolas.ssh > 172.23.15.73.49186: Flags [P.], seq 5489:5537, ack 1776, win 5896, length 48
  111  18:29:19.940785 80:1f:02:ff:ca:5d (oui Unknown) > 74:d4:35:ec:64:73 (oui Unknown), ethertype IPv4 (0x0800), length 60: 172.23.15.73.49186 > legolas.ssh: Flags [.], ack 5489, win 507, length 0
  112  18:29:20.000128 80:1f:02:ff:ca:5d (oui Unknown) > 74:d4:35:ec:64:73 (oui Unknown), ethertype IPv4 (0x0800), length 60: 172.23.15.73.49186 > legolas.ssh: Flags [.], ack 5537, win 507, length 0
  113  18:29:20.223962 74:d4:35:ec:64:73 (oui Unknown) > 80:1f:02:ff:ca:5d (oui Unknown), ethertype IPv4 (0x0800), length 246: legolas.ssh > 172.23.15.73.49186: Flags [P.], seq 5537:5729, ack 1776, win 5896, length 192
  114  18:29:20.234665 80:1f:02:ff:ca:5d (oui Unknown) > 74:d4:35:ec:64:73 (oui Unknown), ethertype IPv4 (0x0800), length 118: 172.23.15.73.49186 > legolas.ssh: Flags [P.], seq 1776:1840, ack 5729, win 512, length 64
  115  18:29:20.234683 74:d4:35:ec:64:73 (oui Unknown) > 80:1f:02:ff:ca:5d (oui Unknown), ethertype IPv4 (0x0800), length 54: legolas.ssh > 172.23.15.73.49186: Flags [.], ack 1840, win 5896, length 0
  116  18:29:20.522878 80:1f:02:ff:ca:5d (oui Unknown) > 74:d4:35:ec:64:73 (oui Unknown), ethertype ARP (0x0806), length 60: Request who-has legolas tell _gateway, length 46
  117  18:29:20.522900 74:d4:35:ec:64:73 (oui Unknown) > 80:1f:02:ff:ca:5d (oui Unknown), ethertype ARP (0x0806), length 42: Reply legolas is-at 74:d4:35:ec:64:73 (oui Unknown), length 28
  118  18:29:20.530831 c4:e9:84:03:91:37 (oui Unknown) > 01:00:5e:7f:ff:fa (oui Unknown), ethertype IPv4 (0x0800), length 215: 10.10.0.95.63779 > 239.255.255.250.1900: UDP, length 173
  119  18:29:20.700306 74:d4:35:ec:64:73 (oui Unknown) > 80:1f:02:ff:ca:5d (oui Unknown), ethertype IPv4 (0x0800), length 93: legolas.32886 > ro-dc4.romania.luxoft.com.domain: 13168+ [1au] PTR? 1.0.10.10.in-addr.arpa. (51)
  120  18:29:20.701147 80:1f:02:ff:ca:5d (oui Unknown) > 74:d4:35:ec:64:73 (oui Unknown), ethertype IPv4 (0x0800), length 128: ro-dc4.romania.luxoft.com.domain > legolas.32886: 13168 NXDomain 0/1/1 (86)
  121  18:29:20.701309 74:d4:35:ec:64:73 (oui Unknown) > 80:1f:02:ff:ca:5d (oui Unknown), ethertype IPv4 (0x0800), length 82: legolas.32886 > ro-dc4.romania.luxoft.com.domain: 13168+ PTR? 1.0.10.10.in-addr.arpa. (40)
  122  18:29:20.702498 80:1f:02:ff:ca:5d (oui Unknown) > 74:d4:35:ec:64:73 (oui Unknown), ethertype IPv4 (0x0800), length 117: ro-dc4.romania.luxoft.com.domain > legolas.32886: 13168 NXDomain 0/1/0 (75)
  123  18:29:20.784048 00:1f:da:5e:d8:01 (oui Unknown) > 01:80:c2:00:00:00 (oui Unknown), 802.3, length 38: LLC, dsap STP (0x42) Individual, ssap STP (0x42) Command, ctrl 0x03: STP 802.1d, Config, Flags [none], bridge-id 8000.00:1f:da:5e:d8:01.8019, length 35
  124  18:29:20.825323 74:d4:35:ec:64:73 (oui Unknown) > 80:1f:02:ff:ca:5d (oui Unknown), ethertype IPv4 (0x0800), length 246: legolas.ssh > 172.23.15.73.49186: Flags [P.], seq 5729:5921, ack 1840, win 5896, length 192
  125  18:29:20.834912 80:1f:02:ff:ca:5d (oui Unknown) > 74:d4:35:ec:64:73 (oui Unknown), ethertype IPv4 (0x0800), length 118: 172.23.15.73.49186 > legolas.ssh: Flags [P.], seq 1840:1904, ack 5921, win 511, length 64
  126  18:29:20.834963 74:d4:35:ec:64:73 (oui Unknown) > 80:1f:02:ff:ca:5d (oui Unknown), ethertype IPv4 (0x0800), length 54: legolas.ssh > 172.23.15.73.49186: Flags [.], ack 1904, win 5896, length 0
  127  18:29:20.938474 74:d4:35:ec:64:73 (oui Unknown) > 80:1f:02:ff:ca:5d (oui Unknown), ethertype IPv4 (0x0800), length 134: legolas.ssh > 172.23.15.73.49186: Flags [P.], seq 5921:6001, ack 1904, win 5896, length 80
  128  18:29:20.939346 74:d4:35:ec:64:73 (oui Unknown) > 80:1f:02:ff:ca:5d (oui Unknown), ethertype IPv4 (0x0800), length 150: legolas.ssh > 172.23.15.73.49186: Flags [P.], seq 6001:6097, ack 1904, win 5896, length 96
  129  18:29:20.940210 74:d4:35:ec:64:73 (oui Unknown) > 80:1f:02:ff:ca:5d (oui Unknown), ethertype IPv4 (0x0800), length 182: legolas.ssh > 172.23.15.73.49186: Flags [P.], seq 6097:6225, ack 1904, win 5896, length 128
  130  18:29:20.940277 74:d4:35:ec:64:73 (oui Unknown) > 80:1f:02:ff:ca:5d (oui Unknown), ethertype IPv4 (0x0800), length 102: legolas.ssh > 172.23.15.73.49186: Flags [P.], seq 6225:6273, ack 1904, win 5896, length 48
  131  18:29:20.941206 74:d4:35:ec:64:73 (oui Unknown) > 80:1f:02:ff:ca:5d (oui Unknown), ethertype IPv4 (0x0800), length 134: legolas.ssh > 172.23.15.73.49186: Flags [P.], seq 6273:6353, ack 1904, win 5896, length 80
  132  18:29:20.941307 74:d4:35:ec:64:73 (oui Unknown) > 80:1f:02:ff:ca:5d (oui Unknown), ethertype IPv4 (0x0800), length 102: legolas.ssh > 172.23.15.73.49186: Flags [P.], seq 6353:6401, ack 1904, win 5896, length 48
  133  18:29:20.942160 74:d4:35:ec:64:73 (oui Unknown) > 80:1f:02:ff:ca:5d (oui Unknown), ethertype IPv4 (0x0800), length 102: legolas.ssh > 172.23.15.73.49186: Flags [P.], seq 6401:6449, ack 1904, win 5896, length 48
  134  18:29:20.942271 74:d4:35:ec:64:73 (oui Unknown) > 80:1f:02:ff:ca:5d (oui Unknown), ethertype IPv4 (0x0800), length 102: legolas.ssh > 172.23.15.73.49186: Flags [P.], seq 6449:6497, ack 1904, win 5896, length 48
  135  18:29:20.944568 80:1f:02:ff:ca:5d (oui Unknown) > 74:d4:35:ec:64:73 (oui Unknown), ethertype IPv4 (0x0800), length 60: 172.23.15.73.49186 > legolas.ssh: Flags [.], ack 6097, win 510, length 0
  136  18:29:20.945063 80:1f:02:ff:ca:5d (oui Unknown) > 74:d4:35:ec:64:73 (oui Unknown), ethertype IPv4 (0x0800), length 60: 172.23.15.73.49186 > legolas.ssh: Flags [.], ack 6273, win 510, length 0
  137  18:29:20.946018 80:1f:02:ff:ca:5d (oui Unknown) > 74:d4:35:ec:64:73 (oui Unknown), ethertype IPv4 (0x0800), length 60: 172.23.15.73.49186 > legolas.ssh: Flags [.], ack 6401, win 509, length 0
  138  18:29:20.946167 80:1f:02:ff:ca:5d (oui Unknown) > 74:d4:35:ec:64:73 (oui Unknown), ethertype IPv4 (0x0800), length 60: 172.23.15.73.49186 > legolas.ssh: Flags [.], ack 6497, win 509, length 0
  139  18:29:21.008320 74:d4:35:ec:64:73 (oui Unknown) > 80:1f:02:ff:ca:5d (oui Unknown), ethertype IPv4 (0x0800), length 118: legolas.38838 > platform-nas.ssh: Flags [P.], seq 2494659159:2494659211, ack 1360695730, win 4581, options [nop,nop,TS val 4065459005 ecr 3148974146], length 52
  140  18:29:21.058737 80:1f:02:ff:ca:5d (oui Unknown) > 74:d4:35:ec:64:73 (oui Unknown), ethertype IPv4 (0x0800), length 94: platform-nas.ssh > legolas.38838: Flags [P.], seq 1:29, ack 52, win 6156, options [nop,nop,TS val 3148989202 ecr 4065459005], length 28
  141  18:29:21.058750 74:d4:35:ec:64:73 (oui Unknown) > 80:1f:02:ff:ca:5d (oui Unknown), ethertype IPv4 (0x0800), length 66: legolas.38838 > platform-nas.ssh: Flags [.], ack 29, win 4581, options [nop,nop,TS val 4065459056 ecr 3148989202], length 0
  142  18:29:21.426829 74:d4:35:ec:64:73 (oui Unknown) > 80:1f:02:ff:ca:5d (oui Unknown), ethertype IPv4 (0x0800), length 246: legolas.ssh > 172.23.15.73.49186: Flags [P.], seq 6497:6689, ack 1904, win 5896, length 192
  143  18:29:21.437275 80:1f:02:ff:ca:5d (oui Unknown) > 74:d4:35:ec:64:73 (oui Unknown), ethertype IPv4 (0x0800), length 118: 172.23.15.73.49186 > legolas.ssh: Flags [P.], seq 1904:1968, ack 6689, win 508, length 64
  144  18:29:21.437326 74:d4:35:ec:64:73 (oui Unknown) > 80:1f:02:ff:ca:5d (oui Unknown), ethertype IPv4 (0x0800), length 54: legolas.ssh > 172.23.15.73.49186: Flags [.], ack 1968, win 5896, length 0
  145  18:29:21.944400 74:d4:35:ec:64:73 (oui Unknown) > 80:1f:02:ff:ca:5d (oui Unknown), ethertype IPv4 (0x0800), length 118: legolas.ssh > 172.23.15.73.49186: Flags [P.], seq 6689:6753, ack 1968, win 5896, length 64
  146  18:29:21.945265 74:d4:35:ec:64:73 (oui Unknown) > 80:1f:02:ff:ca:5d (oui Unknown), ethertype IPv4 (0x0800), length 150: legolas.ssh > 172.23.15.73.49186: Flags [P.], seq 6753:6849, ack 1968, win 5896, length 96
  147  18:29:21.946108 74:d4:35:ec:64:73 (oui Unknown) > 80:1f:02:ff:ca:5d (oui Unknown), ethertype IPv4 (0x0800), length 166: legolas.ssh > 172.23.15.73.49186: Flags [P.], seq 6849:6961, ack 1968, win 5896, length 112
  148  18:29:21.946187 74:d4:35:ec:64:73 (oui Unknown) > 80:1f:02:ff:ca:5d (oui Unknown), ethertype IPv4 (0x0800), length 102: legolas.ssh > 172.23.15.73.49186: Flags [P.], seq 6961:7009, ack 1968, win 5896, length 48
  149  18:29:21.947119 74:d4:35:ec:64:73 (oui Unknown) > 80:1f:02:ff:ca:5d (oui Unknown), ethertype IPv4 (0x0800), length 118: legolas.ssh > 172.23.15.73.49186: Flags [P.], seq 7009:7073, ack 1968, win 5896, length 64
  150  18:29:21.947217 74:d4:35:ec:64:73 (oui Unknown) > 80:1f:02:ff:ca:5d (oui Unknown), ethertype IPv4 (0x0800), length 102: legolas.ssh > 172.23.15.73.49186: Flags [P.], seq 7073:7121, ack 1968, win 5896, length 48
  151  18:29:21.948063 74:d4:35:ec:64:73 (oui Unknown) > 80:1f:02:ff:ca:5d (oui Unknown), ethertype IPv4 (0x0800), length 102: legolas.ssh > 172.23.15.73.49186: Flags [P.], seq 7121:7169, ack 1968, win 5896, length 48
  152  18:29:21.948169 74:d4:35:ec:64:73 (oui Unknown) > 80:1f:02:ff:ca:5d (oui Unknown), ethertype IPv4 (0x0800), length 102: legolas.ssh > 172.23.15.73.49186: Flags [P.], seq 7169:7217, ack 1968, win 5896, length 48
  153  18:29:21.949755 80:1f:02:ff:ca:5d (oui Unknown) > 74:d4:35:ec:64:73 (oui Unknown), ethertype IPv4 (0x0800), length 60: 172.23.15.73.49186 > legolas.ssh: Flags [.], ack 6849, win 507, length 0
  154  18:29:21.950701 80:1f:02:ff:ca:5d (oui Unknown) > 74:d4:35:ec:64:73 (oui Unknown), ethertype IPv4 (0x0800), length 60: 172.23.15.73.49186 > legolas.ssh: Flags [.], ack 7009, win 507, length 0
  155  18:29:21.950892 80:1f:02:ff:ca:5d (oui Unknown) > 74:d4:35:ec:64:73 (oui Unknown), ethertype IPv4 (0x0800), length 60: 172.23.15.73.49186 > legolas.ssh: Flags [.], ack 7121, win 512, length 0
  156  18:29:21.952598 80:1f:02:ff:ca:5d (oui Unknown) > 74:d4:35:ec:64:73 (oui Unknown), ethertype IPv4 (0x0800), length 60: 172.23.15.73.49186 > legolas.ssh: Flags [.], ack 7217, win 511, length 0
  157  18:29:22.027327 74:d4:35:ec:64:73 (oui Unknown) > 80:1f:02:ff:ca:5d (oui Unknown), ethertype IPv4 (0x0800), length 118: legolas.ssh > 172.23.15.73.49186: Flags [P.], seq 7217:7281, ack 1968, win 5896, length 64
  158  18:29:22.034976 80:1f:02:ff:ca:5d (oui Unknown) > 74:d4:35:ec:64:73 (oui Unknown), ethertype IPv4 (0x0800), length 118: 172.23.15.73.49186 > legolas.ssh: Flags [P.], seq 1968:2032, ack 7281, win 511, length 64
  159  18:29:22.034988 74:d4:35:ec:64:73 (oui Unknown) > 80:1f:02:ff:ca:5d (oui Unknown), ethertype IPv4 (0x0800), length 54: legolas.ssh > 172.23.15.73.49186: Flags [.], ack 2032, win 5896, length 0
  160  18:29:22.035420 74:d4:35:ec:64:73 (oui Unknown) > 80:1f:02:ff:ca:5d (oui Unknown), ethertype IPv4 (0x0800), length 246: legolas.ssh > 172.23.15.73.49186: Flags [P.], seq 7281:7473, ack 2032, win 5896, length 192
  161  18:29:22.043419 80:1f:02:ff:ca:5d (oui Unknown) > 74:d4:35:ec:64:73 (oui Unknown), ethertype IPv4 (0x0800), length 118: 172.23.15.73.49186 > legolas.ssh: Flags [P.], seq 2032:2096, ack 7473, win 510, length 64
  162  18:29:22.043437 74:d4:35:ec:64:73 (oui Unknown) > 80:1f:02:ff:ca:5d (oui Unknown), ethertype IPv4 (0x0800), length 54: legolas.ssh > 172.23.15.73.49186: Flags [.], ack 2096, win 5896, length 0
  163  18:29:22.183585 fc:aa:14:2a:35:6c (oui Unknown) > Broadcast, ethertype IPv4 (0x0800), length 342: 0.0.0.0.bootpc > 255.255.255.255.bootps: BOOTP/DHCP, Request from fc:aa:14:2a:35:6c (oui Unknown), length 300
  164  18:29:22.507795 40:8d:5c:11:bc:e8 (oui Unknown) > 33:33:00:00:00:fb (oui Unknown), ethertype IPv6 (0x86dd), length 107: fe80::428d:5cff:fe11:bce8.mdns > ff02::fb.mdns: 0 [2q] PTR (QM)? _ipp._tcp.local. PTR (QM)? _ipps._tcp.local. (45)
  165  18:29:22.507916 40:8d:5c:11:bc:e8 (oui Unknown) > 01:00:5e:00:00:fb (oui Unknown), ethertype IPv4 (0x0800), length 87: buttercup.mdns > 224.0.0.251.mdns: 0 [2q] PTR (QM)? _ipp._tcp.local. PTR (QM)? _ipps._tcp.local. (45)
  166  18:29:22.628983 74:d4:35:ec:64:73 (oui Unknown) > 80:1f:02:ff:ca:5d (oui Unknown), ethertype IPv4 (0x0800), length 246: legolas.ssh > 172.23.15.73.49186: Flags [P.], seq 7473:7665, ack 2096, win 5896, length 192
  167  18:29:22.637214 80:1f:02:ff:ca:5d (oui Unknown) > 74:d4:35:ec:64:73 (oui Unknown), ethertype IPv4 (0x0800), length 118: 172.23.15.73.49186 > legolas.ssh: Flags [P.], seq 2096:2160, ack 7665, win 510, length 64
  168  18:29:22.637249 74:d4:35:ec:64:73 (oui Unknown) > 80:1f:02:ff:ca:5d (oui Unknown), ethertype IPv4 (0x0800), length 54: legolas.ssh > 172.23.15.73.49186: Flags [.], ack 2160, win 5896, length 0
  169  18:29:22.751419 74:d4:35:ec:64:73 (oui Unknown) > 80:1f:02:ff:ca:5d (oui Unknown), ethertype IPv4 (0x0800), length 143: legolas.34244 > ro-dc4.romania.luxoft.com.domain: 14929+ [1au] PTR? b.f.0.0.0.0.0.0.0.0.0.0.0.0.0.0.0.0.0.0.0.0.0.0.0.0.0.0.2.0.f.f.ip6.arpa. (101)
  170  18:29:22.753074 80:1f:02:ff:ca:5d (oui Unknown) > 74:d4:35:ec:64:73 (oui Unknown), ethertype IPv4 (0x0800), length 207: ro-dc4.romania.luxoft.com.domain > legolas.34244: 14929 NXDomain 0/1/1 (165)
  171  18:29:22.753338 74:d4:35:ec:64:73 (oui Unknown) > 80:1f:02:ff:ca:5d (oui Unknown), ethertype IPv4 (0x0800), length 132: legolas.34244 > ro-dc4.romania.luxoft.com.domain: 14929+ PTR? b.f.0.0.0.0.0.0.0.0.0.0.0.0.0.0.0.0.0.0.0.0.0.0.0.0.0.0.2.0.f.f.ip6.arpa. (90)
  172  18:29:22.754050 80:1f:02:ff:ca:5d (oui Unknown) > 74:d4:35:ec:64:73 (oui Unknown), ethertype IPv4 (0x0800), length 196: ro-dc4.romania.luxoft.com.domain > legolas.34244: 14929 NXDomain 0/1/0 (154)
  173  18:29:22.758127 74:d4:35:ec:64:73 (oui Unknown) > 80:1f:02:ff:ca:5d (oui Unknown), ethertype IPv4 (0x0800), length 95: legolas.38112 > ro-dc4.romania.luxoft.com.domain: 1983+ [1au] PTR? 251.0.0.224.in-addr.arpa. (53)
  174  18:29:22.761883 80:1f:02:ff:ca:5d (oui Unknown) > 74:d4:35:ec:64:73 (oui Unknown), ethertype IPv4 (0x0800), length 152: ro-dc4.romania.luxoft.com.domain > legolas.38112: 1983 NXDomain 0/1/1 (110)
  175  18:29:22.762046 74:d4:35:ec:64:73 (oui Unknown) > 80:1f:02:ff:ca:5d (oui Unknown), ethertype IPv4 (0x0800), length 84: legolas.38112 > ro-dc4.romania.luxoft.com.domain: 1983+ PTR? 251.0.0.224.in-addr.arpa. (42)
  176  18:29:22.762567 80:1f:02:ff:ca:5d (oui Unknown) > 74:d4:35:ec:64:73 (oui Unknown), ethertype IPv4 (0x0800), length 141: ro-dc4.romania.luxoft.com.domain > legolas.38112: 1983 NXDomain 0/1/0 (99)
  177  18:29:22.785643 00:1f:da:5e:d8:01 (oui Unknown) > 01:80:c2:00:00:00 (oui Unknown), 802.3, length 38: LLC, dsap STP (0x42) Individual, ssap STP (0x42) Command, ctrl 0x03: STP 802.1d, Config, Flags [none], bridge-id 8000.00:1f:da:5e:d8:01.8019, length 35
  178  18:29:22.950372 74:d4:35:ec:64:73 (oui Unknown) > 80:1f:02:ff:ca:5d (oui Unknown), ethertype IPv4 (0x0800), length 134: legolas.ssh > 172.23.15.73.49186: Flags [P.], seq 7665:7745, ack 2160, win 5896, length 80
  179  18:29:22.951237 74:d4:35:ec:64:73 (oui Unknown) > 80:1f:02:ff:ca:5d (oui Unknown), ethertype IPv4 (0x0800), length 150: legolas.ssh > 172.23.15.73.49186: Flags [P.], seq 7745:7841, ack 2160, win 5896, length 96
  180  18:29:22.952075 74:d4:35:ec:64:73 (oui Unknown) > 80:1f:02:ff:ca:5d (oui Unknown), ethertype IPv4 (0x0800), length 182: legolas.ssh > 172.23.15.73.49186: Flags [P.], seq 7841:7969, ack 2160, win 5896, length 128
  181  18:29:22.952120 74:d4:35:ec:64:73 (oui Unknown) > 80:1f:02:ff:ca:5d (oui Unknown), ethertype IPv4 (0x0800), length 102: legolas.ssh > 172.23.15.73.49186: Flags [P.], seq 7969:8017, ack 2160, win 5896, length 48
  182  18:29:22.953061 74:d4:35:ec:64:73 (oui Unknown) > 80:1f:02:ff:ca:5d (oui Unknown), ethertype IPv4 (0x0800), length 118: legolas.ssh > 172.23.15.73.49186: Flags [P.], seq 8017:8081, ack 2160, win 5896, length 64
  183  18:29:22.953153 74:d4:35:ec:64:73 (oui Unknown) > 80:1f:02:ff:ca:5d (oui Unknown), ethertype IPv4 (0x0800), length 102: legolas.ssh > 172.23.15.73.49186: Flags [P.], seq 8081:8129, ack 2160, win 5896, length 48
  184  18:29:22.954015 74:d4:35:ec:64:73 (oui Unknown) > 80:1f:02:ff:ca:5d (oui Unknown), ethertype IPv4 (0x0800), length 102: legolas.ssh > 172.23.15.73.49186: Flags [P.], seq 8129:8177, ack 2160, win 5896, length 48
  185  18:29:22.954122 74:d4:35:ec:64:73 (oui Unknown) > 80:1f:02:ff:ca:5d (oui Unknown), ethertype IPv4 (0x0800), length 102: legolas.ssh > 172.23.15.73.49186: Flags [P.], seq 8177:8225, ack 2160, win 5896, length 48
