    1  18:26:57.054746 80:1f:02:ff:ca:5d (oui Unknown) > 74:d4:35:ec:64:73 (oui Unknown), ethertype IPv4 (0x0800), length 118: 172.23.15.73.49186 > legolas.ssh: Flags [P.], seq 2262049216:2262049280, ack 2926508064, win 512, length 64
    2  18:26:57.054801 74:d4:35:ec:64:73 (oui Unknown) > 80:1f:02:ff:ca:5d (oui Unknown), ethertype IPv4 (0x0800), length 54: legolas.ssh > 172.23.15.73.49186: Flags [.], ack 64, win 5812, length 0
    3  18:26:57.054976 74:d4:35:ec:64:73 (oui Unknown) > 80:1f:02:ff:ca:5d (oui Unknown), ethertype IPv4 (0x0800), length 102: legolas.ssh > 172.23.15.73.49186: Flags [P.], seq 1:49, ack 64, win 5812, length 48
    4  18:26:57.061265 80:1f:02:ff:ca:5d (oui Unknown) > 74:d4:35:ec:64:73 (oui Unknown), ethertype IPv4 (0x0800), length 118: 172.23.15.73.49186 > legolas.ssh: Flags [P.], seq 64:128, ack 49, win 512, length 64
    5  18:26:57.061893 74:d4:35:ec:64:73 (oui Unknown) > 80:1f:02:ff:ca:5d (oui Unknown), ethertype IPv4 (0x0800), length 118: legolas.ssh > 172.23.15.73.49186: Flags [P.], seq 49:113, ack 128, win 5812, length 64
    6  18:26:57.069020 80:1f:02:ff:ca:5d (oui Unknown) > 74:d4:35:ec:64:73 (oui Unknown), ethertype IPv4 (0x0800), length 118: 172.23.15.73.49186 > legolas.ssh: Flags [P.], seq 128:192, ack 113, win 511, length 64
    7  18:26:57.073201 74:d4:35:ec:64:73 (oui Unknown) > 80:1f:02:ff:ca:5d (oui Unknown), ethertype IPv4 (0x0800), length 278: legolas.ssh > 172.23.15.73.49186: Flags [P.], seq 113:337, ack 192, win 5812, length 224
    8  18:26:57.081444 80:1f:02:ff:ca:5d (oui Unknown) > 74:d4:35:ec:64:73 (oui Unknown), ethertype IPv4 (0x0800), length 118: 172.23.15.73.49186 > legolas.ssh: Flags [P.], seq 192:256, ack 337, win 510, length 64
    9  18:26:57.088084 74:d4:35:ec:64:73 (oui Unknown) > 80:1f:02:ff:ca:5d (oui Unknown), ethertype IPv4 (0x0800), length 390: legolas.ssh > 172.23.15.73.49186: Flags [P.], seq 337:673, ack 256, win 5812, length 336
   10  18:26:57.094574 80:1f:02:ff:ca:5d (oui Unknown) > 74:d4:35:ec:64:73 (oui Unknown), ethertype IPv4 (0x0800), length 150: 172.23.15.73.49186 > legolas.ssh: Flags [P.], seq 256:352, ack 673, win 509, length 96
   11  18:26:57.094664 74:d4:35:ec:64:73 (oui Unknown) > 80:1f:02:ff:ca:5d (oui Unknown), ethertype IPv4 (0x0800), length 102: legolas.ssh > 172.23.15.73.49186: Flags [P.], seq 673:721, ack 352, win 5812, length 48
   12  18:26:57.097435 80:1f:02:ff:ca:5d (oui Unknown) > 74:d4:35:ec:64:73 (oui Unknown), ethertype IPv4 (0x0800), length 118: 172.23.15.73.49186 > legolas.ssh: Flags [P.], seq 352:416, ack 673, win 509, length 64
   13  18:26:57.109497 80:1f:02:ff:ca:5d (oui Unknown) > 74:d4:35:ec:64:73 (oui Unknown), ethertype IPv4 (0x0800), length 118: 172.23.15.73.49186 > legolas.ssh: Flags [P.], seq 416:480, ack 721, win 509, length 64
   14  18:26:57.109562 74:d4:35:ec:64:73 (oui Unknown) > 80:1f:02:ff:ca:5d (oui Unknown), ethertype IPv4 (0x0800), length 54: legolas.ssh > 172.23.15.73.49186: Flags [.], ack 480, win 5812, length 0
   15  18:26:57.109679 74:d4:35:ec:64:73 (oui Unknown) > 80:1f:02:ff:ca:5d (oui Unknown), ethertype IPv4 (0x0800), length 102: legolas.ssh > 172.23.15.73.49186: Flags [P.], seq 721:769, ack 480, win 5812, length 48
   16  18:26:57.114954 80:1f:02:ff:ca:5d (oui Unknown) > 74:d4:35:ec:64:73 (oui Unknown), ethertype IPv4 (0x0800), length 118: 172.23.15.73.49186 > legolas.ssh: Flags [P.], seq 480:544, ack 769, win 509, length 64
   17  18:26:57.115586 74:d4:35:ec:64:73 (oui Unknown) > 80:1f:02:ff:ca:5d (oui Unknown), ethertype IPv4 (0x0800), length 118: legolas.ssh > 172.23.15.73.49186: Flags [P.], seq 769:833, ack 544, win 5812, length 64
   18  18:26:57.118999 74:d4:35:ec:64:73 (oui Unknown) > 80:1f:02:ff:ca:5d (oui Unknown), ethertype IPv4 (0x0800), length 422: legolas.ssh > 172.23.15.73.49186: Flags [P.], seq 833:1201, ack 544, win 5812, length 368
   19  18:26:57.121964 80:1f:02:ff:ca:5d (oui Unknown) > 74:d4:35:ec:64:73 (oui Unknown), ethertype IPv4 (0x0800), length 118: 172.23.15.73.49186 > legolas.ssh: Flags [P.], seq 544:608, ack 833, win 509, length 64
   20  18:26:57.127247 80:1f:02:ff:ca:5d (oui Unknown) > 74:d4:35:ec:64:73 (oui Unknown), ethertype IPv4 (0x0800), length 118: 172.23.15.73.49186 > legolas.ssh: Flags [P.], seq 608:672, ack 1201, win 507, length 64
   21  18:26:57.127315 74:d4:35:ec:64:73 (oui Unknown) > 80:1f:02:ff:ca:5d (oui Unknown), ethertype IPv4 (0x0800), length 54: legolas.ssh > 172.23.15.73.49186: Flags [.], ack 672, win 5812, length 0
   22  18:26:57.140192 80:1f:02:ff:ca:5d (oui Unknown) > 74:d4:35:ec:64:73 (oui Unknown), ethertype IPv4 (0x0800), length 118: 172.23.15.73.49186 > legolas.ssh: Flags [P.], seq 672:736, ack 1201, win 507, length 64
   23  18:26:57.140376 74:d4:35:ec:64:73 (oui Unknown) > 80:1f:02:ff:ca:5d (oui Unknown), ethertype IPv4 (0x0800), length 102: legolas.ssh > 172.23.15.73.49186: Flags [P.], seq 1201:1249, ack 736, win 5812, length 48
   24  18:26:57.145474 80:1f:02:ff:ca:5d (oui Unknown) > 74:d4:35:ec:64:73 (oui Unknown), ethertype IPv4 (0x0800), length 118: 172.23.15.73.49186 > legolas.ssh: Flags [P.], seq 736:800, ack 1249, win 507, length 64
   25  18:26:57.145990 74:d4:35:ec:64:73 (oui Unknown) > 80:1f:02:ff:ca:5d (oui Unknown), ethertype IPv4 (0x0800), length 118: legolas.ssh > 172.23.15.73.49186: Flags [P.], seq 1249:1313, ack 800, win 5812, length 64
   26  18:26:57.149819 74:d4:35:ec:64:73 (oui Unknown) > 80:1f:02:ff:ca:5d (oui Unknown), ethertype IPv4 (0x0800), length 502: legolas.ssh > 172.23.15.73.49186: Flags [P.], seq 1313:1761, ack 800, win 5812, length 448
   27  18:26:57.152039 80:1f:02:ff:ca:5d (oui Unknown) > 74:d4:35:ec:64:73 (oui Unknown), ethertype IPv4 (0x0800), length 134: 172.23.15.73.49186 > legolas.ssh: Flags [P.], seq 800:880, ack 1313, win 507, length 80
   28  18:26:57.154312 80:1f:02:ff:ca:5d (oui Unknown) > 74:d4:35:ec:64:73 (oui Unknown), ethertype IPv4 (0x0800), length 60: 172.23.15.73.49186 > legolas.ssh: Flags [.], ack 1761, win 512, length 0
   29  18:26:57.157816 80:1f:02:ff:ca:5d (oui Unknown) > 74:d4:35:ec:64:73 (oui Unknown), ethertype IPv4 (0x0800), length 118: 172.23.15.73.49186 > legolas.ssh: Flags [P.], seq 880:944, ack 1761, win 512, length 64
   30  18:26:57.157882 74:d4:35:ec:64:73 (oui Unknown) > 80:1f:02:ff:ca:5d (oui Unknown), ethertype IPv4 (0x0800), length 54: legolas.ssh > 172.23.15.73.49186: Flags [.], ack 944, win 5812, length 0
   31  18:26:57.166440 74:d4:35:ec:64:73 (oui Unknown) > 80:1f:02:ff:ca:5d (oui Unknown), ethertype IPv4 (0x0800), length 134: legolas.ssh > 172.23.15.73.49186: Flags [P.], seq 1761:1841, ack 944, win 5812, length 80
   32  18:26:57.167156 74:d4:35:ec:64:73 (oui Unknown) > 80:1f:02:ff:ca:5d (oui Unknown), ethertype IPv4 (0x0800), length 166: legolas.ssh > 172.23.15.73.49186: Flags [P.], seq 1841:1953, ack 944, win 5812, length 112
   33  18:26:57.167895 74:d4:35:ec:64:73 (oui Unknown) > 80:1f:02:ff:ca:5d (oui Unknown), ethertype IPv4 (0x0800), length 182: legolas.ssh > 172.23.15.73.49186: Flags [P.], seq 1953:2081, ack 944, win 5812, length 128
   34  18:26:57.167958 74:d4:35:ec:64:73 (oui Unknown) > 80:1f:02:ff:ca:5d (oui Unknown), ethertype IPv4 (0x0800), length 102: legolas.ssh > 172.23.15.73.49186: Flags [P.], seq 2081:2129, ack 944, win 5812, length 48
   35  18:26:57.168753 74:d4:35:ec:64:73 (oui Unknown) > 80:1f:02:ff:ca:5d (oui Unknown), ethertype IPv4 (0x0800), length 118: legolas.ssh > 172.23.15.73.49186: Flags [P.], seq 2129:2193, ack 944, win 5812, length 64
   36  18:26:57.168841 74:d4:35:ec:64:73 (oui Unknown) > 80:1f:02:ff:ca:5d (oui Unknown), ethertype IPv4 (0x0800), length 102: legolas.ssh > 172.23.15.73.49186: Flags [P.], seq 2193:2241, ack 944, win 5812, length 48
   37  18:26:57.169563 74:d4:35:ec:64:73 (oui Unknown) > 80:1f:02:ff:ca:5d (oui Unknown), ethertype IPv4 (0x0800), length 102: legolas.ssh > 172.23.15.73.49186: Flags [P.], seq 2241:2289, ack 944, win 5812, length 48
   38  18:26:57.169653 74:d4:35:ec:64:73 (oui Unknown) > 80:1f:02:ff:ca:5d (oui Unknown), ethertype IPv4 (0x0800), length 102: legolas.ssh > 172.23.15.73.49186: Flags [P.], seq 2289:2337, ack 944, win 5812, length 48
   39  18:26:57.171563 80:1f:02:ff:ca:5d (oui Unknown) > 74:d4:35:ec:64:73 (oui Unknown), ethertype IPv4 (0x0800), length 60: 172.23.15.73.49186 > legolas.ssh: Flags [.], ack 1953, win 511, length 0
   40  18:26:57.172152 80:1f:02:ff:ca:5d (oui Unknown) > 74:d4:35:ec:64:73 (oui Unknown), ethertype IPv4 (0x0800), length 60: 172.23.15.73.49186 > legolas.ssh: Flags [.], ack 2129, win 510, length 0
   41  18:26:57.173111 80:1f:02:ff:ca:5d (oui Unknown) > 74:d4:35:ec:64:73 (oui Unknown), ethertype IPv4 (0x0800), length 60: 172.23.15.73.49186 > legolas.ssh: Flags [.], ack 2241, win 510, length 0
   42  18:26:57.173664 80:1f:02:ff:ca:5d (oui Unknown) > 74:d4:35:ec:64:73 (oui Unknown), ethertype IPv4 (0x0800), length 60: 172.23.15.73.49186 > legolas.ssh: Flags [.], ack 2337, win 510, length 0
   43  18:26:57.747894 74:d4:35:ec:64:73 (oui Unknown) > 80:1f:02:ff:ca:5d (oui Unknown), ethertype IPv4 (0x0800), length 326: legolas.ssh > 172.23.15.73.49186: Flags [P.], seq 2337:2609, ack 944, win 5812, length 272
   44  18:26:57.756779 80:1f:02:ff:ca:5d (oui Unknown) > 74:d4:35:ec:64:73 (oui Unknown), ethertype IPv4 (0x0800), length 118: 172.23.15.73.49186 > legolas.ssh: Flags [P.], seq 944:1008, ack 2609, win 508, length 64
   45  18:26:57.798886 74:d4:35:ec:64:73 (oui Unknown) > 80:1f:02:ff:ca:5d (oui Unknown), ethertype IPv4 (0x0800), length 54: legolas.ssh > 172.23.15.73.49186: Flags [.], ack 1008, win 5812, length 0
   46  18:26:58.043665 74:d4:35:ec:64:73 (oui Unknown) > 80:1f:02:ff:ca:5d (oui Unknown), ethertype IPv4 (0x0800), length 96: legolas.32797 > ro-dc4.romania.luxoft.com.domain: 49391+ [1au] PTR? 73.15.23.172.in-addr.arpa. (54)
   47  18:26:58.044358 80:1f:02:ff:ca:5d (oui Unknown) > 74:d4:35:ec:64:73 (oui Unknown), ethertype IPv4 (0x0800), length 131: ro-dc4.romania.luxoft.com.domain > legolas.32797: 49391 NXDomain 0/1/1 (89)
   48  18:26:58.044462 74:d4:35:ec:64:73 (oui Unknown) > 80:1f:02:ff:ca:5d (oui Unknown), ethertype IPv4 (0x0800), length 85: legolas.32797 > ro-dc4.romania.luxoft.com.domain: 49391+ PTR? 73.15.23.172.in-addr.arpa. (43)
   49  18:26:58.044954 80:1f:02:ff:ca:5d (oui Unknown) > 74:d4:35:ec:64:73 (oui Unknown), ethertype IPv4 (0x0800), length 120: ro-dc4.romania.luxoft.com.domain > legolas.32797: 49391 NXDomain 0/1/0 (78)
   50  18:26:58.171449 74:d4:35:ec:64:73 (oui Unknown) > 80:1f:02:ff:ca:5d (oui Unknown), ethertype IPv4 (0x0800), length 134: legolas.ssh > 172.23.15.73.49186: Flags [P.], seq 2609:2689, ack 1008, win 5812, length 80
   51  18:26:58.172250 74:d4:35:ec:64:73 (oui Unknown) > 80:1f:02:ff:ca:5d (oui Unknown), ethertype IPv4 (0x0800), length 150: legolas.ssh > 172.23.15.73.49186: Flags [P.], seq 2689:2785, ack 1008, win 5812, length 96
   52  18:26:58.173084 74:d4:35:ec:64:73 (oui Unknown) > 80:1f:02:ff:ca:5d (oui Unknown), ethertype IPv4 (0x0800), length 182: legolas.ssh > 172.23.15.73.49186: Flags [P.], seq 2785:2913, ack 1008, win 5812, length 128
   53  18:26:58.173157 74:d4:35:ec:64:73 (oui Unknown) > 80:1f:02:ff:ca:5d (oui Unknown), ethertype IPv4 (0x0800), length 102: legolas.ssh > 172.23.15.73.49186: Flags [P.], seq 2913:2961, ack 1008, win 5812, length 48
   54  18:26:58.174048 74:d4:35:ec:64:73 (oui Unknown) > 80:1f:02:ff:ca:5d (oui Unknown), ethertype IPv4 (0x0800), length 118: legolas.ssh > 172.23.15.73.49186: Flags [P.], seq 2961:3025, ack 1008, win 5812, length 64
   55  18:26:58.174144 74:d4:35:ec:64:73 (oui Unknown) > 80:1f:02:ff:ca:5d (oui Unknown), ethertype IPv4 (0x0800), length 102: legolas.ssh > 172.23.15.73.49186: Flags [P.], seq 3025:3073, ack 1008, win 5812, length 48
   56  18:26:58.174967 74:d4:35:ec:64:73 (oui Unknown) > 80:1f:02:ff:ca:5d (oui Unknown), ethertype IPv4 (0x0800), length 102: legolas.ssh > 172.23.15.73.49186: Flags [P.], seq 3073:3121, ack 1008, win 5812, length 48
   57  18:26:58.175071 74:d4:35:ec:64:73 (oui Unknown) > 80:1f:02:ff:ca:5d (oui Unknown), ethertype IPv4 (0x0800), length 102: legolas.ssh > 172.23.15.73.49186: Flags [P.], seq 3121:3169, ack 1008, win 5812, length 48
   58  18:26:58.176886 80:1f:02:ff:ca:5d (oui Unknown) > 74:d4:35:ec:64:73 (oui Unknown), ethertype IPv4 (0x0800), length 60: 172.23.15.73.49186 > legolas.ssh: Flags [.], ack 2785, win 508, length 0
   59  18:26:58.177690 80:1f:02:ff:ca:5d (oui Unknown) > 74:d4:35:ec:64:73 (oui Unknown), ethertype IPv4 (0x0800), length 60: 172.23.15.73.49186 > legolas.ssh: Flags [.], ack 2961, win 507, length 0
   60  18:26:58.178055 80:1f:02:ff:ca:5d (oui Unknown) > 74:d4:35:ec:64:73 (oui Unknown), ethertype IPv4 (0x0800), length 60: 172.23.15.73.49186 > legolas.ssh: Flags [.], ack 3073, win 507, length 0
   61  18:26:58.179637 80:1f:02:ff:ca:5d (oui Unknown) > 74:d4:35:ec:64:73 (oui Unknown), ethertype IPv4 (0x0800), length 60: 172.23.15.73.49186 > legolas.ssh: Flags [.], ack 3169, win 512, length 0
   62  18:26:58.348143 74:d4:35:ec:64:73 (oui Unknown) > 80:1f:02:ff:ca:5d (oui Unknown), ethertype IPv4 (0x0800), length 262: legolas.ssh > 172.23.15.73.49186: Flags [P.], seq 3169:3377, ack 1008, win 5812, length 208
   63  18:26:58.355566 80:1f:02:ff:ca:5d (oui Unknown) > 74:d4:35:ec:64:73 (oui Unknown), ethertype IPv4 (0x0800), length 118: 172.23.15.73.49186 > legolas.ssh: Flags [P.], seq 1008:1072, ack 3377, win 511, length 64
   64  18:26:58.355583 74:d4:35:ec:64:73 (oui Unknown) > 80:1f:02:ff:ca:5d (oui Unknown), ethertype IPv4 (0x0800), length 54: legolas.ssh > 172.23.15.73.49186: Flags [.], ack 1072, win 5812, length 0
   65  18:26:58.780725 00:1f:da:5e:d8:01 (oui Unknown) > 01:80:c2:00:00:00 (oui Unknown), 802.3, length 38: LLC, dsap STP (0x42) Individual, ssap STP (0x42) Command, ctrl 0x03: STP 802.1d, Config, Flags [none], bridge-id 8000.00:1f:da:5e:d8:01.8019, length 35
   66  18:26:58.794815 80:1f:02:ff:ca:5d (oui Unknown) > 74:d4:35:ec:64:73 (oui Unknown), ethertype IPv4 (0x0800), length 118: 172.23.15.73.49186 > legolas.ssh: Flags [P.], seq 1072:1136, ack 3377, win 511, length 64
   67  18:26:58.794829 74:d4:35:ec:64:73 (oui Unknown) > 80:1f:02:ff:ca:5d (oui Unknown), ethertype IPv4 (0x0800), length 54: legolas.ssh > 172.23.15.73.49186: Flags [.], ack 1136, win 5812, length 0
   68  18:26:58.795032 74:d4:35:ec:64:73 (oui Unknown) > 80:1f:02:ff:ca:5d (oui Unknown), ethertype IPv4 (0x0800), length 102: legolas.ssh > 172.23.15.73.49186: Flags [P.], seq 3377:3425, ack 1136, win 5812, length 48
   69  18:26:58.800745 80:1f:02:ff:ca:5d (oui Unknown) > 74:d4:35:ec:64:73 (oui Unknown), ethertype IPv4 (0x0800), length 118: 172.23.15.73.49186 > legolas.ssh: Flags [P.], seq 1136:1200, ack 3425, win 511, length 64
   70  18:26:58.800757 74:d4:35:ec:64:73 (oui Unknown) > 80:1f:02:ff:ca:5d (oui Unknown), ethertype IPv4 (0x0800), length 54: legolas.ssh > 172.23.15.73.49186: Flags [.], ack 1200, win 5812, length 0
   71  18:26:58.801495 74:d4:35:ec:64:73 (oui Unknown) > 80:1f:02:ff:ca:5d (oui Unknown), ethertype IPv4 (0x0800), length 118: legolas.ssh > 172.23.15.73.49186: Flags [P.], seq 3425:3489, ack 1200, win 5812, length 64
   72  18:26:58.807232 80:1f:02:ff:ca:5d (oui Unknown) > 74:d4:35:ec:64:73 (oui Unknown), ethertype IPv4 (0x0800), length 118: 172.23.15.73.49186 > legolas.ssh: Flags [P.], seq 1200:1264, ack 3489, win 511, length 64
   73  18:26:58.807266 74:d4:35:ec:64:73 (oui Unknown) > 80:1f:02:ff:ca:5d (oui Unknown), ethertype IPv4 (0x0800), length 54: legolas.ssh > 172.23.15.73.49186: Flags [.], ack 1264, win 5812, length 0
   74  18:26:58.828096 74:d4:35:ec:64:73 (oui Unknown) > 80:1f:02:ff:ca:5d (oui Unknown), ethertype IPv4 (0x0800), length 278: legolas.ssh > 172.23.15.73.49186: Flags [P.], seq 3489:3713, ack 1264, win 5812, length 224
   75  18:26:58.836532 80:1f:02:ff:ca:5d (oui Unknown) > 74:d4:35:ec:64:73 (oui Unknown), ethertype IPv4 (0x0800), length 118: 172.23.15.73.49186 > legolas.ssh: Flags [P.], seq 1264:1328, ack 3713, win 510, length 64
   76  18:26:58.878884 74:d4:35:ec:64:73 (oui Unknown) > 80:1f:02:ff:ca:5d (oui Unknown), ethertype IPv4 (0x0800), length 54: legolas.ssh > 172.23.15.73.49186: Flags [.], ack 1328, win 5812, length 0
   77  18:26:58.934278 80:1f:02:ff:ca:5d (oui Unknown) > 74:d4:35:ec:64:73 (oui Unknown), ethertype IPv4 (0x0800), length 118: 172.23.15.73.49186 > legolas.ssh: Flags [P.], seq 1328:1392, ack 3713, win 510, length 64
   78  18:26:58.934307 74:d4:35:ec:64:73 (oui Unknown) > 80:1f:02:ff:ca:5d (oui Unknown), ethertype IPv4 (0x0800), length 54: legolas.ssh > 172.23.15.73.49186: Flags [.], ack 1392, win 5812, length 0
   79  18:26:58.963774 80:1f:02:ff:ca:5d (oui Unknown) > 74:d4:35:ec:64:73 (oui Unknown), ethertype IPv4 (0x0800), length 118: 172.23.15.73.49186 > legolas.ssh: Flags [P.], seq 1392:1456, ack 3713, win 510, length 64
   80  18:26:58.963803 74:d4:35:ec:64:73 (oui Unknown) > 80:1f:02:ff:ca:5d (oui Unknown), ethertype IPv4 (0x0800), length 54: legolas.ssh > 172.23.15.73.49186: Flags [.], ack 1456, win 5812, length 0
   81  18:26:58.964303 74:d4:35:ec:64:73 (oui Unknown) > 80:1f:02:ff:ca:5d (oui Unknown), ethertype IPv4 (0x0800), length 102: legolas.ssh > 172.23.15.73.49186: Flags [P.], seq 3713:3761, ack 1456, win 5812, length 48
   82  18:26:58.970021 80:1f:02:ff:ca:5d (oui Unknown) > 74:d4:35:ec:64:73 (oui Unknown), ethertype IPv4 (0x0800), length 118: 172.23.15.73.49186 > legolas.ssh: Flags [P.], seq 1456:1520, ack 3761, win 509, length 64
   83  18:26:58.970068 74:d4:35:ec:64:73 (oui Unknown) > 80:1f:02:ff:ca:5d (oui Unknown), ethertype IPv4 (0x0800), length 54: legolas.ssh > 172.23.15.73.49186: Flags [.], ack 1520, win 5812, length 0
   84  18:26:58.971472 74:d4:35:ec:64:73 (oui Unknown) > 80:1f:02:ff:ca:5d (oui Unknown), ethertype IPv4 (0x0800), length 118: legolas.ssh > 172.23.15.73.49186: Flags [P.], seq 3761:3825, ack 1520, win 5812, length 64
   85  18:26:58.977063 80:1f:02:ff:ca:5d (oui Unknown) > 74:d4:35:ec:64:73 (oui Unknown), ethertype IPv4 (0x0800), length 118: 172.23.15.73.49186 > legolas.ssh: Flags [P.], seq 1520:1584, ack 3825, win 509, length 64
   86  18:26:58.977082 74:d4:35:ec:64:73 (oui Unknown) > 80:1f:02:ff:ca:5d (oui Unknown), ethertype IPv4 (0x0800), length 54: legolas.ssh > 172.23.15.73.49186: Flags [.], ack 1584, win 5812, length 0
   87  18:26:58.983365 74:d4:35:ec:64:73 (oui Unknown) > 80:1f:02:ff:ca:5d (oui Unknown), ethertype IPv4 (0x0800), length 262: legolas.ssh > 172.23.15.73.49186: Flags [P.], seq 3825:4033, ack 1584, win 5812, length 208
   88  18:26:58.991626 80:1f:02:ff:ca:5d (oui Unknown) > 74:d4:35:ec:64:73 (oui Unknown), ethertype IPv4 (0x0800), length 118: 172.23.15.73.49186 > legolas.ssh: Flags [P.], seq 1584:1648, ack 4033, win 508, length 64
   89  18:26:58.998352 74:d4:35:ec:64:73 (oui Unknown) > 80:1f:02:ff:ca:5d (oui Unknown), ethertype IPv4 (0x0800), length 438: legolas.ssh > 172.23.15.73.49186: Flags [P.], seq 4033:4417, ack 1648, win 5812, length 384
   90  18:26:59.007765 80:1f:02:ff:ca:5d (oui Unknown) > 74:d4:35:ec:64:73 (oui Unknown), ethertype IPv4 (0x0800), length 118: 172.23.15.73.49186 > legolas.ssh: Flags [P.], seq 1648:1712, ack 4417, win 507, length 64
   91  18:26:59.050856 74:d4:35:ec:64:73 (oui Unknown) > 80:1f:02:ff:ca:5d (oui Unknown), ethertype IPv4 (0x0800), length 54: legolas.ssh > 172.23.15.73.49186: Flags [.], ack 1712, win 5812, length 0
   92  18:26:59.064007 80:1f:02:ff:ca:5d (oui Unknown) > 74:d4:35:ec:64:73 (oui Unknown), ethertype IPv4 (0x0800), length 118: 172.23.15.73.49186 > legolas.ssh: Flags [P.], seq 1712:1776, ack 4417, win 507, length 64
   93  18:26:59.064079 74:d4:35:ec:64:73 (oui Unknown) > 80:1f:02:ff:ca:5d (oui Unknown), ethertype IPv4 (0x0800), length 54: legolas.ssh > 172.23.15.73.49186: Flags [.], ack 1776, win 5812, length 0
   94  18:26:59.176491 74:d4:35:ec:64:73 (oui Unknown) > 80:1f:02:ff:ca:5d (oui Unknown), ethertype IPv4 (0x0800), length 134: legolas.ssh > 172.23.15.73.49186: Flags [P.], seq 4417:4497, ack 1776, win 5812, length 80
   95  18:26:59.177017 74:d4:35:ec:64:73 (oui Unknown) > 80:1f:02:ff:ca:5d (oui Unknown), ethertype IPv4 (0x0800), length 134: legolas.ssh > 172.23.15.73.49186: Flags [P.], seq 4497:4577, ack 1776, win 5812, length 80
   96  18:26:59.177708 74:d4:35:ec:64:73 (oui Unknown) > 80:1f:02:ff:ca:5d (oui Unknown), ethertype IPv4 (0x0800), length 166: legolas.ssh > 172.23.15.73.49186: Flags [P.], seq 4577:4689, ack 1776, win 5812, length 112
   97  18:26:59.177781 74:d4:35:ec:64:73 (oui Unknown) > 80:1f:02:ff:ca:5d (oui Unknown), ethertype IPv4 (0x0800), length 102: legolas.ssh > 172.23.15.73.49186: Flags [P.], seq 4689:4737, ack 1776, win 5812, length 48
   98  18:26:59.178678 74:d4:35:ec:64:73 (oui Unknown) > 80:1f:02:ff:ca:5d (oui Unknown), ethertype IPv4 (0x0800), length 134: legolas.ssh > 172.23.15.73.49186: Flags [P.], seq 4737:4817, ack 1776, win 5812, length 80
   99  18:26:59.178773 74:d4:35:ec:64:73 (oui Unknown) > 80:1f:02:ff:ca:5d (oui Unknown), ethertype IPv4 (0x0800), length 102: legolas.ssh > 172.23.15.73.49186: Flags [P.], seq 4817:4865, ack 1776, win 5812, length 48
  100  18:26:59.179641 74:d4:35:ec:64:73 (oui Unknown) > 80:1f:02:ff:ca:5d (oui Unknown), ethertype IPv4 (0x0800), length 102: legolas.ssh > 172.23.15.73.49186: Flags [P.], seq 4865:4913, ack 1776, win 5812, length 48
  101  18:26:59.179696 00:1f:da:5e:d8:01 (oui Unknown) > 01:80:c2:00:00:0e (oui Unknown), ethertype LLDP (0x88cc), length 165: LLDP, length 151
  102  18:26:59.179754 74:d4:35:ec:64:73 (oui Unknown) > 80:1f:02:ff:ca:5d (oui Unknown), ethertype IPv4 (0x0800), length 102: legolas.ssh > 172.23.15.73.49186: Flags [P.], seq 4913:4961, ack 1776, win 5812, length 48
  103  18:26:59.182651 80:1f:02:ff:ca:5d (oui Unknown) > 74:d4:35:ec:64:73 (oui Unknown), ethertype IPv4 (0x0800), length 60: 172.23.15.73.49186 > legolas.ssh: Flags [.], ack 4577, win 512, length 0
  104  18:26:59.182943 80:1f:02:ff:ca:5d (oui Unknown) > 74:d4:35:ec:64:73 (oui Unknown), ethertype IPv4 (0x0800), length 60: 172.23.15.73.49186 > legolas.ssh: Flags [.], ack 4737, win 511, length 0
  105  18:26:59.183319 80:1f:02:ff:ca:5d (oui Unknown) > 74:d4:35:ec:64:73 (oui Unknown), ethertype IPv4 (0x0800), length 60: 172.23.15.73.49186 > legolas.ssh: Flags [.], ack 4865, win 511, length 0
  106  18:26:59.183704 80:1f:02:ff:ca:5d (oui Unknown) > 74:d4:35:ec:64:73 (oui Unknown), ethertype IPv4 (0x0800), length 60: 172.23.15.73.49186 > legolas.ssh: Flags [.], ack 4961, win 510, length 0
  107  18:26:59.191836 80:1f:02:ff:ca:5d (oui Unknown) > 74:d4:35:ec:64:73 (oui Unknown), ethertype IPv4 (0x0800), length 150: 172.23.15.73.49186 > legolas.ssh: Flags [P.], seq 1776:1872, ack 4961, win 510, length 96
  108  18:26:59.191869 74:d4:35:ec:64:73 (oui Unknown) > 80:1f:02:ff:ca:5d (oui Unknown), ethertype IPv4 (0x0800), length 54: legolas.ssh > 172.23.15.73.49186: Flags [.], ack 1872, win 5812, length 0
  109  18:26:59.191919 74:d4:35:ec:64:73 (oui Unknown) > 80:1f:02:ff:ca:5d (oui Unknown), ethertype IPv4 (0x0800), length 102: legolas.ssh > 172.23.15.73.49186: Flags [P.], seq 4961:5009, ack 1872, win 5812, length 48
  110  18:26:59.247107 80:1f:02:ff:ca:5d (oui Unknown) > 74:d4:35:ec:64:73 (oui Unknown), ethertype IPv4 (0x0800), length 60: 172.23.15.73.49186 > legolas.ssh: Flags [.], ack 5009, win 510, length 0
  111  18:26:59.312636 28:29:86:2a:61:ae (oui Unknown) > Broadcast, ethertype IPv4 (0x0800), length 350: 0.0.0.0.bootpc > 255.255.255.255.bootps: BOOTP/DHCP, Request from 28:29:86:2a:61:ae (oui Unknown), length 308
  112  18:26:59.394657 00:1f:da:5e:d8:01 (oui Unknown) > 01:00:81:00:01:01 (oui Unknown), 802.3, length 19: LLC, dsap SNAP (0xaa) Individual, ssap SNAP (0xaa) Command, ctrl 0x03: oui Nortel Networks SONMP (0x000081), pid Unknown (0x01a1), length 11: 
	0x0000:  aaaa 0300 0081 01a1 c0a8 0101 0001 199f  ................
	0x0010:  0c02 00                                  ...
  113  18:26:59.572791 74:d4:35:ec:64:73 (oui Unknown) > 80:1f:02:ff:ca:5d (oui Unknown), ethertype IPv4 (0x0800), length 278: legolas.ssh > 172.23.15.73.49186: Flags [P.], seq 5009:5233, ack 1872, win 5812, length 224
  114  18:26:59.583562 80:1f:02:ff:ca:5d (oui Unknown) > 74:d4:35:ec:64:73 (oui Unknown), ethertype IPv4 (0x0800), length 118: 172.23.15.73.49186 > legolas.ssh: Flags [P.], seq 1872:1936, ack 5233, win 509, length 64
  115  18:26:59.583610 74:d4:35:ec:64:73 (oui Unknown) > 80:1f:02:ff:ca:5d (oui Unknown), ethertype IPv4 (0x0800), length 54: legolas.ssh > 172.23.15.73.49186: Flags [.], ack 1936, win 5812, length 0
  116  18:26:59.618332 80:1f:02:ff:ca:5d (oui Unknown) > 74:d4:35:ec:64:73 (oui Unknown), ethertype IPv4 (0x0800), length 118: 172.23.15.73.49186 > legolas.ssh: Flags [P.], seq 1936:2000, ack 5233, win 509, length 64
  117  18:26:59.618361 74:d4:35:ec:64:73 (oui Unknown) > 80:1f:02:ff:ca:5d (oui Unknown), ethertype IPv4 (0x0800), length 54: legolas.ssh > 172.23.15.73.49186: Flags [.], ack 2000, win 5812, length 0
  118  18:26:59.618916 74:d4:35:ec:64:73 (oui Unknown) > 80:1f:02:ff:ca:5d (oui Unknown), ethertype IPv4 (0x0800), length 102: legolas.ssh > 172.23.15.73.49186: Flags [P.], seq 5233:5281, ack 2000, win 5812, length 48
  119  18:26:59.624813 80:1f:02:ff:ca:5d (oui Unknown) > 74:d4:35:ec:64:73 (oui Unknown), ethertype IPv4 (0x0800), length 118: 172.23.15.73.49186 > legolas.ssh: Flags [P.], seq 2000:2064, ack 5281, win 509, length 64
  120  18:26:59.624847 74:d4:35:ec:64:73 (oui Unknown) > 80:1f:02:ff:ca:5d (oui Unknown), ethertype IPv4 (0x0800), length 54: legolas.ssh > 172.23.15.73.49186: Flags [.], ack 2064, win 5812, length 0
  121  18:26:59.626257 74:d4:35:ec:64:73 (oui Unknown) > 80:1f:02:ff:ca:5d (oui Unknown), ethertype IPv4 (0x0800), length 118: legolas.ssh > 172.23.15.73.49186: Flags [P.], seq 5281:5345, ack 2064, win 5812, length 64
  122  18:26:59.626933 74:d4:35:ec:64:73 (oui Unknown) > 80:1f:02:ff:ca:5d (oui Unknown), ethertype IPv4 (0x0800), length 246: legolas.ssh > 172.23.15.73.49186: Flags [P.], seq 5345:5537, ack 2064, win 5812, length 192
  123  18:26:59.631850 80:1f:02:ff:ca:5d (oui Unknown) > 74:d4:35:ec:64:73 (oui Unknown), ethertype IPv4 (0x0800), length 60: 172.23.15.73.49186 > legolas.ssh: Flags [.], ack 5537, win 508, length 0
  124  18:26:59.634069 80:1f:02:ff:ca:5d (oui Unknown) > 74:d4:35:ec:64:73 (oui Unknown), ethertype IPv4 (0x0800), length 118: 172.23.15.73.49186 > legolas.ssh: Flags [P.], seq 2064:2128, ack 5537, win 508, length 64
  125  18:26:59.636761 80:1f:02:ff:ca:5d (oui Unknown) > 74:d4:35:ec:64:73 (oui Unknown), ethertype IPv4 (0x0800), length 118: 172.23.15.73.49186 > legolas.ssh: Flags [P.], seq 2128:2192, ack 5537, win 508, length 64
  126  18:26:59.636853 74:d4:35:ec:64:73 (oui Unknown) > 80:1f:02:ff:ca:5d (oui Unknown), ethertype IPv4 (0x0800), length 54: legolas.ssh > 172.23.15.73.49186: Flags [.], ack 2192, win 5812, length 0
  127  18:26:59.637953 28:29:86:39:b9:f7 (oui Unknown) > 33:33:00:01:00:02 (oui Unknown), ethertype IPv6 (0x86dd), length 118: fe80::2a29:86ff:fe39:b9f7.dhcpv6-client > ff02::1:2.dhcpv6-server: dhcp6 solicit
  128  18:26:59.663619 74:d4:35:ec:64:73 (oui Unknown) > 80:1f:02:ff:ca:5d (oui Unknown), ethertype IPv4 (0x0800), length 246: legolas.ssh > 172.23.15.73.49186: Flags [P.], seq 5537:5729, ack 2192, win 5812, length 192
  129  18:26:59.672770 80:1f:02:ff:ca:5d (oui Unknown) > 74:d4:35:ec:64:73 (oui Unknown), ethertype IPv4 (0x0800), length 118: 172.23.15.73.49186 > legolas.ssh: Flags [P.], seq 2192:2256, ack 5729, win 507, length 64
  130  18:26:59.714886 74:d4:35:ec:64:73 (oui Unknown) > 80:1f:02:ff:ca:5d (oui Unknown), ethertype IPv4 (0x0800), length 54: legolas.ssh > 172.23.15.73.49186: Flags [.], ack 2256, win 5812, length 0
  131  18:26:59.800789 80:1f:02:ff:ca:5d (oui Unknown) > 74:d4:35:ec:64:73 (oui Unknown), ethertype IPv4 (0x0800), length 118: 172.23.15.73.49186 > legolas.ssh: Flags [P.], seq 2256:2320, ack 5729, win 507, length 64
  132  18:26:59.800818 74:d4:35:ec:64:73 (oui Unknown) > 80:1f:02:ff:ca:5d (oui Unknown), ethertype IPv4 (0x0800), length 54: legolas.ssh > 172.23.15.73.49186: Flags [.], ack 2320, win 5812, length 0
  133  18:26:59.833704 80:1f:02:ff:ca:5d (oui Unknown) > 74:d4:35:ec:64:73 (oui Unknown), ethertype IPv4 (0x0800), length 118: 172.23.15.73.49186 > legolas.ssh: Flags [P.], seq 2320:2384, ack 5729, win 507, length 64
  134  18:26:59.833733 74:d4:35:ec:64:73 (oui Unknown) > 80:1f:02:ff:ca:5d (oui Unknown), ethertype IPv4 (0x0800), length 54: legolas.ssh > 172.23.15.73.49186: Flags [.], ack 2384, win 5812, length 0
  135  18:26:59.834262 74:d4:35:ec:64:73 (oui Unknown) > 80:1f:02:ff:ca:5d (oui Unknown), ethertype IPv4 (0x0800), length 102: legolas.ssh > 172.23.15.73.49186: Flags [P.], seq 5729:5777, ack 2384, win 5812, length 48
  136  18:26:59.840232 80:1f:02:ff:ca:5d (oui Unknown) > 74:d4:35:ec:64:73 (oui Unknown), ethertype IPv4 (0x0800), length 118: 172.23.15.73.49186 > legolas.ssh: Flags [P.], seq 2384:2448, ack 5777, win 507, length 64
  137  18:26:59.840266 74:d4:35:ec:64:73 (oui Unknown) > 80:1f:02:ff:ca:5d (oui Unknown), ethertype IPv4 (0x0800), length 54: legolas.ssh > 172.23.15.73.49186: Flags [.], ack 2448, win 5812, length 0
  138  18:26:59.841667 74:d4:35:ec:64:73 (oui Unknown) > 80:1f:02:ff:ca:5d (oui Unknown), ethertype IPv4 (0x0800), length 118: legolas.ssh > 172.23.15.73.49186: Flags [P.], seq 5777:5841, ack 2448, win 5812, length 64
  139  18:26:59.846937 80:1f:02:ff:ca:5d (oui Unknown) > 74:d4:35:ec:64:73 (oui Unknown), ethertype IPv4 (0x0800), length 118: 172.23.15.73.49186 > legolas.ssh: Flags [P.], seq 2448:2512, ack 5841, win 507, length 64
  140  18:26:59.846953 74:d4:35:ec:64:73 (oui Unknown) > 80:1f:02:ff:ca:5d (oui Unknown), ethertype IPv4 (0x0800), length 54: legolas.ssh > 172.23.15.73.49186: Flags [.], ack 2512, win 5812, length 0
  141  18:26:59.853267 74:d4:35:ec:64:73 (oui Unknown) > 80:1f:02:ff:ca:5d (oui Unknown), ethertype IPv4 (0x0800), length 262: legolas.ssh > 172.23.15.73.49186: Flags [P.], seq 5841:6049, ack 2512, win 5812, length 208
  142  18:26:59.861484 80:1f:02:ff:ca:5d (oui Unknown) > 74:d4:35:ec:64:73 (oui Unknown), ethertype IPv4 (0x0800), length 118: 172.23.15.73.49186 > legolas.ssh: Flags [P.], seq 2512:2576, ack 6049, win 512, length 64
  143  18:26:59.868376 74:d4:35:ec:64:73 (oui Unknown) > 80:1f:02:ff:ca:5d (oui Unknown), ethertype IPv4 (0x0800), length 486: legolas.ssh > 172.23.15.73.49186: Flags [P.], seq 6049:6481, ack 2576, win 5812, length 432
  144  18:26:59.877736 80:1f:02:ff:ca:5d (oui Unknown) > 74:d4:35:ec:64:73 (oui Unknown), ethertype IPv4 (0x0800), length 118: 172.23.15.73.49186 > legolas.ssh: Flags [P.], seq 2576:2640, ack 6481, win 510, length 64
  145  18:26:59.918857 74:d4:35:ec:64:73 (oui Unknown) > 80:1f:02:ff:ca:5d (oui Unknown), ethertype IPv4 (0x0800), length 54: legolas.ssh > 172.23.15.73.49186: Flags [.], ack 2640, win 5812, length 0
  146  18:26:59.950470 80:1f:02:ff:ca:5d (oui Unknown) > 74:d4:35:ec:64:73 (oui Unknown), ethertype IPv4 (0x0800), length 118: 172.23.15.73.49186 > legolas.ssh: Flags [P.], seq 2640:2704, ack 6481, win 510, length 64
  147  18:26:59.950563 74:d4:35:ec:64:73 (oui Unknown) > 80:1f:02:ff:ca:5d (oui Unknown), ethertype IPv4 (0x0800), length 54: legolas.ssh > 172.23.15.73.49186: Flags [.], ack 2704, win 5812, length 0
  148  18:27:00.083719 80:1f:02:ff:ca:5d (oui Unknown) > 74:d4:35:ec:64:73 (oui Unknown), ethertype IPv4 (0x0800), length 118: 172.23.15.73.49186 > legolas.ssh: Flags [P.], seq 2704:2768, ack 6481, win 510, length 64
  149  18:27:00.083810 74:d4:35:ec:64:73 (oui Unknown) > 80:1f:02:ff:ca:5d (oui Unknown), ethertype IPv4 (0x0800), length 54: legolas.ssh > 172.23.15.73.49186: Flags [.], ack 2768, win 5812, length 0
  150  18:27:00.084282 74:d4:35:ec:64:73 (oui Unknown) > 80:1f:02:ff:ca:5d (oui Unknown), ethertype IPv4 (0x0800), length 102: legolas.ssh > 172.23.15.73.49186: Flags [P.], seq 6481:6529, ack 2768, win 5812, length 48
  151  18:27:00.090212 80:1f:02:ff:ca:5d (oui Unknown) > 74:d4:35:ec:64:73 (oui Unknown), ethertype IPv4 (0x0800), length 118: 172.23.15.73.49186 > legolas.ssh: Flags [P.], seq 2768:2832, ack 6529, win 510, length 64
  152  18:27:00.090305 74:d4:35:ec:64:73 (oui Unknown) > 80:1f:02:ff:ca:5d (oui Unknown), ethertype IPv4 (0x0800), length 54: legolas.ssh > 172.23.15.73.49186: Flags [.], ack 2832, win 5812, length 0
  153  18:27:00.091572 74:d4:35:ec:64:73 (oui Unknown) > 80:1f:02:ff:ca:5d (oui Unknown), ethertype IPv4 (0x0800), length 118: legolas.ssh > 172.23.15.73.49186: Flags [P.], seq 6529:6593, ack 2832, win 5812, length 64
  154  18:27:00.094966 74:d4:35:ec:64:73 (oui Unknown) > 80:1f:02:ff:ca:5d (oui Unknown), ethertype IPv4 (0x0800), length 143: legolas.51720 > ro-dc4.romania.luxoft.com.domain: 35923+ [1au] PTR? 2.0.0.0.1.0.0.0.0.0.0.0.0.0.0.0.0.0.0.0.0.0.0.0.0.0.0.0.2.0.f.f.ip6.arpa. (101)
  155  18:27:00.095919 80:1f:02:ff:ca:5d (oui Unknown) > 74:d4:35:ec:64:73 (oui Unknown), ethertype IPv4 (0x0800), length 207: ro-dc4.romania.luxoft.com.domain > legolas.51720: 35923 NXDomain 0/1/1 (165)
  156  18:27:00.096187 74:d4:35:ec:64:73 (oui Unknown) > 80:1f:02:ff:ca:5d (oui Unknown), ethertype IPv4 (0x0800), length 132: legolas.51720 > ro-dc4.romania.luxoft.com.domain: 35923+ PTR? 2.0.0.0.1.0.0.0.0.0.0.0.0.0.0.0.0.0.0.0.0.0.0.0.0.0.0.0.2.0.f.f.ip6.arpa. (90)
  157  18:27:00.096865 80:1f:02:ff:ca:5d (oui Unknown) > 74:d4:35:ec:64:73 (oui Unknown), ethertype IPv4 (0x0800), length 196: ro-dc4.romania.luxoft.com.domain > legolas.51720: 35923 NXDomain 0/1/0 (154)
  158  18:27:00.101363 80:1f:02:ff:ca:5d (oui Unknown) > 74:d4:35:ec:64:73 (oui Unknown), ethertype IPv4 (0x0800), length 118: 172.23.15.73.49186 > legolas.ssh: Flags [P.], seq 2832:2896, ack 6593, win 510, length 64
  159  18:27:00.101450 74:d4:35:ec:64:73 (oui Unknown) > 80:1f:02:ff:ca:5d (oui Unknown), ethertype IPv4 (0x0800), length 54: legolas.ssh > 172.23.15.73.49186: Flags [.], ack 2896, win 5812, length 0
  160  18:27:00.117895 74:d4:35:ec:64:73 (oui Unknown) > 80:1f:02:ff:ca:5d (oui Unknown), ethertype IPv4 (0x0800), length 294: legolas.ssh > 172.23.15.73.49186: Flags [P.], seq 6593:6833, ack 2896, win 5812, length 240
  161  18:27:00.126495 80:1f:02:ff:ca:5d (oui Unknown) > 74:d4:35:ec:64:73 (oui Unknown), ethertype IPv4 (0x0800), length 118: 172.23.15.73.49186 > legolas.ssh: Flags [P.], seq 2896:2960, ack 6833, win 509, length 64
  162  18:27:00.166886 74:d4:35:ec:64:73 (oui Unknown) > 80:1f:02:ff:ca:5d (oui Unknown), ethertype IPv4 (0x0800), length 54: legolas.ssh > 172.23.15.73.49186: Flags [.], ack 2960, win 5812, length 0
  163  18:27:00.182210 74:d4:35:ec:64:73 (oui Unknown) > 80:1f:02:ff:ca:5d (oui Unknown), ethertype IPv4 (0x0800), length 134: legolas.ssh > 172.23.15.73.49186: Flags [P.], seq 6833:6913, ack 2960, win 5812, length 80
  164  18:27:00.183139 74:d4:35:ec:64:73 (oui Unknown) > 80:1f:02:ff:ca:5d (oui Unknown), ethertype IPv4 (0x0800), length 150: legolas.ssh > 172.23.15.73.49186: Flags [P.], seq 6913:7009, ack 2960, win 5812, length 96
  165  18:27:00.184014 74:d4:35:ec:64:73 (oui Unknown) > 80:1f:02:ff:ca:5d (oui Unknown), ethertype IPv4 (0x0800), length 182: legolas.ssh > 172.23.15.73.49186: Flags [P.], seq 7009:7137, ack 2960, win 5812, length 128
  166  18:27:00.184139 74:d4:35:ec:64:73 (oui Unknown) > 80:1f:02:ff:ca:5d (oui Unknown), ethertype IPv4 (0x0800), length 102: legolas.ssh > 172.23.15.73.49186: Flags [P.], seq 7137:7185, ack 2960, win 5812, length 48
  167  18:27:00.185016 74:d4:35:ec:64:73 (oui Unknown) > 80:1f:02:ff:ca:5d (oui Unknown), ethertype IPv4 (0x0800), length 118: legolas.ssh > 172.23.15.73.49186: Flags [P.], seq 7185:7249, ack 2960, win 5812, length 64
  168  18:27:00.185105 74:d4:35:ec:64:73 (oui Unknown) > 80:1f:02:ff:ca:5d (oui Unknown), ethertype IPv4 (0x0800), length 102: legolas.ssh > 172.23.15.73.49186: Flags [P.], seq 7249:7297, ack 2960, win 5812, length 48
  169  18:27:00.185950 74:d4:35:ec:64:73 (oui Unknown) > 80:1f:02:ff:ca:5d (oui Unknown), ethertype IPv4 (0x0800), length 102: legolas.ssh > 172.23.15.73.49186: Flags [P.], seq 7297:7345, ack 2960, win 5812, length 48
  170  18:27:00.186055 74:d4:35:ec:64:73 (oui Unknown) > 80:1f:02:ff:ca:5d (oui Unknown), ethertype IPv4 (0x0800), length 102: legolas.ssh > 172.23.15.73.49186: Flags [P.], seq 7345:7393, ack 2960, win 5812, length 48
  171  18:27:00.189570 80:1f:02:ff:ca:5d (oui Unknown) > 74:d4:35:ec:64:73 (oui Unknown), ethertype IPv4 (0x0800), length 60: 172.23.15.73.49186 > legolas.ssh: Flags [.], ack 7009, win 508, length 0
  172  18:27:00.190196 80:1f:02:ff:ca:5d (oui Unknown) > 74:d4:35:ec:64:73 (oui Unknown), ethertype IPv4 (0x0800), length 60: 172.23.15.73.49186 > legolas.ssh: Flags [.], ack 7185, win 507, length 0
  173  18:27:00.190399 80:1f:02:ff:ca:5d (oui Unknown) > 74:d4:35:ec:64:73 (oui Unknown), ethertype IPv4 (0x0800), length 60: 172.23.15.73.49186 > legolas.ssh: Flags [.], ack 7297, win 507, length 0
  174  18:27:00.190853 80:1f:02:ff:ca:5d (oui Unknown) > 74:d4:35:ec:64:73 (oui Unknown), ethertype IPv4 (0x0800), length 60: 172.23.15.73.49186 > legolas.ssh: Flags [.], ack 7393, win 507, length 0
  175  18:27:00.236015 80:1f:02:ff:ca:5d (oui Unknown) > 74:d4:35:ec:64:73 (oui Unknown), ethertype IPv4 (0x0800), length 118: 172.23.15.73.49186 > legolas.ssh: Flags [P.], seq 2960:3024, ack 7393, win 507, length 64
  176  18:27:00.236086 74:d4:35:ec:64:73 (oui Unknown) > 80:1f:02:ff:ca:5d (oui Unknown), ethertype IPv4 (0x0800), length 54: legolas.ssh > 172.23.15.73.49186: Flags [.], ack 3024, win 5812, length 0
  177  18:27:00.421120 80:1f:02:ff:ca:5d (oui Unknown) > 74:d4:35:ec:64:73 (oui Unknown), ethertype IPv4 (0x0800), length 118: 172.23.15.73.49186 > legolas.ssh: Flags [P.], seq 3024:3088, ack 7393, win 507, length 64
  178  18:27:00.421192 74:d4:35:ec:64:73 (oui Unknown) > 80:1f:02:ff:ca:5d (oui Unknown), ethertype IPv4 (0x0800), length 54: legolas.ssh > 172.23.15.73.49186: Flags [.], ack 3088, win 5812, length 0
  179  18:27:00.421344 74:d4:35:ec:64:73 (oui Unknown) > 80:1f:02:ff:ca:5d (oui Unknown), ethertype IPv4 (0x0800), length 102: legolas.ssh > 172.23.15.73.49186: Flags [P.], seq 7393:7441, ack 3088, win 5812, length 48
  180  18:27:00.426313 80:1f:02:ff:ca:5d (oui Unknown) > 74:d4:35:ec:64:73 (oui Unknown), ethertype IPv4 (0x0800), length 118: 172.23.15.73.49186 > legolas.ssh: Flags [P.], seq 3088:3152, ack 7441, win 512, length 64
  181  18:27:00.426386 74:d4:35:ec:64:73 (oui Unknown) > 80:1f:02:ff:ca:5d (oui Unknown), ethertype IPv4 (0x0800), length 54: legolas.ssh > 172.23.15.73.49186: Flags [.], ack 3152, win 5812, length 0
  182  18:27:00.427119 74:d4:35:ec:64:73 (oui Unknown) > 80:1f:02:ff:ca:5d (oui Unknown), ethertype IPv4 (0x0800), length 118: legolas.ssh > 172.23.15.73.49186: Flags [P.], seq 7441:7505, ack 3152, win 5812, length 64
  183  18:27:00.432805 80:1f:02:ff:ca:5d (oui Unknown) > 74:d4:35:ec:64:73 (oui Unknown), ethertype IPv4 (0x0800), length 118: 172.23.15.73.49186 > legolas.ssh: Flags [P.], seq 3152:3216, ack 7505, win 512, length 64
  184  18:27:00.432888 74:d4:35:ec:64:73 (oui Unknown) > 80:1f:02:ff:ca:5d (oui Unknown), ethertype IPv4 (0x0800), length 54: legolas.ssh > 172.23.15.73.49186: Flags [.], ack 3216, win 5812, length 0
  185  18:27:00.439105 74:d4:35:ec:64:73 (oui Unknown) > 80:1f:02:ff:ca:5d (oui Unknown), ethertype IPv4 (0x0800), length 262: legolas.ssh > 172.23.15.73.49186: Flags [P.], seq 7505:7713, ack 3216, win 5812, length 208
  186  18:27:00.446196 80:1f:02:ff:ca:5d (oui Unknown) > 74:d4:35:ec:64:73 (oui Unknown), ethertype IPv4 (0x0800), length 118: 172.23.15.73.49186 > legolas.ssh: Flags [P.], seq 3216:3280, ack 7713, win 511, length 64
  187  18:27:00.453902 74:d4:35:ec:64:73 (oui Unknown) > 80:1f:02:ff:ca:5d (oui Unknown), ethertype IPv4 (0x0800), length 390: legolas.ssh > 172.23.15.73.49186: Flags [P.], seq 7713:8049, ack 3280, win 5812, length 336
